Code,Title,Credits,Description
ANC290,Mechanics of Movement for Dancers,3,"Course Descriptions 
 
215 
Degree Index      Table of Contents 
Focusing on human skeletal and muscular anatomy and its 
relationship to movement skills and postural alignment, the 
course will analyze gravity and its effect on posture and 
muscular function"
ANC350,Dance Workshop III,1,"Explores various dance styles through the preparation and 
performance of solo and group dance"
ANC360,"Musical Theatre Dance Composition &  
Choreography",2,"Through Musical theatre repertoire, the performer will 
examine the structure of stage choreography through dance 
theme, construction of dances and small group studies"
ANC370,Dance Composition & Choreography,2,"Selection of dance theme, construction of dances and small 
group studies"
CON301,Economics of Money & Banking,3,"Course Descriptions 
 
216 
Degree Index      Table of Contents 
Definition and role of money in the economy: classical, 
Keynesian and modern views will be covered"
CON302,Financial Markets & Institutions,3,"The course provides a comprehensive view of how financial 
markets and institutions function"
CON303,Quantitative Methods in Economics,3,"The course focuses on the basic mathematical and statistical 
concepts used in economic analysis, including various ways 
economic information can be graphed to show issues such 
as income and wealth distribution"
CON305,Political Economy,3,"Analysis of government from an economic perspective 
through the lens of public choice theory, with emphasis on 
rent-seeking behavior, market distorting effects of 
government regulation and inefficiencies in collective 
decision-making"
CON310,Public Finance,3,"Topics 
include 
principles 
of 
fiscal 
development, 
countercyclical effectiveness of fiscal measures, budgeting, 
revenue generation and public expenditures, debt structure 
and management, and the incidence and effects of taxation"
CON315,Globalization,3,"The structure and effects of global economic, political, and 
cultural integration, and the mechanisms of international 
governance  Students who have taken PSCI 315 may not 
take this course for credit (Prerequisite: one prior PSCI or 
ECON course) Offered as needed"
CON317,"Collective Bargaining & Labor  
Problems",3,"Economic factors involved in labor analysis and an 
examination of the topics of labor unrest, labor and 
management organizations and recent developments in labor 
relations"
CON319,International Economics,3,"Topics include the balance of payments, comparative costs, 
general equilibrium theory, price elasticity, income 
absorption combined approaches to currency revaluation 
and devaluation problems, foreign exchange problems, and 
international trade and finance policy considerations"
CON320,Intermediate Macroeconomics,3,"Aggregate economic theory of consumption, investment, 
savings, money, interest,  price level and economic growth, 
and fluctuations of national income and employment"
CON321,Intermediate Microeconomics,3,"The focus of the course is efficient resource allocation using 
advanced analytical economic tools"
CON322,Econometrics,3,"The construction of economic models using mathematical 
techniques for the purpose of testing economic theory 
empirically and forecasting economic events"
CON325,Behavioral Economics,3,"The study of emotional, cognitive, and psychological 
influences on decision making"
CON401,Capstone: Senior Research,2,"Course Descriptions 
 
217 
Degree Index      Table of Contents 
Independent study on an economic topic approved by the 
department, requiring preparation of a well-researched 
paper, under the supervision of an economics department 
faculty member"
NGL151,Publications Activities,1,"Basics of writing, editing, and producing student 
publications, both print and online, including the student 
newspaper and literary magazine"
udents,ENGL231.  Issues in Writing Studies,3,"An introduction to the theories and issues of writing studies, 
including rhetoric, language, literacy, and professional 
writing"
NGL240,Special Topics in Writing,3,An exploration of different topics in writing studies
NGL303,Advanced Writing,3,"Advanced writing experience and study focusing on the 
genre of creative nonfiction and professional texts"
NGL304,Advanced Creative Writing: Poetry,3,Advanced writing experience focusing on poetry
NGL305,Advanced Creative Writing: Fiction,3,Advanced writing experience focusing on fiction
NGL306,Advanced Creative Writing: Drama,3,Advanced writing experience focusing on drama
NGL310,Teaching Writing,3,For K-12+ prospective teachers of English
NGL330,Advanced Topics in Literature,3,"An advanced study of literature and cultural contexts 
designed around a theme or topic"
NGL332,English Language,3,"A study of the form, structure and history of English"
NGL352,Shakespeare,3,"A selection of Shakespeare’s plays including comedies, 
tragedies, histories and or romances"
NGL368,"Intermediate Studies in American 
Literature",3,"(Humanities) 
Why is literature important?  How does it shape our world?  
Through an in-depth exploration of American literature in 
historical context, students will pursue a focused study of 
significant works, genres, or movements"
NGL402,Capstone,3,"Examination and practice of research and project design in 
English Studies"
NGL499,Advanced Experimental Course,3,"Courses in Business Administration-  
Entrepreneurial  Studies (ENTR) 
 
ENTR199"
NTR250,Fundamentals of Entrepreneurship,3,"Examines the role and develops the basic skill set of the 
entrepreneur in both start-up companies and more mature 
organizations"
NTR251,Entrepreneurial Speaker Series,1,"Students will travel to the University of Michigan to attend 
their speaker series every Friday (transportation provided)"
NTR351,The Entrepreneurial Experience,3,"An experiential based course providing opportunities to 
apply and refine the fundamental skills of entrepreneurship"
NTR352,Evolution of Entrepreneurship,3,A journey through the evolution of entrepreneurship
NTR455,Entrepreneurial Practicum,3,"This one semester supervised practicum in an approved 
entrepreneurial setting will connect and apply knowledge 
and techniques from multiple business, accounting and other 
courses to an entrepreneurial venture"
SAT101,Physical Education Activities,1,"The fundamental skills and techniques of various activities 
which students may select"
SAT103,Foundations & Careers in ESAT,2,"Relationships among physical education, sport and 
recreation through history, including principles, objectives 
and programs"
SAT218,Rhythmic Activities,1,"The development of rhythmic movement principles taught 
in the elementary and secondary schools"
SAT222,"Instructional Methods in Physical  
Education",3,"Designed to provide experiences which will assist physical 
education majors and minors select developmentally 
appropriate 
motor 
activities, 
develop 
instructional 
materials, develop assessment techniques and management 
skills"
SAT225,Human Anatomy,3,An introduction to gross anatomical structure
SAT226,Human Anatomy Lab,1,"A one semester survey of the structures of the human body, 
including dissections and discussions of cells, tissues, 
organs and systems"
SAT230,Motor Learning & Development,3,"Examination of motor skill acquisition and application to 
skill performance"
SAT236,Sports Technique I,2,"Based on the Michigan Department of Education 
framework for invasion games and target games"
SAT238,Sports Technique III,2,"Based on the Michigan Department of Education 
framework for rhythmic activities and fitness activities"
eshmen,ESAT240.  Introduction to Research,3,"An introduction to research  methods as they apply to 
qualitative and quantitative design in exercise science"
SAT246,Lifetime Fitness,3,"Candidates will design, implement and instruct health and 
skill related fitness activities including functional strength 
and conditioning, rhythmic activities, cardiovascular group 
fitness, acquiring motor skills, knowledge and structured 
learning experiences to perform and teach in the P-12 
school systems"
SAT247,Organizational Sports,2,"Based on the Michigan Department of Education 
framework for invasion, net wall, target games and 
striking/fielding games for teacher candidates will acquire 
skills, knowledge, strategies, and rules wit practical 
experiences playing, teaching, skills, drills and games"
SAT250,Human Physiology,3,"Introduction to physiological mechanisms which govern 
systemic organ function"
SAT256,Human Physiology Lab,1,"A one-semester survey of physiological concepts and 
functions via experimentation"
SAT300,Kinesiology,3,"The theory and practical application of basic facts, laws, 
principles and concepts of biomechanical movement, with 
attention given to the physiological and anatomical study of 
muscles"
SAT302,Organization of Intramurals,2,"The organization of a comprehensive intramural program, 
with major emphasis on philosophy, objectives, rules and 
policies, scheduling, reporting and promotional techniques"
SAT304,"Teaching Program Design of Strength &  
Conditioning",2,"Candidates will design, implement and instruct a functional 
strength and conditioning class for high school"
SAT309,Theory & Practice,1,"Practical application of methods and techniques of teaching 
physical education activities"
SAT310,Introduction to Phlebotomy,3,"Students will learn how to perform phlebotomy by safely 
acquiring blood samples from the arm and hand using 
vacutainer, syringe, and butterfly methods"
SAT311,Exercise Physiology,3,"A physiological examination of how the body responds and 
adapts to exercise"
SAT312,Sports Nutrition,3,"The study of the metabolic and physiological responses of 
the body to diet including the acute and chronic effects of 
sports 
nutrition 
and 
supplementation 
on 
physical 
Course Descriptions 
 
221 
Degree Index      Table of Contents 
performance"
SAT316,"Health & Physical Education for the  
Classroom Teacher",3,"This course will provide elementary classroom teachers with 
the opportunity to develop the functional knowledge, skills 
and behaviors to enhance students’ current health and 
physical activity as well as to develop life-long healthy 
lifestyles"
SAT333,Adapted Physical Education,2,"Practical approach to instruction of physical activity for 
special populations of diverse learners"
SAT339,Principles of Strength & Conditioning,3,"Integrates scientific principles, concepts, and theories of 
exercise to improve the condition of the physically active"
SAT350,Exercise Physiology Lab,1,This lab class accompanies the exercise physiology lecture
SAT360,Exercise and the Brain,2,"The effects of exercise on cognitive function, energy 
balance, addiction, mood disorders and neurodegenerative 
diseases (Prerequisite: ESAT250)"
SAT402,"Capstone: Administration of Physical  
Education & Sport",3,"Capstone class for the physical education major emphasizes 
administration, program and curriculum design of physical 
education and physical activity programs including 
collaborative partnerships within the public schools and 
surrounding communities"
SAT404,Capstone: Senior Seminar,2,"Each student develops a research project, uses the 
appropriate methods and statistical tools, and analyzes data"
SAT481,Internship Seminar,1,"Course to be taken with ESAT399, this course is designed 
to maximize the experiences learned through the 
professional internship"
ESS104,Regional Geography,3,An introduction to the geographic regions of the world
ESS110,Introduction to Environmental Science,3,"Introductory overview of topics in environmental science 
and studies, exploring the intersection of people and their 
biotic and abiotic environment"
ESS201,Weather & Climate,3,"Introduces the nature and causes of weather and climate 
patterns"
ESS205,Environmental Geology,4,"The interaction between natural systems and society, 
including the effects of volcanic activity, earthquakes, 
landslides, 
mineral 
and 
energy 
resources, 
soil 
contamination, surface and ground water pollution, waste 
management, and climate change"
ESS305,Paleoclimatology,2,"Earth’s climate through geologic time, including the 
analysis of data and data repositories that record climate 
and their application to understanding climate history and 
modern climate change"
ESS325,Environmental Problems & Solutions,3,"An investigation of current environmental problems and 
possible solutions offered from different perspectives"
ESS375,"Geographic Information & Positioning  
Systems",4,"Historical perspective of how maps are made and global 
positions determined and the current means of employing 
computer and satellite technology using geographic 
information systems (GIS) and global positioning systems 
(GPS)"
ESS400,Capstone: Senior Research,2,"Original capstone research designed and carried out by 
student"
ESS401,Capstone: Research Presentation,1,"Analysis, write up and presentation of results of research 
carried out in ESS400"
VNT290,Event Planning Principles,3,Overview of the event industry
VNT390,"Event Production & Operations  
Management",3,Each event creates unique production issues
VNT391,Event Risk Management,3,Risk is inherent anytime people gather for an event
VNT392,Convention & Trade Show Operations,3,"The study of the convention and trade show segment of 
event industry operations offers a unique marketing tool for 
organizations"
ASH270,Introduction to Fashion Merchandising,3,"An introduction to the fashion industry including apparel, 
footwear, and accessories"
ASH371,Textiles,3,"This course is a thorough study of the textile industry and its 
application to the apparel industry"
ASH372,"Visual Merchandising & Fashion 
Promotion",3,"This interactive approach to visual merchandising includes 
the study of display and their application to retail"
ASH373,"Product Development & Assortment  
Planning",3,"In this course students conduct an in-depth study of 
merchandising and marketing including line and product 
development, levels of quality, and costing and sourcing of 
materials"
ASH374,Evolution of Fashion,3,"A survey of the evolution of apparel and accessories from 
the Egyptian period to current fashion"
FIN110,Basic Financial Literacy,3,"Fundamental knowledge, strategies, techniques for  
personal saving, debt management and avoidance, taxation, 
consumer awareness, acquisition of insurance, purchase of 
real estate, investing and retirement planning, which can all 
be immediately implemented"
FIN310,Managerial Finance,3,"The interpretation and utilization of financial information as 
used by corporate managers in the decision-making process"
FIN311,Investments & Security Analysis,3,"Course Descriptions 
 
224 
Degree Index      Table of Contents 
Introduction to the major security exchange markets and 
related regulatory agencies, techniques for valuation of 
equity securities, bond investments and financial statement 
analysis Personal financial planning through portfolio 
development and analysis and industry and market research 
(Prerequisite: FIN310) Offered as needed"
FIN314,International Financial Management,3,"Corporations that operate in an international environment 
face significant financial challenges This course studies 
how to manage these challenges"
FIN410,Advanced Managerial Finance,3,"Advanced study of major decision-making areas of 
managerial finance, including selected topics in financial 
theory and its practical application"
needed,FIN413.  Entrepreneurial Finance,3,"This course studies how entrepreneurs obtain and use 
financial resources"
EOL301,Mineralogy,4,"Crystallography, atomic structure and bonding, phase 
equilibria and crystal chemistry, and the megascopic   
identification and descriptive mineralogy of nonsilicate and 
silicate minerals"
EOL302,Igneous & Metamorphic Petrology,4,"An introduction to the physical and chemical properties 
related to the formation of igneous and metamorphic rocks 
in different tectonic regimes"
EOL307,Structural Geology,4,"The behavior of rocks under various kinds of force, with 
analysis of resulting structural features, including folds, 
Course Descriptions 
 
225 
Degree Index      Table of Contents 
joints and faults, and the nature of the forces that produced 
them"
EOL318,Field & Laboratory Methods,4,"An introduction to geological field and laboratory 
techniques and the fundamentals of collection and 
interpretation of geologic data in field and laboratory 
settings"
EOL319,Plate Tectonics,4,"A global study of plate tectonics as a unifying solid-earth 
theory"
EOL320,US Geology Field Experience,1,"Students will research, give an oral presentation, and write 
an abstract on a specific geologic location in the US"
EOL321,"Contaminated Soil & Groundwater: 
Assessment & Remediation",4,"Principles of contaminant behavior in soil and groundwater 
systems and the application of assessment and remedial 
techniques to address environmental problems"
EOL322,Petroleum Geology,3,"Lecture and laboratory exercises concerning the origin, 
migration, and accumulation of oil and natural gas in the 
Earth’s crust and the techniques for surface, subsurface, and 
geophysical exploration of petroleum resources"
EOL403,Capstone: Senior Research,2,"Independent library research on a geologic topic approved 
by the department"
HCA100,The History of Public Health,3,"The role of public health and governance has fundamentally 
shaped human societies  In this course, students will learn 
the role of the state in ensuring favorable public health 
outcomes  Students will also learn the importance of public 
health, understand how it provided, and learn how it is 
practiced  The course is intended to introduce students to 
the field of public health; it is intended to be broadly 
accessible to all students and provide a practical 
understanding of the field"
HCA161,"Introduction to Emergency and Disaster 
Management",3,"This course will provide students with an introduction to 
emergency and disaster management and the theories and 
legal frameworks that drive the field"
HCA200,Health Economics,3,"Health Economics is the application of economics to health 
care in support of the public good"
HCA201,Biostatistics,3,"The course represents an introduction to the field of 
biostatistics and provides a survey of data and data types"
HCA262,Socio-Economic Dimensions of Disasters,3,"This course focuses on the ways in which socio-economic 
features impact disaster planning, response and recovery"
HCA281,Introduction to Health Care in the U.S.,3,"This course introduces current methods of delivering health 
care"
HCA282,Health Clinic Operations & Observation,1,"Course includes concepts relevant for a clinical practice 
such as patient experience, revenue cycle, HIPAA, 
insurance, HER, risk, safety, regulatory standards, and 
testing  Course also offers students a medical clinical 
observation experience Open to freshmen"
HCA287,Health Education and Communication,3,"This course will focus on using health education to influence 
and inform health decisions for individuals, communities 
and populations"
HCA290,Health Services,3,"This content will include the way healthcare is provided; the 
history of healthcare in high, middle and low income 
countries; and the evolution, structure, and function of 
healthcare services; both domestically and abroad"
HCA300,Epidemiology,3,"Epidemiology is the branch of medicine that deals with the 
incidence, distribution, and control of a disease"
HCA301,Health Economics,3,"Health economics is the application of economics to health 
care in support of public good"
HCA363,"Emergency and Disaster Management 
Planning",3,"Emergency 
and 
Disaster 
Management 
Planning 
dramatically 
enhances 
community 
resilience 
and 
sustainability by reducing the risks from natural and man-
made hazards"
HCA381,Financing Health Care,3,"This course examines the current systems of financing 
health care, the factors affecting them, and how they drive 
transformational change"
HCA383,Health Care Outcomes & Quality,3,"Course will address the manager’s role and approaches to 
quality improvement in both patient care and management 
of services in healthcare organizations"
HCA385,"Health & Society: Introduction To Public  
Health",3,"Course introduces a population-based perspective on health 
and health care management"
HCA386,Health Care Management Practicum I,3,"This course provides exposure to health care management 
experiences, aiming to develop job-related skills through 
contact with industry professionals"
HCA400,"Public Health Studies I: Current Topics and 
Politics",3,"This course allows students to evaluate the health impact of 
political decisions"
HCA401,"Public Health Studies II: Demographics, 
Geospatial Mapping, and Qualitative Research",3,"This course provides students with a variety of tools for 
understanding the impact that disease other Public Health 
concerns may have on a population"
HCA464,Global Health and Crisis Management,3,"This course examines the growing threat and potential 
consequences of disasters by examining the complexities 
of public health and humanitarian crises and studying 
emerging health security threats"
HCA465,Post Disaster Resilience and Recovery,3,"This course will examine the current state of disaster 
resilience and recovery"
HCA480,Health Care Transformation,3,"Concepts associated with change management, emotional 
intelligence, knowledge management, and a heightened 
patient experience will be considered as students explore 
new ways to lead in a transforming health care industry"
HCA486,Health Care Management Practicum II,3,"This is an experiential learning course built around problem 
solving projects within health care organizations"
IST205,The Novel as History,1,"A study of a particular novel as it relates to the historical 
events in which it is set"
IST240,Experiential Museology,3,"Students will read about issues in Museum Studies and then 
create an exhibit at the Lenawee County Historical Museum"
IST301,Topics in  History,3,"In-depth study of topics in various fields and periods of 
history"
IST303,"Fortification to Reformation: The History of  
York, England to the 15th Century",6,"A five-week interdisciplinary course centered on York 
Minster"
IST305,History of the Soviet Union,3,Rise and fall of the Soviet Union
IST321,Perspectives on Nazi Germany,3,An advanced history course examining Nazi Germany
IST361,The “American Century”,3,"An examination of the postwar American response to the 
prospect of living in an uncertain world, including political 
and cultural perspectives"
IST363,Topics in American Social History,3,"Examines the forces that shaped the lives of average 
Americans during various decades"
IST408,Senior Research Preparation,3,"Each student will produce and defend a senior theses 
prospectus, and will produce an exhaustive annotated 
bibliography to support senior research"
IST409,Senior Research Capstone,3,"Research seminar on selected problems in American, Asian, 
European or Comparative History"
ONR101,Honors Colloquium,1,"Combines academic and experiential learning and 
emphasizes academic excellence and respect for human 
dignity"
ONR301,Advanced Honors Colloquium,1,"A seminar that draws on readings from the great books of 
western and non-western civilization as well as more recent 
work"
ONR499,Honors Option,0,"This course will be taken with a College course in which the 
student is choosing to perform the Honors Option"
NTD130,Freshman Studio,3,"A studio course concentrating on drawing, sketching and 
rendering perspectives"
NTD200,Sophomore Studio,3,"A studio course giving special attention to the design 
process, research, writing, programming and presentation"
NTD221,Interior Design Materials,3,"Definition, 
environmental 
attributes, 
application, 
specification, and installation techniques of interior 
materials and textiles"
NTD222,History of Architecture & Interiors I,3,"The history of Architecture and Interiors from Antiquity 
through the 18th Century"
NTD224,History of Architecture & Interiors II,3,"History of Architecture and Interiors from the 19th Century 
through today"
NTD225,AutoCAD Architectural Basics,3,"An introduction to computer aided drafting and design or 
non-interior design majors, applicable for facilities 
management, engineering, construction management and 
landscape design"
NTD226,AutoCad,3,"An introduction to computer aided drafting and design 
specifically for the interior designer through the use of Auto 
CAD"
NTD227,Revit,3,"An introduction to computer aided drafting and design 
specifically for the interior designer through the use of 
Revit"
NTD326,Lighting,3,"A studio course exploring the elements and applications of 
lighting including electrical components, measurements, 
coloration and energy efficiency for both interior and 
exterior lighting needs"
NTD323,Residential Design I,3,A studio course designed around residential client needs
NTD327,Commercial Design I,3,A studio course designed around commercial client needs
NTD330,Residential Design II,3,A studio course designed around residential client needs
NTD331,Commercial Design II,3,A studio course designed around commercial client needs
NTD350,Special Topics in Interior Design,3,"An interdisciplinary and collaborative class exploring a 
topic related to the built environment"
NTD401,Senior Studio,3,"A studio course applying research and production of a 
project that will showcase all aspects of the design needs and 
requirements for a specific facility"
NTD408,"Professional Practices for Interior  
Designers",3,Business practices and ethics in the field of interior design
