code,name,credits,description
YMI 3240,Counseling and Communicating with Contemporary Youth ,0,"Grace College and Seminary Catalog | 2023-2025 
 
Biblical Studies Department 
9 "
YMI 3140,Cross Cultural Youth Ministry ,24,"  
Applied Learning 6 hrs 
 
 
Biblical Languages Minor 
The requirement for a minor in Intercultural Studies is 21 or 24 hours in the department, including the 
following courses: 
Option 1 (Greek Emphasis) "
GRE 1010,Greek I ,0,GRE 1020 Greek II 
GRE 2010,Greek Exegesis I ,0,GRE 2040 Greek Exegesis II 
BBL 3140,Biblical Backgrounds ,0,Choose two of the following 
BIB 3290,New Testament Bible Exposition ,0,BIB 3310 Old Testament Bible Exposition  
ICS 3110,Intercultural Communication  ,0,Option 2 (Hebrew Emphasis) 
HEB 1010,Hebrew I  ,0,HEB 1020 Hebrew II  
HEB 1030,Hebrew III ,0,HEB 2020 Hebrew Exegesis I 
BBL 3140,Biblical Backgrounds ,0,Choose two of the following: 
BIB 3290,New Testament Bible Exposition ,0,BIB 3310 Old Testament Bible Exposition  
HEB 2080,Hebrew Exegesis II ,0,"ICS 3110 Intercultural Communication 
 
Option 3 (Both Languages) "
GRE 1010,Greek I ,0,GRE 1020 Greek II 
GRE 2010,Greek Exegesis I ,0,GRE 2040 Greek Exegesis II 
HEB 1010,Hebrew I  ,0,HEB 1020 Hebrew II 
HEB 1030,Hebrew III ,0,"HEB 2020 Hebrew Exegesis I 
 
Master of Arts in Ministry Studies 
The MA in Ministry Studies is a 36-hour online program designed to provide professional and practical 
training for those who are pursuing or are already involved in church ministry. This degree will prepare 
and equip ministry leaders with the necessary personal, professional, and theological training for your 
unique Christian calling within church ministry or human services.  The program goals are designed to 
augment and support the mission of Grace College and Seminary 
 
Grace College and Seminary Catalog | 2023-2025 
 
Biblical Studies Department 
10 "
MIN 6010,Spiritual Formation ,18," 
Christian Ministry Concentration Courses: 18 Hours "
MIN 5100,Bible Study Methods ,0,MIN 5310 Ministry & Cultural Diversity 
MIN 5320,Ministry Leadership ,18,"PM 7120       Local Church Ministry in the 21st Century 
PM 5570  
Communication in Ministry 
PM 6170 
Ministry Administration 
 
Women’s Leadership Studies Concentration: 18 Hours 
The first four courses below (5110, 5360, 5600, 5820) are required and offered as weekend seminars: "
MIN 5110,     Equipping Others for Ministry ,0,MIN 5360    Women & Scripture 
MIN 5600,   Biblical Foundations of Leadership ,0,"MIN 5820    Soul Care & Leadership 
Choose two of the following: "
MIN 5100,    Bible Study Methods ,18,"MIN 5310     Ministry and Cultural Diversity 
PM 5570     Communication in Ministry 
 
Counseling Concentration Courses: 18 Hours 
PM 6160      Biblical Psychology "
MIN 5500,   Counseling Theories ,0,MIN 5700    Counseling Methods & Techniques 
MIN 5900,   Pre-Marital & Marital Counseling ,18,"MIN 6200    Counseling Common Problems 
PM 6060     Legal and Ethical Issues in Pastoral Counseling 
 
Technology Concentration Courses: 18 Hours 
PM 5180      Technology and Media in Ministry 
PM 5190      Worship Arts 
PM 6070     Creative Communication Strategies  
PM 6180      Organizational Tools 
PM 6240     Developing Tech Talent 
Grace College and Seminary Catalog | 2023-2025 
 
Biblical Studies Department 
11 "
BBL 2011,Understanding the Old Testament I ,Three,"An introduction to the Pentateuch and the Historical Books of the Old Testament with special reference 
to background, historical setting, literary composition, theology and message. After successfully 
completing this course, the student should be able to demonstrate a knowledge of background issues 
which introduce one to the study of various concepts of the Old Testament, the historical milieu of each 
Old Testament book studied, the purpose and general content of each Old Testament book studied, the 
use of the Old Testament in modern ministry, and the foundation the Old Testament provides for the 
New Testament. Three hours. 
 "
BBL 2013,Understanding the Old Testament II ,Three,"An introduction to the Poetic and Prophetic books of the Old Testament with special reference to 
background, historical setting, literary composition, theology and message. After successfully 
completing this course, the student should be able to demonstrate a knowledge of background issues 
which introduce one to the study of various concepts of the Old Testament, the historical milieu of each 
Old Testament book studied, the purpose and general content of each Old Testament book studied, the 
use of the Old Testament in modern ministry, and the foundation the Old Testament provides for the 
New Testament. Three hours. 
 "
BBL 2020,Understanding the New Testament ,Three,"This course introduces the New Testament with special reference to background, historical setting, literary 
composition, theology, and message. After successfully completing this course, the student should be able to 
demonstrate a knowledge of background issues which introduce one to the study of various concepts of the 
New Testament, the historical milieu of each New Testament book studied, the purpose and general content 
of each New Testament book studied, the relationship between the New and Old Testaments, and the use of 
the New Testament in modern ministry. Three hours. 
 "
BBL 3000,Theological Systems ,Three,"Students will explore the theological methods and presuppositions practiced by the diversity of 
theological systems. Students will seek answers to questions such as, how is presuppositional 
apologetics different from evidential apologetics. How is systematic theology different from biblical 
theology? How is dispensational theology different from covenant theology? How is reformed theology 
different from Armenian theology? How is progressive dispensationalism different from classic 
dispensationalism? Students will study the methods and presuppositions of leading theologians, from 
the Apostle Paul to the present. Prerequisite: BIB1050. This is an upper level course available to juniors 
and seniors. It is also offered at a graduate level. Three hours. 
 
Grace College and Seminary Catalog | 2023-2025 
 
Biblical Studies Department 
12 "
BBL 3010,Defining Doctrines of the Christian Faith ,Three,"Students will identify the central affirmations of Christianity that distinguish orthodoxy from heresy, 
heterodoxy, liberalism, and neo-orthodoxy. Students will be able to support each defining doctrine from 
Scripture. The role of creeds, church councils, and doctrinal statements in defining and preserving 
orthodoxy will be explored. Students will appreciate the diversity within Christian orthodoxy, while the 
central affirmations are preserved. Prerequisite: BIB1050. Three hours. 
 "
BBL 3090,Spiritual Formation ,Three,"Students will explore the various dynamics that converge to produce maturity in the life of a Christian. 
They will seek to construct a theory of spiritual formation based on a practical knowledge of God, a 
realistic awareness of self, a full-orbed understanding of pertinent scriptural insights, and a historical 
perspective of various approaches to spirituality. They will examine the necessity of the integration of 
the individual pursuit of spiritual maturity with the corporate dimension. The approach of the course will 
include practical application along with classroom discussion and outside research. Prerequisite: BIB 
2010. Three hours. 
 "
BBL 3140,Biblical Backgrounds ,Three,"Students will seek to understand how people thought, communicated, and lived in the ancient world 
during the OT, NT and Intertestamental Periods.  Special emphasis will be placed on key people groups 
and political, cultural, theological, and literary developments that form the background to the Bible.  
Students will learn to use insights from geography, cultural anthropology, archaeology, sociology, 
philosophy, politics, literature, and history for the interpretation of Scripture in light of the history and 
culture of the people to whom it was addressed.  Three hours. 
 "
BBL 4310,Women and Scripture ,Three,"Students will explore the various roles women played in the OT against the backdrop of the ancient 
world. They will investigate ways that Jesus elevated the status of women and how NT passages 
describe the function of women within the Christian community. Using modern theories on the role of 
women—hierarchical, complementarian, and egalitarian—students will seek to define a biblical 
approach to contemporary questions about the role of women. Three hours. 
 "
BBL 4810,Senior Seminar  ,Three,"This course is designed to facilitate senior level students in the application of theory to ministry practice. 
The learner will be challenged to integrate biblical/theological knowledge gained in a variety of courses 
together with specialized research that pertains to specific ministry issues. Three hours. 
 "
BIB 1050,Exploring the Bible ,Three,"A general overview of the Bible which orients the student to the overall presentation of the program of 
God from the Creation through the Consummation of Christ. Emphasis will be placed on the themes, 
timeline, structure, and coherence of the entire Biblical revelation. This course is required in the liberal 
arts core curriculum. Three hours. 
 "
BIB 2010,Scripture and Interpretation ,0,"Foundational principles of effective Bible study will be applied for personal study and small group Bible 
study leadership. Observational skills of the English text will be developed through hands-on activities 
and assignments. Hermeneutical principles will be applied to various biblical genres with the goal of 
equipping the learner to interpret the text based on its historical/cultural and literary context. 
Grace College and Seminary Catalog | 2023-2025 
 
Biblical Studies Department 
13 "
BIB 2050,Understanding and Engaging Culture ,Three,"This course examines culture.  It explores the roots of culture as a foundational and overarching 
expression of humanities vocations as “imaging” of God in Scripture. The subsequent harmonies and 
dissonances between historical expressions of culture and Christianity are analyzed and discussed.  Also, 
contemporary expressions of popular digital culture, film, video and music, will be selectively surveyed 
with an eye to developing the capacity to constructively and critically engage culture as 
Christians.  Three hours. 
 "
BIB 2090,Contemporary Issues ,Three,"Students will interact with controversial issues facing young Christians, weighing carefully biblical and 
ethical criteria for those issues. Careful distinction will be made between explicit biblical teaching, 
traditional Christian practices, and personal convictions. Typical issues to be analyzed in the course 
include: decision making and the will of God, spiritual gifts, gender issues, media and culture, sexuality 
and alternative lifestyles. Three hours. 
 "
BIB 2140,Evangelism and Discipleship ,Three,"Students will explore foundational issues for developing an approach to evangelism. Questions that will be 
considered include: What constitutes true conversion? Is becoming a Christian a process or an event? What 
about lordship salvation? What is the relationship between evangelism and the sovereignty of God? How do 
trends and needs in society shape a strategy for evangelism? Second, students will examine various methods 
of evangelism, for example, lifestyle evangelism. Third, students will study the concept and methods of 
discipleship as an integral part of evangelism.. Three hours. 
 "
BIB 2310,History of Christianity ,Three,"Students will seek to discover what transpired in Christianity from the 1st century to modern times in 
order to understand what Christianity is in the present. They will identify the major events, 
personalities, and theological issues, both Western and non-Western, that shaped the development of 
Christianity. They will appreciate the challenges that the church faced as it matured in history, and they 
will gain perspective on the challenges still facing the church today. Prerequisite: BIB1050. This is an 
upper level course available to juniors and seniors. It is also offered at a graduate level. Three hours. 
 "
BIB 3290,New Testament Exposition ,Three,"Foundational principles of effective Bible study will be applied for personal study and small group Bible 
study leadership. Observational skills of the English text of the New Testament will be developed 
through hands-on activities and assignments. Hermeneutical principles will be applied to various biblical 
genres with the goal to equip the learner to interpret the text based on its historical/cultural and literary 
context. Application of the meaning of the text for spiritual formation will be emphasized as well. 
Prerequisites: BIB1050, BIB2010, and BBL2020. Three hours. 
 "
BIB 3300,Essential Doctrinal Themes ,Three,"An overview of the essential doctrines every Christian should know and be able to articulate and defend. 
This course will focus on allowing students to engage in collaborative exercises to challenge their 
thinking and solidify their faith.  This course is required in the liberal arts core curriculum. Three hours. 
 "
BIB 3310,Old Testament Exposition ,0,"Grace College and Seminary Catalog | 2023-2025 
 
Biblical Studies Department 
14 "
BIB 4060,Expository Preaching and Teaching ,Three,"This course combines both theory and practice. It introduces a functional methodology of organizing 
and developing the elements of a sermon. It examines issues of bridging exegesis and exposition as well 
as the application of biblical truth and the effective delivery to listeners. Approximately one-third of the 
course is devoted to a lab setting where lessons and sermons are video-recorded and critiqued. 
Prerequisites: COM1100, BIB1050 and BIB2010. Three hours. 
 
 
Educational Ministries "
BBL 2030,Foundations of Educational Ministry ,0,"This course exposes students to learning theories and educational practices that can be applied to 
ministry settings. Learning theories help teachers understand how humans acquire new knowledge and 
embrace truth for transformational life change. This course will address not only inner processes that 
bring about growth, but also the environmental and social influences that can either promote or hinder 
wholistic learning that results in biblical wisdom. 
 "
BBL 2040,Foundations of Ministry Leadership ,0,"This course looks at the life of Jesus to learn from Him as the Master Teacher, Leader and Discipler. 
Students will explore Scripture and the lives of other godly men and women to gain a composite picture 
of leadership that addresses heart issues in the lives of people they will lead. Leadership from a biblical 
perspective will be countercultural and address issues of pride vs. humility, how we view failure/success 
and taking initiative in a Spirit-driven process. Students will have the opportunity for hands on 
integration of theory with practice as they process the course concepts in life with others in a relational 
context of ministry. "
BBL 2050, Relational Skills for Ministry ,0," Theoretical principles of interpersonal communication and conflict management skills will be applied to 
ministry settings in order to equip the learner to work more effectively with a variety of people in 
diverse settings. Through course material, individual reflection, and small group experiences, learners 
will explore the biblical foundations of relationships, personal relating style, small group dynamics and 
roles, and conflict management skills. The focus of this course contains principles for evaluating 
relational maturity, elements that help and hinder spiritual community and skills for dealing with conflict 
in healthy ways utilizing effective communication skills necessary for personal and ministerial 
development. Three units. 
 
See School of Behavioral Sciences, School of Education, and School of Arts & Sciences catalogs for 
additional course listings. 
 
Grace College and Seminary Catalog | 2023-2025 
 
Biblical Studies Department 
15 "
ICS 3110,Intercultural Communication ,Three,"Students will examine the principles and processes of communicating effectively with people from a 
second cultural context, whether in multi-cultural U.S.A. or in other countries. The course will 
investigate functional perception and how cultural worldview, beliefs, and values affect it through the 
personal perception of each individual. Students will explore how the shaping of the message, the style 
of communication, and the use of communication networks help to penetrate different cultures with 
the gospel. Dangers of ethnocentrism and its affect on the cross-cultural communication process will be 
discussed. The principles examined are valuable for intercultural relations in any field of work. 
Prerequisite: MIS2010. Three hours. 
 "
ICS 3210,Applied Cultural Anthropology ,Three,"The nature of man and how his culture affects him are explored with a view to how this, in turn, affects 
ministry in intercultural contexts. Worldview assumptions and resulting values, beliefs, behavior, and 
attitudes are studied as to how they affect the person in his perception and understanding of the 
physical and spiritual world around him and, ultimately, his understanding of the Gospel. Social 
organization is examined as to how it affects ministry strategy, and the nature of culture change is 
investigated with a view to evangelism. Prerequisites: MIS2010. Three hours. 
 "
ICS 3300,Eastern World Religions ,Three,"In this course the belief systems of major religions originating and concentrated in the Eastern world are 
studied with a view to understanding why the tenets make sense and drive behavior for the adherents. 
How each religion affects the host culture and how the culture affects the religion will be explored. The 
inadequacies of each belief system will be discussed in light of the adequacy of Christianity, but an 
introductory understanding of biblical theology is assumed.   Religions covered in the course include 
Hinduism, Buddhism, Jainism, Sikhism, Chinese Popular Religion (Taoism and Confucianism, with 
reflections of Taoism in Native American Religion), and Shintoism. These will be introduced with a short 
Theology of Religions.  Three hours. "
ICS 3350,Middle-Eastern World Religions ,Three,"In this course the belief systems of major religions originating and concentrated in the Middle East are 
studied with a view to understanding why the tenets make sense and drive behavior for the adherents. 
How each religion affects the host culture and how the culture affects the religion will be explored. The 
inadequacies of each belief system will be discussed in light of the adequacy of Christianity, but an 
introductory understanding of biblical theology is assumed.   Religions covered in the course include 
Judaism, Islam, Baha’i, Zoroastrianism (Zarathustrism), and African Animism. These will be introduced 
with a short Theology of Religions and comments on why various religions have similarities with others.  
Three hours. "
MIS 2010,Introduction to World Missions ,0,"This introductory course will help students discover basic understandings, motives, and methods for 
successful missionary work. Practical subjects such as good and bad reasons for going into missions, 
departure from and reentry into one’s own culture, entering a new culture, and choosing a mission field 
will be discussed. Basic skills for God’s work in another culture will be introduced. Theological and 
Grace College and Seminary Catalog | 2023-2025 
 
Biblical Studies Department 
16 "
MIS 2080,Teamwork and Leadership Training in Missions ,Three,"Students will discover and carefully examine the biblical data on teamwork, emphasizing the New Testament 
material. From this examination, principles guiding biblical teamwork will be gleaned with primary emphasis 
on application to missionary teams today, especially those involved in church planting. Students will also 
discover biblical patterns and models of leadership training with a view to their practice today. Other 
practices of leadership training will be evaluated in light of this study. Attention will be given to the 
relationship between biblically sound leadership and team health and effectiveness. Prerequisites: MIS2010. 
Three hours. 
 "
MIS 2100,History of World Missions ,Three,"In this course the backgrounds and development of the missions enterprise from the apostolic period 
until the present will be analyzed with a view to discovering the benefit to the intercultural task before 
us today. A proper understanding of the work of the Holy Spirit in this endeavor is emphasized. To give 
the student a good grasp of present-day major movements, significant current trends in missiological 
thought and practice will be examined. Prerequisites: MIS2010. Three hours. 
 "
MIS 3220,Principles and Practice of Prayer ,Three,"Students will examine the teaching of the Scriptures on the subject of prayer with a view to discovering 
the absolute necessity of a vital prayer experience in the life of the man or woman of God and in the life 
of the Church. Urgency, consistency, and effectiveness of prayer will all be discussed as well as practical 
guidance for fostering these. Significant time will be spent in the practice of prayer. Three hours. 
 "
MIS 4960,Cross Cultural Internship ,six,"The Cross-Cultural Internship is for a minimum of 14 weeks (one semester) in a second culture. The 
internship itself is for six hours of academic credit. While in the host context the student will complete 
two campus courses (BBL3090 Spiritual Formation and MIS2100 History of World Missions) for three 
hours of credit each. These two courses will be taken by distance education with the supervision and 
grading of the professors on campus.  
 
The cross-cultural aspects of the internship are to be fulfilled under the direction of the faculty 
supervisor. The components that are requirements for the internship are a personal cultural identity 
exercise, a culture identity comparison exercise in the host culture, ministry and interaction experiences 
in the host context, (living with a host family in some contexts), a weekly journal, required reading, and 
a reflective term paper. 9  Credit hours. 
 
Languages, Biblical 
In the following courses, students will explore the meaning of the biblical text through a study of the original 
languages. The aim of the courses in Greek and Hebrew is to gain knowledge of grammar and vocabulary in order 
to do basic translation and exegesis of biblical passages. 
 "
ENG 3300,Introduction to Linguistics ,0,"A survey of the primary features of language, including phonology, morphology, semantics, language acquisition, 
how the brain processes language, and how languages change through contact with each other.  Students will 
learn the International Phonetics Alphabet and learn to transcribe the sounds of English and other world 
Grace College and Seminary Catalog | 2023-2025 
 
Biblical Studies Department 
17 "
GRE 2010,Greek Exegesis ,Three,"This course is a practical study of the procedures for doing sound exegesis in the various portions of the 
New Testament. The method will include the study of syntax, words, poetics, textual criticism, biblical 
theology, and practical exegetical exposition in the different genres of the Greek New Testament. The 
student will be introduced to the electronic tools available to aid in the preparation of sound, biblically-
based sermons/lessons. The course is designed to help the student prepare for the future use of the 
skills in the ministry of the Word. Prerequisites: GRE1010 and GRE1020. Three hours. 
 "
GRE 2040,Greek Exegesis II ,Three,"An exegetical study of selected portions of the Greek New Testament in the original language designed 
to show its theological, expository, and practical values. Prerequisites: GRE1010, GRE1020 and GRE2010. 
Three hours. 
 "
HEB 1010–1030,"Hebrew I, II and III ",Three,"In this two semester course students will seek to gain sufficient mastery of the Hebrew language, including 
vocabulary, forms, and syntax, in order to begin translating and interpreting the Hebrew Bible. The second 
semester is devoted mostly to reading Hebrew narrative, with a continuation of grammar studies inductively 
from the reading selections. Students will be introduced to the basic literary and electronic tools currently in 
use in Hebrew language studies. Prerequisites: none. Three hours each session. 
 "
HEB 2020,Hebrew Exegesis I ,Three,"Students will seek to build on the foundation learned in the first two semesters of Hebrew and increase 
their knowledge of vocabulary, grammar, and syntax. Students will translate selections from the Old 
Testament, discovering translation techniques. Special focus will be placed on the theology and 
homiletical treatment of the book of Jonah. Prerequisites: HEB1010 and HEB1020. Three hours. 
 "
HEB 2080,Hebrew Exegesis II ,Three,"Students will undertake critical and exegetical studies of portions of the Hebrew OT. By analyzing the 
major exegetical and theological problems against the historical background of the selected passages, 
students will discover theological, expository, and practical values of doing Hebrew exegesis. 
Prerequisites: HEB1010, HEB1020 and HEB2010. Three hours. 
 "
LNG 4500,Articulatory Phonetics  ,Two,"Students will introduce the student to the sounds used in spoken languages.  The student will be trained 
to recognize, produce, transcribe, classify and describe words.  The student will get intensive practice in 
using the full International Phonetic Alphabet (IPA) for the whole range of sounds used in human 
speech. Two hours. 
 
