code,name,credits,description
personal characteristics trigger students’ own issues. The Department of Graduate Counseling 
can help provide the student with a referral list of counselors.  The student should be aware 
that this component might involve an additional expense. 
2. Comprehensive Exam  
The Comprehensive Exam is one of three gatekeeping processes (along with Candidacy and 
Portfolio) by which the DOGC faculty assesses student readiness to graduate from the CMHC 
program.  The Comprehensive Exam utilizes the standardized Counselor Preparation 
Comprehensive Examination (CPCE), administered by the National Board for Certified 
Counselors.  Students must make arrangements to take the CPCE through an approved testing 
site. Students should keep in mind the timing required for registration, completing the exam, 
and having scores sent to Grace College. CPCE scores must be received at least 30 days prior to 
the expected graduation date. Students will be required to pay for the test through the 
approved testing site. The Comprehensive Exam tests the student’s proficiency in the following 
eight major areas: Professional Counseling Orientation and Ethical Practice, Social and Cultural 
Diversity, Human Growth and Development; Career Development, Counseling and Helping 
Relationships; Social and Cultural Foundations; Group Counseling and Group Work; Assessment 
and Testing, and Research and Program Evaluation.  The CPCE is a “Pass/Fail” exam. The 
Department of Graduate Counseling, using the CPCE national norms, determines the minimum 
passing score. Students who earn the minimum passing score or higher are eligible to graduate 
from the CMHC program.  Students who score below the minimum passing score must re-take 
Grace College and Seminary Catalog | 2023 – 2025 
Department of Graduate Counseling 
 25 
 June 2023 
 
the CPCE and receive a passing score in order to graduate.  If a student has not achieved a 
passing score after taking the CPCE three times but has shown competency in all areas covered 
by the exam, the student should meet with their advisor and the Department Chair to assess 
alternative methods of meeting the comprehensive exam requirement.  Please click here for 
more information on the CPCE. 
3. Portfolio 
Portfolio is one of three gatekeeping processes (along with the Comprehensive Exam) by which 
the DOGC faculty determines student readiness to graduate from the CMHC program.  Students 
must register to present their Portfolio prior to graduation during the Advanced Internship 
course. In addition to completing all Portfolio requirements, students must present a 
professional identity oral presentation Portfolio is a “Pass/Fail” component of the CMHC degree.  
Students receiving a passing grade will be eligible for graduation from the CMHC program.  
Students receiving a failing grade are not eligible for graduation.  Students who fail Portfolio will 
be required to complete remedial work as designated by faculty. If a student fails Portfolio twice 
but has shown competency in all areas of the Portfolio assessment otherwise, the student 
should meet with their advisor and the department chair to assess alternative methods of 
meeting the Portfolio requirement. Graduation will be postponed until Portfolio has been 
passed.  
Additional Policies Related to the DOGC 
Acknowledgement of Catalog Policy                                                                                                
Students are required to read the DOGC Catalog and submit a completed Acknowledgement of the 
DOGC Catalog Form to their advisor each academic year. The catalog is reviewed and updated bi-
annually. In unusual circumstances, it may be modified mid-year, and these modifications will be posted 
as addendums. It is the responsibility of the student to review the catalog periodically in order to remain 
current with its contents. 
Dissemination of Program Information                                                                                       
Information is disseminated to students in DOGC programs via the Grace College email system.  Active 
students enrolled in the DOGC program will be given a personalized Grace College email 
account.  Students are responsible for checking their personal Grace College email account on a regular 
basis (daily is advisable).  It is not advised that students set up automatic email forwarding from their 
Grace College account to a personal email account, as certain emails may be blocked and/or identified 
as spam. In addition, program information can be found on the Resource page on the portal, on the 
Department of Graduate Counseling website, and in Canvas course shells.   
Counseling Services                                                                                                       
 A DOGC student who would like to obtain counseling is encouraged to do so. Students who observe 
others in need of assistance are urged to support the student in need by referring them to a counselor. 
The Grace College Counseling Center, located in the Gordon Recreation Center, provides counseling 
services to a limited number of graduate students in Indiana. Telehealth appointments are available as 
well. For an appointment, call the Grace College Counseling Center counselor, (574) 372-5100, ext. 6468. 
Confidentiality is observed according to ethical and legal standards. 
Grace College and Seminary Catalog | 2023 – 2025 
Department of Graduate Counseling 
 26 
 June 2023 
 
Counseling organizations offer a list of counselors available in your area. The American Counseling 
Association provides assistance for locating a counselor at the following web address: 
https://www.counseling.org/aca-community/learn-about-counseling/what-is-counseling/find-a-counselor . 
The American Association of Christian Counselors also provides a list of counselors at the following web 
address: http://www.aacc.net/resources/find-a-counselor/. The student will be responsible for any 
expense for the counseling.  
Technology Requirements                                                                                                                           
In a very broad sense, DOGC students will need a computer purchased in the last couple of years, a high-
speed internet connection, a web browser, anti-malware software, and the Microsoft Office Suite of 
programs.  Depending on the academic program, additional equipment (such as a recording device) and 
services (such as Time2Track) may be a required purchase.  In addition, computer literacy is required 
along with skills that go beyond word processing in the areas of hardware and software installation.   
Prospective students may access the technology and computer literacy requirements on the Office of 
Information Technology page of the Grace College Website. This information includes a chart detailing 
the specific hardware and software requirements and recommendations. At the end of the chart are 
some suggested computers students may purchase that will meet Grace College’s requirements. 
Please note: Mobile phones and tablets are not allowed for recording client sessions or volunteer 
role-plays.  These devices are not secure and are not suitable for keeping client information 
confidential.  
 
Technology Requirements for Online Courses                                                                                       
The Office of Instructional Technology and the office of Student and Professional Online Education will 
work with students related to important information concerning technology for the virtual/online 
classroom.  Because of their very nature, the success of online courses is dependent not only on the 
quality of the technology used, but also the skill set of the individual using the technology. 
Participation in an online program or course requires different tools and skills from more traditional 
coursework.  In addition to having a computer and an internet connection, the online student must be 
familiar and comfortable with: 
• 
Loading and configuring various software programs 
• 
Sending and receiving email 
• 
Opening and sending email attachments 
• 
Downloading and uploading files 
• 
Creating and uploading video (MP4) 
• 
Searching the internet 
• 
Using Microsoft Office Suite 
Besides the technical skills and requirements listed above, other characteristics of the successful online 
student include: 
• 
Ability to work independently 
• 
Self-motivation and self-discipline 
• 
Wise time management 
• 
Effective written communication 
Grace College and Seminary Catalog | 2023 – 2025 
Department of Graduate Counseling 
 27 
 June 2023 
 
Additional Information for DOGC Students 
Records-Student Education                                                                                                                        
The institution maintains the privacy of student education records with the exception of those situations 
in which the law or consent of the student permits disclosure.  
Family Education Rights and Privacy Act (FERPA) affords matriculated students certain rights with 
respect to their educational records. This includes the right to: 
• 
Inspect and review the student’s education records 
• 
Request an amendment of the student’s education records 
• 
Provide written consent before the university discloses personally identifiable information from 
the student’s educational records, except to the extent that FERPA authorizes disclosure 
without consent 
• 
File a complaint with the U.S. Department of Education concerning alleged failures by the 
university to comply with the requirements of FERPA. 
The complete policy can be found in the Academic Policies Manual on the Registrar’s page of the 
institution’s Web site.  
Public Notification of Directory Information                                                                                                                        
At its discretion, Grace College and Seminary may provide directory information in accordance with the 
provisions of the Family Education Rights and Privacy Act. Directory information is defined as that 
information which would not generally be considered harmful or an invasion of privacy if disclosed. 
Students may block the public disclosure of directory information by notifying the Registrar’s Office in 
writing. 
The complete policy can be found in the Academic Policies Manual available on the Student's Right to 
Know page of the institution’s website.  
Citation and Format Style Policy                                                                                                                
The American Psychological Association (APA) citation and format style is commonly used within the 
social sciences when writing research papers. This citation and format style (from the most recent 
Publication Manual of the American Psychological Association) is the standard requirement for all 
students taking courses within the DOGC. 
Textbooks                                                                                                                                                        
A listing of the textbooks for each course offered may be found at the Grace College bookstore using 
this link. Students may also find this to be a convenient place to purchase the course texts and materials, 
although students are not required to purchase books from any specific vendor. In addition, the book list 
is available on the DOGC Portal Resources page.  
Endorsement Policy                                                                                                                                
Students enrolled in, graduating from, or alumni of a DOGC program may request letters of 
recommendation from DOGC faculty related to employment and licensure.  The DOGC faculty reserves 
the right to determine whether or not a letter of recommendation will be issued to a student. Letters of 
recommendation are a privilege/courtesy and should be viewed this way. The DOGC faculty is under no 
Grace College and Seminary Catalog | 2023 – 2025 
Department of Graduate Counseling 
 28 
 June 2023 
 
obligation to endorse a student or write letters of recommendation. 
Professional Organizations                                                                                                                 
The DOGC acknowledges the importance of counseling students development of a professional 
counseling identity through membership and participation in professional counseling organizations. To 
facilitate this process, all students are required to join a professional counseling organization by the end 
of the first year of their schedule of study. Students may enroll in national counseling organizations such 
as the American Counseling Association (ACA) or the American Mental Health Counseling Association 
(AMHCA), or students may elect membership in their state or other regional professional counseling 
organization. Students are required to participate in their chosen professional counseling organization 
for a minimum of three (3) hours per year. This participation may include attending or presenting at 
conferences, serving on student committees, volunteering, or other professional involvement. Students 
must submit evidence of their membership and participation in a professional counseling organization 
to their advisors each year in order to be eligible to register for courses.   
License  
Licensed Mental Health Counselor (LMHC) or Licensed Professional Counselor 
(LPC)                                                                                                                   
Persons interested in licensing should check with the state licensing board for the state in which 
licensing will be pursued. In Indiana, this license requires a 60-hour master’s degree in counseling from 
an accredited college or university. In addition, the candidate must complete a designated number of 
supervised counseling hours under a licensed counselor or psychologist and pass a qualifying 
examination. For more information about Indiana licensure, please consult the Indiana Professional 
Licensing Agency website.  
All states accept the education of applicants for licensure from a CACREP-approved program. However, a 
few states require additional coursework. The DOGC webpage maintains information on state 
requirements for licensure. It is important that students check the licensing boards/agencies of their 
state for detailed requirements.  If a student becomes a licensed mental health counselor, continuing 
education credit hours are necessary on a yearly basis to maintain licensure.  
  
Various Offices Necessary to DOGC Students  
Financial Information 
• 
Tuition and Regular Fees 
A graduate student taking at least six credits is considered to have a full-time semester load subject 
to regular per semester tuition and fees. Tuition is charged by the credit hour. Rates and fees are 
subject to change each academic year. For more information, please contact the Business office at 
1-800-54-GRACE, ext. 6075. 
• 
Business Office Policies 
The Business Office provides information regarding tuition and other expenses, annual costs, terms 
of payment and payment options, responsibility for payments, tuition refunds, appeal of refunds, 
and deposits. 
Grace College and Seminary Catalog | 2023 – 2025 
Department of Graduate Counseling 
 29 
 June 2023 
 
• 
Financial Aid Policies 
Students interested in further information about the financial aid application process, financial aid 
award notices, financial aid eligibility and appeals, satisfactory academic progress, and financial aid 
suspension should contact the Office of Student Financial Aid Services. 
• 
Refunds  
Tuition refunds for students withdrawing or dropping a class will be based on the official date of 
that action.  A student withdrawing from the school must contact the DOGC to complete the 
appropriate forms.  A student dropping from a class must contact the DOGC to complete the drop.   
Withdrawal from the school or dropping a class can change financial aid.  It is the student’s 
responsibility to contact the Financial Aid office and the Business Office to ascertain the effect of 
the action and make payment if needed. 
Satisfactory Academic Progress                                                                                                     
Recipients of student financial assistance are required to make satisfactory academic progress toward 
a specific educational objective or degree. The federal government's Department of Education has 
mandated that Grace College monitor and enforce these standards which are consistent with the 
educational mission of the college. This policy applies to all students receiving assistance from any 
financial aid program administered by the Office of Financial Aid at Grace College.  This policy is 
administered separately from the college's academic probation and suspension policy.  
Qualitative and Quantitative Measure 
Satisfactory academic progress is measured by both a qualitative and a quantitative standard.  The 
qualitative standard is based on meeting the minimum cumulative GPA required for the number of 
hours attempted.  The quantitative standard requires the student to have completed the required 
minimum percentage for the number of hours attempted.  The Office of Financial Aid determines on an 
annual basis (at the end of spring semester) the eligibility of the student for continued financial aid 
based on the standards established under the Satisfactory Academic Progress Policy.   
GRADUATE LEVEL: 
Hours 
Attempted 
Minimum % 
Of Completion 
Minimum 
Cum. GPA 
All (1+) 
67% 
2.000 
Students who fail to complete the required minimum percentage of credit hours as listed above and/or 
who do not meet the minimum grade point requirements during any applicable academic year will be 
cited as not making satisfactory academic progress.  Students who fail to meet the standards at the end 
of the spring semester each academic year will be placed on financial aid suspension and notified in 
writing.  Students placed on suspension are not eligible for financial aid funding. 
Courses for which a student receives F, W, or I will count as credits attempted but will not be considered 
as credits successfully completed.  Incompletes will be considered as successful completions if the I is 
changed to a grade (other than F or W) within the six-week period granted by the Academic Policy 
Manual.  Courses that are repeated for academic forgiveness will count in the number of credits 
attempted and completed.  If the original course had a passing grade, the original credits are counted as 
Grace College and Seminary Catalog | 2023 – 2025 
Department of Graduate Counseling 
 30 
 June 2023 
 
completed even though the grade is no longer calculated as part of the cumulative GPA.  Courses for 
which a student receives CR count towards credits attempted and completed even if the grade is not 
calculated as part of the cumulative GPA.  Courses for which a student receives NCR count toward the 
credits attempted but not completed. Courses which are taken for credit, even though they are remedial 
in nature, are counted in both the quantitative and qualitative computations for eligibility. AU (Audit) 
credits do not count either in the cumulative GPA or in the credit hours attempted/completed.  
Eligibility and Appeal Process 
A student who has lost eligibility for financial aid may take courses at Grace College at their own 
expense until they have achieved the required minimum cumulative GPA and/or the required minimum 
number of credit hours.  Once completing these requirements, the student must request that SAP be 
reviewed again if requirements are completed at the end of Fall or Summer terms. Financial aid will be 
reinstated if the student has been found to be meeting the SAP requirements. 
A student who has been denied financial aid can appeal by contacting the Registrar to develop an 
Academic Plan that will enable the student to regain SAP by the end of a year. A student has 30 days 
from the date of the notification of suspension to develop the Academic Plan and submit it to the Office 
of Financial Aid.  The Academic Plan needs to spell out when and how SAP will be achieved. The 
Academic Plan will grant one year of SAP Probation. If the student is not meeting this prescribed plan 
when SAP is reviewed again at the end of the spring term, the student will be placed on Financial Aid 
Suspension until SAP has been achieved and there will not be another probationary period. 
If a student cannot develop a satisfactory academic plan with the registrar that will resolve their SAP 
failure by the end of a year, the student will have to pay for courses at their own expense. 
Student Rights and Responsibilities                                                                                                          
All students enrolled in the DOGC program assume an obligation to conduct themselves at all times as 
responsible members of the Grace College community, to respect the personal and property rights of 
others, and to support the educational mission of Grace College.  Grace College and the DOGC insist that 
its students demonstrate personal and professional integrity in addition to academic excellence. Grace 
College administrators, faculty, and staff encourage student involvement in decision making. Student 
membership and input on institutional committees are valued and encouraged at Grace College. 
Attitude and Conduct Expectations                                                                                                  
Members of the Grace College community are committed to the mission of the institution and to living 
in a manner that brings glory to the name of our Lord. All students enrolled in the DOGC program are 
required to uphold the standards of the Grace College community and affirm their agreement to do so 
by signing a Statement on Community Lifestyle Expectations. A copy of this document can be found on 
the Department of Graduate Counseling Resource page on the portal.   
In addition to following the Grace College community lifestyle expectations, students also are required 
to adhere to the Code of Conduct Policy outlined below:  
Code of Conduct Policy                                                                                     
All students enrolled in the DOGC program are expected to conduct themselves in an ethical, 
professional, and civil manner.  Students found guilty of the following violations shall be subject to 
disciplinary action up to and including dismissal from Grace College:    
Grace College and Seminary Catalog | 2023 – 2025 
Department of Graduate Counseling 
 31 
 June 2023 
 
• 
Academic dishonesty of any kind with respect to examinations or coursework. This includes any 
form of cheating and plagiarism. 
• 
Falsification or alteration of Grace College documents, records, or identification cards. 
• 
Forgery, issuing bad checks, or not meeting financial obligations to Grace College. 
• 
Theft or the deliberate damaging or misusing of property belonging to others or the property of 
Grace College. 
• 
The manufacture, possession, use, or illegal distribution of any form of illegal drugs. 
• 
Possession, display, or use of any dangerous instrument, weapon, or explosives (certified law 
enforcement officers required by their employer to carry a firearm are excluded). 
• 
Disrupting the study of others or of Grace College activities, or interfering with the freedom of 
movement of any member or guest of the Grace College community. 
• 
Deliberate interference with academic freedom, freedom of speech, or movement of any 
member or guest of the Grace College community. 
• 
Participation in any activity that disrupts or interferes with the education of others or the 
orderly operation of Grace College. 
• 
Physical abuse, threatening acts, or harassment toward others. 
• 
Gambling, drunkenness, distribution of alcohol to minors, or illegal drug use.  
• 
Membership or association with organizations that promote ideas that are in direct conflict with 
biblical principles and/or Grace College community lifestyle expectations. 
• 
Nonconformity to certain standards of appearance and dress which are maintained in order to 
strengthen professionalism and to promote the general morale of the school (see Dress Code under 
Miscellaneous Re: Clinical Work) 
• 
Violation of the ethical codes (ACA & AACC) and/or state licensing laws and statutes governing and 
pertaining to the counseling profession. 
 
If a professor believes that a student is violating any of the above guidelines, the offending parties will 
be contacted directly in an effort to discuss the situation. Based on the severity of the violation and/or 
the student’s receptivity to the instructor’s intervention, the professor reserves the right to implement 
remediation of issues related to the offense.  Offenses that violate policies and procedures outlined in 
the Graduate Counseling program catalog or the professional ethics and standards published by the 
American Counseling Association may result in a failing grade or a “No Credit” for the course.  
If a student feels that another student is behaving inappropriately, they are advised to follow the 
principles outlined in Matthew 18 and discuss this concern with the other student. If for some reason, 
the student does not feel they can do this, the student is advised to send a private email to the 
professor explaining the situation to discuss a wise course of action as soon as possible. 
