code,name,credits,description
Concentrations – select one of the following (12 hours): 
 
Concentration 1: Business "
BUS 1010,Foundations of Business ,0,"ACC 2110 Financial Accounting 
Grace College and Seminary Catalog | 2023-2025 
 
Science and Mathematics    
  20 "
MGT 2430,Principles of Management ,0,"ISM 4800 ISM Senior Seminar 
 
Concentration 2: Pre-Data Science "
MAT 4200,Probability Theory ,0,MAT 4320 Mathematics Statistics 
MAT 4830,Research in Mathematics ,0,"MAT 4020 Math Senior Seminar 
 
Concentration 3: Application Development "
ISM 4800,ISM Senior Seminar ,credit,"3 Electives from the following LCMC Courses: 
 
CSC I Internet History, Technology and Security 
 
CSC IV Web Development 
 
CSC V Application Development I 
 
CSC VI Application Development II 
 
NOTE: Course descriptions for BUS, ACC, ISM and MGT can be found in the Department of Business course listings. 
CSC and CSM courses are offered via partnership with LCMC and course descriptions can be found here. Additional 
fees may apply to partnership programs. For more information, please contact the Director of Partnership 
Programs at statoncg@grace.edu. 
 
 
MATHEMATICS MAJOR 
Bachelor of Science and Bachelor of Arts 
The mathematics major equips students for a broad variety of applications. Students will learn how 
mathematics is the language we use to describe and predict God’s creation. The program places a strong 
focus on practical problem solving with applications in business and the sciences. A total of 47-48 credit 
hours in mathematics, physics, and related courses are required. 
 
Math and Science Requirements (35 hours): "
ISM 1150,Introduction to Computer Science ,0,MAT 1230/1240 Calculus I and Lab 
MAT 1250,Calculus II ,0,MAT 2100 Introduction to Proofs 
MAT 2200,Discrete Mathematics ,0,MAT 2250 Calculus III 
MAT 2280,Differential Equations ,0,MAT 3130 Linear Algebra 
MAT 4020,Senior Seminar in Mathematics ,0,MAT 4930 Mathematics Internship 
MAT 4140,Abstract Algebra ,0,"MAT 4280 Real Analysis 
Choose two from the following: 
Grace College and Seminary Catalog | 2023-2025 
 
Science and Mathematics    
  21 "
MAT 3280,College Geometry ,0,MAT 3930 Independent Study in Mathematics 
MAT 4200,Probability Theory ,0,MAT 4280 Real Analysis or 4140 Abstract Algebra 
MAT 4320,Mathematical Statistics ,0,"MAT 4830 Research in Mathematics 
Choose one of the following: "
BUS 3050,Business Spreadsheet Applications ,0,ISM 2150 Object-Oriented Programming 
ISM 1150,Introduction to Computer Science ,0,MAT 1230/1240 Calculus I and Lab 
MAT 1250,Calculus II ,0,MAT 2250 Calculus III 
MAT 2100,Introduction to Proofs ,0,MAT 2200 Discrete Mathematics 
MAT 3130,Linear Algebra ,0,MAT 3280 College Geometry 
MAT 4020,Senior Seminar in Mathematics ,6,"MAT 4140 Abstract Algebra  
 
Electives - choose from the following (6 hours):   "
MAT 2280,Differential Equations ,0,MAT 3930 Independent Study in Mathematics 
MAT 4200,Probability Theory ,0,MAT 4280 Real Analysis 
MAT 4320,Mathematical Statistics ,36,"MAT 4830 Research in Mathematics  
 
Professional Education Requirements (36 hours): "
SED 1000,Teaching School in America ,0,"SED 2200 The School Age Child 
Grace College and Seminary Catalog | 2023-2025 
 
Science and Mathematics    
  22 "
SED 2210,Responsive and Differentiated Instruction ,0,SED 2400 Teaching Exceptional Learners 
SED 2500,Teaching in a Pluralistic Society ,0,SED 2600 Teaching and Learning 
SED 3600,Teaching in the Middle and High School Setting ,0,SED 4650 Methods of Teaching Secondary Mathematics 
SED 4700,The Moral Practitioner ,credit,"SED 4900 Student Teaching and Seminar 
 
No minor is required for this major. 
 
NOTE: Course descriptions for SED can be found in the Department of Education course listings. Course 
descriptions for ISM can be found in the Department of Business course listings. 
 
APPLIED MATHEMATICS MINOR 
The requirement for an applied mathematics minor is 19 credit hours in mathematics. 
 
Required Courses (16 hours): "
MAT 1250,Calculus II ,0,MAT 2250 Calculus III    
MAT 2280,Differential Equations  ,3,"MAT 3130 Linear Algebra  
 
Electives – choose one of the following (3 hours):  "
MAT 2100,Introduction to Proofs ,0,MAT 2200 Discrete Mathematics 
MAT 4200,Probability Theory ,credit,"MAT 4320 Mathematical Statistics 
 
MATHEMATICS MINOR 
The requirement for a mathematics minor is 19 credit hours in mathematics. 
 
Required Courses (10 hours): "
MAT 1250,Calculus II ,9,"MAT 2100 Introduction to Proofs 
 
Electives – choose from the following (9 hours):  "
MAT 2200,Discrete Mathematics ,0,MAT 2250 Calculus III    
MAT 2280,Differential Equations  ,0,MAT 3130 Linear Algebra  
MAT 3280,College Geometry ,0,MAT 4140 Abstract Algebra 
MAT 4200,Probability Theory ,0,MAT 4280 Real Analysis 
MAT 4320,Mathematical Statistics ,0,"Grace College and Seminary Catalog | 2023-2025 
 
Science and Mathematics    
  23 "
MAT 3130,Linear Algebra (requires other math courses as prerequisites) ,0,CSI 1151 Introduction to Computer Science 
ISM 2150,Object Oriented Programming ,0,ISM 2700 HTML and Web Development 
ISM 3800,Database Programming ,9," 
Partnership Courses with LCMC (9 hours):  "
BIO 4010,Senior Seminar in Biology ,0,ENV 4010 Senior Seminar in Environmental Science 
MAT 4020,Senior Seminar in Mathematics  ,7," 
Electives – choose from the following (6-7 hours): "
SCI 1160,Theories of Origins ,0,SCI 2360 Introduction to Astronomy 
SCI 2230,Physical Geography ,3,"SCI 2240 Physical Geology 
 
Experiential Learning Requirement – choose from the following (3 hours): "
BIO 2310,Biochemistry ,0,CHM 2610/2620 Organic Chemistry I and Lab 
CHM 3610,Environmental Analytical Chemistry ,0,CHM 4610/4620 Physical Chemistry and Lab 
CHM 4700,Advanced Inorganic Chemistry ,12," 
Required Math and Physics Courses (12 hours):  "
CHM 4730,Internship in Chemistry ,0,"CHM 4830 Research in Chemistry 
 
Suggested Courses: * "
MAT 1250,Calculus II ,0,CHM 2300 Forensic Chemistry 
CHM 4530,Independent Study in Chemistry: Adv Organic Chemistry ,0,"Grace College and Seminary Catalog | 2023-2025 
 
Science and Mathematics    
  25 "
BIO 2310,Biochemistry (required for Biology/Health Science majors only) ,credit,"CHM 3610 Environmental Analytical Chemistry (required for Environmental Science majors only) 
 
GENERAL SCIENCE MINOR 
The requirement for a minor in general science is 24 credit hours of courses in biological, environmental, 
and/or physical science. Choose any courses from biological, environmental or physical science (BIO, 
ENV, CHM, PHY and SCI course prefixes). Note that some courses have prerequisites. 
 
 
 
 
 
 
 
 
 
 
 
 
 
 
 
 
 
 
Grace College and Seminary Catalog | 2023-2025 
 
Science and Mathematics    
  26 "
BIO 1010,Bioscience Survey  ,Three,"A broad overview of living organisms, their structure, function, and relationships to their non-living 
environment, to each other, and to humans. Special attention is given to cellular biology as it applies to 
both lower and higher forms of life. Students must enroll concurrently in BIO 1020 Bioscience Survey 
Laboratory. (Credit will not be given for both BIO 1010 and BIO 1610). Three hours. "
BIO 1020,Bioscience Survey Laboratory  ,0,"The laboratory is designed to support BIO 1010 and must be taken concurrently with the course. This 
course has a fee for consumables used in its labs. "
BIO 1200,Medical Terminology  ,Three,"Students will focus on building core medical vocabulary by analyzing their prefix, suffix, root, connecting 
and combining forms. Through such analysis, students gain an understanding of the human body’s 
structure, function and diseases. Three hours.  "
BIO 1610,General Biology I ,Four,"Principles of structure, function, and cellular organisms. Includes an introduction to the scientific 
method, characteristics of cytoplasm, and basic cytology, energy acquisition and release and heredity. 
Also includes basic plant structure and function. Students must enroll concurrently in BIO 1620. Four 
hours. "
BIO 1620,General Biology I Laboratory ,0,"The laboratory is designed to support BIO 1610 and must be taken concurrently with the course. This 
course has a fee for consumables used in its labs. "
BIO 1710,General Biology II ,Four,"A continuation of BIO 1610. Includes structure, function and interrelationships of the organ systems of 
animals with particular attention to the human body. Also includes introductory taxonomy, surveying 
the major groups of plants and animals. Prerequisite: BIO 1610/1620 or permission of the instructor. 
Students must enroll concurrently in BIO 1720. Four hours. "
BIO 1720,General Biology II Laboratory ,0,"The laboratory is designed to support BIO 1710 and must be taken concurrently with the course. This 
course has a fee for consumables used in its labs. "
BIO 2010,Anatomy and Physiology I ,Four,"This course is designed for students pursuing a career in an allied health field (nursing, health and 
wellness, etc.) The class includes the study of basic gross and microscopic anatomy and the function of 
the body on cellular, tissue, and organ system levels. The class will include organization of the body, 
cytology, basic histology, and the study of several organ systems – integumentary, skeletal, muscular, 
nervous, and endocrine. Remaining body systems including – circulatory, respiratory, digestive, urinary, 
and reproductive to be covered in course BIO 2040. Students must enroll concurrently in BIO 2020. Four 
hours. 
 
 
Grace College and Seminary Catalog | 2023-2025 
 
Science and Mathematics    
  27 "
BIO 2020,Anatomy and Physiology I Lab ,0,"The laboratory is designed to support BIO 2010 and must be taken concurrently with the course. This 
course has a fee for consumables used in its labs.  "
BIO 2040,Anatomy and Physiology II ,0,"This course is designed for students pursuing a career in an allied health field (nursing, health and 
wellness, etc.) This course includes a basic study of the gross and microscopic structure of several major 
organ systems – endocrine, circulatory, respiratory, digestive, urinary, and reproductive. The other body 
systems including – integumentary, skeletal, muscular, nervous, and endocrine to be covered in course "
BIO 2050,Anatomy and Physiology II Lab ,0,"The laboratory is designed to support BIO 2040 and must be taken concurrently with the course. This 
course has a fee for consumables used in its labs. "
BIO 2100,Health Sciences Seminar ,One,"An overview of the health professions, as presented by current practicing medical professionals. 
Includes occupations ranging from nurse to medical doctor to veterinarian to chiropractor, with many 
others included. Prerequisites: BIO 1610/1620 and BIO 1710/1720, or consent of the instructor. One 
hour. "
BIO 2110,General Ecology  ,Four,"A study of the interaction of organisms with their physical environment and with each other. Particular 
focus will be on application of ecological concepts and field work in various local ecosystems. Students 
must enroll concurrently in BIO 2120. Four hours. (Cross-listed; register as ENV 2110.) "
BIO 2120,General Ecology Lab ,0,"This laboratory is designed to support BIO 2110 and must be taken concurrently with the course. (Cross-
listed; register as ENV 2120.) This course has a fee for consumables used in its labs. "
BIO 2210,Principles of Nutrition ,Three,"Functions and interrelationships of food nutrients throughout the life cycle of man. Includes digestion, 
absorption and metabolism of nutrients, as well as dietary evaluation and modification for physiological 
needs. Other areas of study include: role of social, psychological and cultural factors in food selection. 
Prerequisite: BIO 1610/1620 or consent of the biology program director. Three hours. "
BIO 2240,Intro to Public Health ,Three,"This is an introductory course in public health designed for students pursuing careers in healthcare. 
Various aspects of public health are explored, including: infection disease; psychosocial behavior; 
environmental issues; and governmental policy-making. Epidemiological approaches to understanding 
public health data feature prominently throughout the course. Pre-requisite: MAT 3200. Three hours. "
BIO 2310,Biochemistry ,Three,"A study of the basic composition, function and metabolism of carbohydrates, lipids and proteins. 
Emphasis is placed on the catalytic function and regulation of enzymes, and on the process of cellular 
respiration. Some consideration given to the role of nucleic acids in cellular metabolism. The course 
includes hands-on laboratory experiments involving current procedures in biochemistry. This course has 
a fee for consumables used in its labs. Prerequisite: CHM 1710/1720 and BIO 1610/1620, or consent of 
instructor. Three hours. 
Grace College and Seminary Catalog | 2023-2025 
 
Science and Mathematics    
  28 "
BIO 2410,Plant Biology ,Four,"Integrated study of plants as organisms. Deals with plant structure, physiology, development, genetics, 
ecology, and classification of major plant groups. Prerequisite: BIO 1610/1620 or consent of the 
instructor. Students must enroll concurrently in BIO 2420. Four hours. "
BIO 2420,Plant Biology Laboratory ,0,"The laboratory is designed to support BIO 2410 and must be taken concurrently with the course. This 
course has a fee for consumables used in its labs. "
BIO 2510,Animal Biology ,Four,"Integrated study of animals as organisms. Deals with animal structure, physiology, development, 
genetics, ecology, and classification of major animal groups. Prerequisite: BIO 1610/1620 or consent of 
the instructor. Students must enroll concurrently in BIO 2520. Four hours. "
BIO 2520,Animal Biology Laboratory ,0,"The laboratory is designed to support BIO 2510 and must be taken concurrently with the course. This 
course has a fee for consumables used in its labs.  "
BIO 2700,Introduction to Microbiology ,Four,"An organ systems approach to the study of disease-related microorganisms intended for the nursing 
major. The foundations of microbiology are presented through the lens of disease processes as 
bacterial, viral and parasitic infections relevant to health professionals are explored. Other course topics 
include: host-parasite interaction; virulence factors; hospital and community acquired infections; 
mechanisms of gene transfer; disinfection; antimicrobial drugs; and, immunology. Prerequisite: BIO 
1010/1020; or BIO 1610/1620; or BIO 2010/2020; or consent of the instructor. Students must enroll 
concurrently in BIO 2710. Four hours. 
 "
BIO 2710,Introduction to Microbiology Laboratory ,0,"The laboratory is designed to support BIO 2700 and must be taken concurrently with the course. This 
course has a fee for consumables used in its labs.  "
and 2870,"Healthcare Observation 1, 2, 3 ",40,"Each of these courses requires 40 hours of shadowing a healthcare professional in the area of the 
student’s desired future occupation, during which time the student will become more familiar with the 
specifics of the career. Shadowing may require that the student be vetted through the volunteer process 
of a healthcare facility (may include an application, drug screening and/or health testing, which are the 
student’s responsibility to complete). A different healthcare professional must be shadowed for each 
Grace College and Seminary Catalog | 2023-2025 
 
Science and Mathematics    
  29 "
BIO 3110,Cell and Molecular Biology ,Three,"A study of the basic principles that guide cellular composition, organization and function. Particular 
attention will be paid to understanding the molecular mechanism that underlies cell function. Topics 
studied in the course include, processes of energy extraction, membrane transport, cell surface 
communication, cell cycle and regulation, cell division, along with the study of specialized cells like 
gametes, lymphocytes, neurons, muscle cells, and cancer cells. The course includes hands-on laboratory 
experiments involving current procedures in cell and molecular biology. This course has a fee for 
consumables used in its labs. Prerequisite: BIO 2310 or consent of the instructor. Three hours.  "
BIO 3210,Advanced Anatomy and Physiology I ,Four,"This course is designed for students preparing for graduate studies in biology/medically related 
programs (medicine, physical therapy, pharmacy, veterinary medicine, etc.). The class includes an in-
depth look at organization of the human body, cytology, histology, and the study of several of the major 
organ systems – integumentary, skeletal, muscular, nervous, and endocrine. A detailed study of the 
remaining body systems including – circulatory, respiratory, digestive, urinary, and reproductive to be 
covered in course BIO 3310/3320. Students must enroll concurrently in BIO 3220. Prerequisites: BIO 
1710/1720 or consent of the instructor. Four hours. "
BIO 3220,Advanced Anatomy and Physiology I Lab ,0,"The laboratory is designed to support BIO 3210 and must be taken concurrently with the course.  This 
course has a fee for consumables used in its labs.  "
BIO 3310,Advanced Anatomy and Physiology II ,Four,"This course is designed for students preparing for graduate studies in biology/medically related 
programs (medicine, physical therapy, pharmacy, veterinary medicine, etc.). This course includes an in 
depth study of the gross and microscopic structure of several major organ systems – endocrine, 
circulatory, respiratory, digestive, urinary, and reproductive. A detailed study of the other body systems 
including –integumentary, skeletal, muscular, nervous, and endocrine to be covered in course BIO 
3210/3220. Students must enroll concurrently in BIO 3320. Prerequisites: BIO 1710/1720 or consent of 
the instructor. Four hours. 
 
 
 
Grace College and Seminary Catalog | 2023-2025 
 
Science and Mathematics    
  30 "
BIO 3320,Advanced Anatomy and Physiology II Lab ,0,"The laboratory is designed to support BIO 3310 and must be taken concurrently with the course. This 
course has a fee for consumables used in its labs. "
BIO 3710,Pathophysiology ,Three,"This course covers the biological basis for disease within the human body. Pathological conditions are 
presented by organ system, including disorders caused by injury, infection, deficiency, and genetics. A 
review of basic anatomy and physiology is included with each body system in order to contrast normal 
and diseased states of tissues and organs. The origin of each disease is analyzed down to a cellular or 
tissue level to provide root understanding of the cause of human disease. Prerequisite: BIO 1710/1720 
or BIO 2040/2050. Three hours. "
BIO 4010,Biology Senior Seminar ,0,"This course is designed as a capstone course for science majors and is meant to teach valuable skills and 
give experience with tools needed for science careers or post-graduate education. Coursework is 
designed to challenge the student to integrate their current biological knowledge with a Biblical 
worldview, as well as to consider their future role as a Christ-follower in the workforce. Prerequisites: "
BIO 2310,"and senior class standing, or consent of the instructor. Three hours. ",Four,"BIO 4110 Microbiology 
An introductory study of microorganisms dealing with the morphology, physiology and cultivation and 
identification of microbes and their role in the environment. Other areas studied include: immunology, 
genetics, metabolism, food, preservation, and diseases. Prerequisite: BIO 1610/1620 and BIO 
1710/1720, or consent of the instructor. Students must enroll concurrently in BIO 4120. Four hours. "
BIO 4120,Microbiology Laboratory ,0,"The laboratory is designed to support BIO 4110 and must be taken concurrently with the course.  This 
course has a fee for consumables used in its labs. "
BIO 4210,Genetics ,Three,"A study of both in-depth classical genetics and underlying molecular mechanisms; also genetic 
mechanisms and processes, recombination, genetic interaction, and gene regulation. The process of 
expression of genetic information through protein synthesis is also considered in depth. The 
course includes hands-on laboratory experiments involving current procedures in molecular genetics.  
This course has a fee for consumables used in its labs. Prerequisite: BIO 2310 or consent of the 
instructor. Three hours. 
 
 
Grace College and Seminary Catalog | 2023-2025 
 
Science and Mathematics    
  31 "
BIO 1710,and BIO 2310 or consent of the biology program director. One to three ,six,"hours. Maximum of six hours permitted. 
 
CHEMISTRY "
CHM 1010,Introduction to Chemistry ,Four,"This course is designed to give the student a broad introduction to general, organic, and biological 
chemistry. The lecture emphasizes general chemical concepts while the laboratory concentrates on 
techniques and data handling. Students must enroll concurrently in CHM 1020. Four hours.  "
CHM 1020,Introduction to Chemistry Lab  ,0,"Designed to support CHM 1010 and must be taken concurrently with the course. This course has a fee 
for consumables used in its labs. "
CHM 1610,General Chemistry I  ,Four,"This course is designed to investigate all topics normally found within the American Chemistry Society 
recommended guidelines (i.e., atomic structure, physical measurements, chemical reactions and 
balancing equations, percent composition, solubility and precipitation, redox chemistry, gas laws, 
thermochemistry, quantum chemistry, VSEPR theory, molecular orbital theory, unit cells and unit cell 
calculation, and intermolecular forces) for a first-semester freshmen chemistry course. Students must 
enroll concurrently in CHM 1620. Four hours. "
CHM 1620,General Chemistry I Lab  ,0,"General Chemistry I Lab investigates many of the concepts discussed in CHM 1610 and re-enforces the 
student’s applied learning. Students must enroll concurrently in CHM 1610. This course has a fee for 
consumables used in its labs. "
CHM 1710,General Chemistry II ,Four,"This is the second part of a two-semester sequence in general chemistry. This course studies and 
problem solves topics in solution chemistry, chemical kinetics, chemical equilibria, thermodynamics, 
acid-base equilibria, electrochemistry, and an introduction to organic chemistry. Prerequisite: CHM 
1610/1620. Students must enroll concurrently in CHM 1720. Four hours. "
CHM 1720,General Chemistry II Lab  ,0,"General Chemistry II Lab focuses on the van’t Hoff factor and its effect on boiling point elevation, 
chemical kinetics of a combustion reaction, chemical equilibria and reaction rates, synthesis of biodiesel, 
electrochemical cells, oxidation-reduction, and testing functional groups of organic compounds. 
Students must enroll concurrently in CHM 1710. This course has a fee for consumables used in its labs. "
CHM 2300,Forensic Chemistry ,Three,"This is a descriptive course covering the wide spectrum of current forensic chemistry and its application 
in criminal investigations. Drugs, drugs as physical evidence, seized drugs and their analysis, and 
selected drug classes are investigated. Drugs in the body, and the chemistry of combustion and arson, 
explosives, and firearms are also covered. Quantitative reasoning is utilized in the form of scientific units 
(e.g., dosage) and in oxygen balance calculations (i.e., explosives). Discussion boards and documented 
case studies re-enforce the material covered. Three hours. 
Grace College and Seminary Catalog | 2023-2025 
 
Science and Mathematics    
  32 "
CHM 2610,Organic Chemistry I  ,Four,"This is a first part of a two-semester sequence in organic chemistry. Fundamentals of organic chemistry 
will be studied which include atomic structure, functional groups, acid-base chemistry, chemical 
nomenclature, alkane conformations (Newman configurations, chair conformations), SN2/SN1/E2/E1 
reactions and their mechanisms, alkene reactions and mechanisms, radical reactions and their 
mechanism and general physical and chemical properties of all organic compounds presented herein. 
Additionally, FT-IR, 1H NMR and 13C NMR spectroscopy will be investigated along with mass 
spectrometry. Prerequisite: CHM 1710/1720. Students must enroll concurrently in CHM 2620. Four 
hours. "
CHM 2620,Organic Chemistry I Lab  ,0,"The lab component will cover essential organic chemistry skills that include (but are not limited to) 
melting point determination, acid-base extraction, aqueous extraction, thin-layer chromatography, FT-
IR, 1H NMR and 13C NMR spectroscopic analysis and synthesis, isolation, purification, and 
characterization of a complex organic heterocycle. Must be taken concurrently with CHM 2610. This 
course has a fee for consumables used in its labs. "
CHM 2710,Organic Chemistry II  ,Four,"This is the second part of a two-part sequence in organic chemistry. Reactions and mechanisms are 
covered for alcohols, ketones, aldehydes, carboxylic acids, carboxylic acid derivatives, aromatic EAS and 
NAS reactions, alpha-carbonyl chemistry, and amine chemistry. 1H and 13C NMR and IR spectroscopy and 
MS are heavily utilized. Special topics will include amino acid and nucleic acid chemistry.  Students must 
enroll concurrently in CHM 2720. Four hours. "
CHM 2720,Organic Chemistry II Lab  ,0,"This lab course will heavily utilize modern synthetic organic chemistry research techniques and practices 
such as rotary evaporation, Schlenk glassware, vacuum manifold work, TLC and silica purification 
techniques, and recrystallization. Purified organic compounds will be analyzed by 1H and 13C NMR and IR 
spectroscopy using instrument within our department as well as out-sourcing to an external research 
laboratory. Must be taken concurrently with CHM 2710. This course has a fee for consumables used in 
its labs. "
