code,title,credits,description
COUN 5413,Interpersonal Communication in Counseling and Relationships,3,"Increased knowledge of fundamental patterns for improving communication through language and language patterns allows students to master promoting change-work in individual, couple, marital, and family counseling and coaching. Students would advance their resourcefulness in applying communication to form or enrich relationships. Students would demonstrate an enhanced level of applying communication processes that presuppose a structure of healing assumptions within the communication framework. The range of skills involves students eliciting high-quality information, formulating solution-focused questions, and demonstrating the application of well- organized communication processes in performing counseling and coaching. Students learn to address clients’ mental health and relationship issues by building communication designed to indirectly presuppose meanings that transform limiting thought-frames into positive frames – promoting optimism, hope, and healing attitudes – as the context for beneficial change in clients, drawing from positive psychology, emotional and social intelligence, and neuro-linguistic communication, a range of themes are addressed: Rapport, bonding and connecting, nurturing, attachment and love, compassion, male/ female differences, optimal functioning, and increasing meaning and purpose in life."
COUN 5433,Addiction in the Family Counseling,3,"A major focus of this course is for students to skillfully perform addiction and substance abuse counseling, including adapting individual, group, marital, and family treatment techniques. In addition, an emphasis is given to the acquisition of the competencies for students to apply strength-based therapeutic strategies and interventions incorporating an understanding of biology and addiction across the life span with the treatment of eating disorders, gambling, shopping, sex, other behavioral addictions, and co- occurring mental disorders or disabilities. Additionally, strategies for prevention, retaining sobriety, and relapse prevention of addiction and substance abuse are acquired for working with individuals and families. Finally, students would study processes for addressing the treatment issues and characteristics of diverse racial, ethnic, and cultural populations as well as the social aspects of addiction, including family risks and resiliencies, gender distinctions, and sexual orientation differences."
COUN 5513,Marriage and Family Systems and Treatment,3,"Family therapy has a revolutionary emphasis on systems thinking and the search for identifiable and recurrent family patterns to be explored in this course. Students would examine the history and development of marriage, couple, and family counseling, including foundational theories and principles of family development, the contemporary family, family subsystems, individual and interpersonal relationships, and grasping the influence of larger systems – race, social class, gender, ethnicity, sexual orientation – on the functioning of the family and its individual members. Students would utilize systemic theories to describe problems and structure solutions by acquiring knowledge of the models of marital and family counseling. Students would examine the fundamentals of the family, including adopting a family relationship framework, family development, diversity in family functioning, systems theory and systemic thinking, and the development and practice of family therapy. The range of theories examined includes Psychodynamic models, transgenerational models, experiential models, structural models, strategic models, behavioral and cognitive-behavioral models, social construction models, and population-based family treatments."
COUN 5533,Pharmacology of Drugs of Abuse,3,"The counselor treating addiction and substance abuse requires a strong foundational knowledge of the nature of drugs and their impact. This course focuses

on basic behavioral pharmacology; the behavioral analysis of drug effects; tolerance and conditioning of drug effects; the nervous system and neurological functioning as it relates to psychological disorders, the effects of medications and other substances on the individual’s cognitive, social, emotional, and behavioral functioning; and characteristics of dependence and addiction. In addition, students would examine the pharmacokinetics of drug action(s), the side effects of psychoactive and psychotherapeutic drugs, the development of tolerance, the development of dependency and issues regarding withdrawal, and cross-addiction(s). Additional studies would include The self-administration of drugs, alcohol and its effects, tranquilizers and sedative-hypnotics, inhaled substances, tobacco and nicotine, caffeine and methylxanthines, psychomotor stimulants, opiates, antipsychotic drugs, antidepressants and mood stabilizers, cannabis, and hallucinogens."
COUN 5563,Clinical Psychopharmacology in Counseling,3,"The foundations of therapeutic and behavioral effects of psychoactive drugs are extensively explored in this course. The effects of medications on the nervous system, neurological functioning, cognitive processing, and emotional and behavioral functioning are studied. Decision-making processes for prescribing medications are explained so that counselors can understand the part medications may play in treatment. Organized by disorder and, within each disorder, by medication, this course is designed to familiarize counselors with the basic terminology and models of pharmacokinetics. This study includes research on side effects, contraindications, the efficacy of all major medications prescribed for mental health disorders, and the effects of withdrawing from psychopharmacological medications."
COUN 5613,Marital and Family Treatment Techniques,3,"Couples, marital, and family counselors need to be empowered to apply theoretical concepts and develop real-world skills and essential competencies performed in the roles and setting of counseling with a strong understanding of the structures of marriages, couples, and families. Students are engaged in an active learning process applying family therapy theories using theory-informed case conceptualization, clinical assessment, treatment planning, and progress notes. Students would learn to effectively determine factors to address by identifying clients’ presenting issues in alignment with a set of research-based qualities that promote stable, satisfying, and durable relationships. Students would demonstrate how to apply an array of the following theories: Systemic and Strategic Therapies, Structural Family Therapy, Experiential Family Therapies, Intergenerational and Psychoanalytic Family Therapies, Cognitive-Behavioral and Mindfulness-Based Couple and Family Therapies, Cognitive Interpersonal Therapy, Solution-Based Therapies, Collaborative and Narrative Therapies, Group Treatments for Couples and Families. A range of fundamental relationship skills are studied that counselors can incorporate into their practice: Communication danger signs, handling conflict, problem-solving, clarifying core beliefs and expectations, addressing issues and hidden issues, forgiveness, commitment, preserving and enhancing funds, friendship, and sensuality."
COUN 5643,Addiction and Substance Abuse Counseling Theory and Techniques,3,"The application of theories and techniques of counseling with a special emphasis on models/methods of alcohol and substance abuse/addiction/dependency counseling is important for the addiction and professional counselor. The current treatment research, the application of theoretical models, and the successful methods in the treatment process of addiction and substance abuse are extensively examined. In addition, understanding the causes, social implications, treatment (including the principles and philosophies of self-help), cultural competency, and prevention methods and skills are extensively studied."
COUN 5713,Human Development,3,"The foundation of biological, neurological, and physiological factors and systemic and environmental factors affecting human development, functioning, and behavior is the primary focus of this course. Ethical and culturally relevant strategies for promoting resilience and optimum development and wellness across

the lifespan are included. Students would explore theoretical and research approaches in studying the development of human abilities and behavior throughout the lifespan - childhood, adolescence, and adulthood. Topics include developmental research methodology, variables influencing development, and basic developmental processes in physical, motor, perceptual, cognitive, linguistic, emotional, social, and personality development. Applications of developmental theory to counseling are emphasized."
COUN 5813,Tests and Measurement,3,"Accomplished counselors integrate knowledge and skills in the areas of assessment, evaluation, and testing to perform systematic appraisals of the needs, abilities, and characteristics of clients, couples, and families. Students would synthesize the assessment process to perform accurate differential diagnoses, align theories of counseling for treatment, and utilize the complete assessment and testing process to culminate in writing comprehensive mental health reports and constructing complete treatment plans. Using the essential skills of assessment, students would use test-related statistics, validity, reliability, and test item analysis to systematically evaluate tests and their construction. Students would further enhance their expertise in following rules of administration and interpretation of various assessment instruments, including Intelligence tests, personality instruments, projective tests, neuropsychological tests, and disorder-specific tests."
COUN 5913,Research Methods,3,"Highly qualified counselors comprehend research and the scientific method behind the conclusions presented. Students would compose a well-written research presentation demonstrating an experimental design for a study by constructing a hypothesis clearly delineating dependent and independent variables and explaining the framework for performing the study. The research project would include the significance of the potential impact on mental health research based on a comprehensive review of the literature and an appropriate research design. The nature and design of experimental, observational, quasi-experimental, survey, and correlational studies are examined related to behavioral observation. Students would assess the quality of research studies to include proper design, correct utilization of descriptive and inferential statistics, accurate analysis of the research data, and the appropriateness of the conclusions drawn from the data."
COUN 6133,Multicultural Counseling and Treatment Planning for Individuals and Families,3,"Providing professional counselors with multicultural counseling theory and practices for culturally competent interventions within the broad range of important areas of cultural diversity, along with the in-depth study of factors resulting in diagnostic symptomatology, is a major focus of this course. The scope of cultural diversity includes race/ethnicity, sexual orientation, disability, socioeconomic disadvantage, and military service correlated with how they impact diagnostic interviewing, assessment methods, treatment planning, and the counseling relationship. Significantly enhancing diagnostic interviewing and assessment skills, students would extensively explore the etiology and underlying dynamics of the range of the current DSM diagnosis, design appropriate evidence-based treatment plans, and develop strategies for modifying treatment plans and processes related to cultural diversity."
COUN 6233,Ethics and Professional Studies,3,"The detailed study of the legal and ethical codes for professional licensure establishes a framework for ethical decision-making essential to quality practice. The major focus of the study is the American Counseling Association’s ACA Code of Ethics, along with an investigation of other professional ethical codes. Case studies presenting common dilemmas and conflicts are extensively analyzed to identify potential risks and areas of concern, to recognize the ethical standards involved, and to understand essential principles for preventing ethical violations or properly resolving ethical issues. Students would examine the theoretical and philosophical issues fundamental to fully comprehending the codes. Major themes of study include the following: Professional socialization/relationships, the role of the professional organization, confidentiality and privacy, proper assessment and interpretation of data, supervision and training,

distance counseling, technology, and social media, the legal responsibilities and liabilities involving record keeping, third party reimbursement and other considerations on independent practice and interprofessional cooperation, ethics, and family law. In addition, students would learn advocacy processes for addressing institutional and social barriers that impede client equity and success."
COUN 6333,Advanced Counseling and Psychotherapy Techniques,3,"Applying a range of treatment interventions aligned with the major counseling theories establishes the framework for effective results- oriented counseling. Students would learn to apply counseling theory in real-world settings skillfully by studying theory-specific approaches to case conceptualization and treatment planning. Students would examine the evidence base for each theory and its unique applications for specific culturally and sexually diverse populations. Finally, students would design and perform counseling sessions based on the conceptualization of treatment that incorporates a wide range of treatment interventions. Models for performing treatment can include distress tolerance skills, emotion regulation skills, cognitive thinking strategies, cognitive-behavioral methodologies, belief processing and cognitive reframing, therapeutic relaxation and mindfulness, thinking strategies, experiential change techniques, psycho-physiological methods, and advanced therapeutic language skills."
COUN 6353,Human Sexuality in Counseling,3,"Human sexuality issues are explored, emphasizing assessment and intervention in mental health counseling practice. The course is designed for counselors whose work would bring them into contact with clients experiencing problems and concerns with their sexuality. The course would develop: a) students’ knowledge base related to human sexuality, b) an understanding of the varied sexuality issues which may be encountered in professional counseling practice, c) students’ skills in assessment and intervention skills with sexuality issues, and d) increased awareness of one’s personal perceptions, attitudes and affect related to sexuality issues. As a result, course participants become more effective in identifying, assessing, and intervening with human sexuality-related counseling issues."
COUN 6363,"Community Counseling (3cr.) The fundamental concern of community counseling involves increasing client functioning by providing ways to integrate professional services that accommodate individuals and communities in meeting mental health and social needs. The areas of application can include mental health agencies, organizations and work settings, businesses, families, schools, courts, hospitals, the military, churches, and social institutions. The general goal is for students to learn to promote positive changes, mental health, and empowerment at individual and systemic levels that impact the person and families within community entities.
COUN 6433 Assessment of Individuals and Families in Counseling",3,"Mental health assessment provides the counselor with information for performing correct diagnoses, developing treatment plans, and uncovering the dynamics underlying psychopathology as part of the total assessment of individuals and families. Students would acquire assessment interviewing skills to include biopsychosocial assessment to increase competence in making and explaining diagnoses with assessments relevant to individual counselors as well as marriage, couple, and family counselors. Students would analyze case studies to develop skills for determining the appropriateness of performing assessments, selecting types of assessment instruments, and writing mental health reports. Students would administer and interpret a personality inventory and learn the purpose, basics of interpretation, and rules of administration of various assessment instruments, including Intelligence tests, personality instruments, projective tests, neuropsychological tests, and disorder-specific tests."
COUN 6463,"Clinical Issues of Aging, Death, and Dying (3cr.) Issues of aging, death, and dying from a multidisciplinary perspective. This complex field encompasses various human experiences, emotions, expectations, and realities. This course provides a historical, cultural, biological, sociological, psychological, and spiritual perspective on aging,

death, and dying in our society and worldwide. Information and skills needed to address ethical and legal concerns related to palliative and end-of-life care are presented. Palliative care focuses on symptom control and amelioration of suffering, which are often underemphasized in conventional healthcare training. Theories of grieving and the grief reaction, as well as the empirically-based therapeutic interventions available to support and care for the bereaved, are covered in this course.
COUN 6533 Intervention for Individuals and Families in Crisis and Trauma",3,"Competent professional counselors need to use methods for the practical application of research for professional development in a wider range of human issues and psychopathology. By discovering and providing research-supported information regarding a range of problems, students become proficient in developing quality treatment plans and skilled interventions to increase the coping and resilience of individuals and families confronted with crises and trauma. The range of problem situations and psychopathological issues include Issues impacting marriages (financial, work, dual-careers, in-laws, affairs, partner in prison, disasters, abortion); Children in the family (having children, child-rearing practices, living together); singleness, separation, divorce, second marriages and beyond, blended families, step- parenting, ex-spouse, being a custodial parent, losing custody, family violence and spousal abuse (physical and sexual abuse, child abuse and neglect), addictions and substance abuse, chronic illness, hospitalizations, dying partner, the effect of partner death, the effect of a child’s death, gay and lesbian relationships, impact of mental illness, suicide, and para-suicidal behavior, homicidally, bullying, adolescent acting out behavior, sexuality, and issues of desire, sexual dysfunction, the impact of unemployment and under-employment, impact of changes in the socioeconomic standing of the family."
COUN 6633,Addiction and Chemical Dependency Counseling,3,"This course would examine the historical foundations of chemical dependency counseling and the theoretical and practical acquisition of Models of Addiction and Recovery. Alcoholism and substance abuse; readiness to change; counseling methods, tests, and assessments for chemical dependency; and specific knowledge of alcohol and drug research are the focus of this course. The potential for co-occurring disorders and the impact of addiction on families, marriages, and couples are explored. Strategies are examined to reduce the negative effects of substance use dependence and to help clients identify the impact of addiction on life, the effects of continued harmful use or abuse, and the benefits of a life without addiction. To achieve this, students would evaluate and identify individualized strategies and treatment for different populations, client stages of dependence, and change in recovery."
COUN 6733,Child/Adolescent Psychopathology and Counseling,3,"Students performing differential diagnoses of disorders of childhood and adolescents according to the current DSM, explaining the disorder with an understanding of normative and non-normative aspects of development, and demonstrating the adaptation of a range of counseling theories specifically for working with that population is the primary purpose of this course. Students would examine the principles and practices of developmental psychopathology to comprehend the maladaptive patterns of emotion, cognition, and behavior to formulate treatment plans that promote resilience and optimum development and wellness. Students would apply theoretical models and intervention strategies to address an array of developmental, educational, personal, social, and behavioral problems, including the following: Disasters, crises, trauma, death, violence, divorce, substance abuse, victimization of abuse, or debilitating medical conditions."
COUN 6833,Group Dynamics and Counseling,3,"Applying the various theoretical models to group counseling and analyzing group dynamics in a therapeutic setting is important for the professional counselor. Students would extensively study the basic elements of the group process, deal with ethical and professional issues special to group work, and determine how to apply key concepts and approaches to group counseling. Students would participate in an applied lab activity to

experience the group process, acquire skills in group psychotherapy methods, and demonstrate effective counseling group facilitation. Methods for receiving referrals, adapting groups to various settings, assessing appropriate membership, and preparing participants for receiving appropriate benefits from the group process are presented."
COUN 6863,Psychopathology Diagnostics and Treatment Design,3,"Diagnostic skills comprise a complex set of principles and guidelines. A firm grasp of case conceptualization and hypothesis building supports them. The course would include practice in diagnostic skills, case conceptualization, and treatment planning. This course would build a) a working knowledge of the diagnostic process, including differential diagnosis and the use of diagnostic tools; b) a working knowledge of the diagnostic criteria for mental and emotional disorders; c) an ability to discern pertinent diagnostic information from a case study, assessment, or intake; d) an understanding of the relevance and potential biases of commonly used diagnostic tools as they apply to diverse populations; e) an ability to identify and make use of resources for case conceptualization and intervention; f) an ability to work collaboratively in group diagnostic and treatment teams; and, g) an understanding of culturally relevant diagnostic processes."
