code,title,credits,description
MISE 4213,Configuring Email and Web Services,3,"This course focuses on configuring email and web services in the network. It also details procedures of how to configure a web server, secure a web server, install a Mail server, and secure a Mail server. In addition, students can define roles and policies related to email and web services."
MISE 4403,Project Planning and Implementation,3,"This course provides a foundation for understanding the broad concepts of successful planning, organization, and implementation within software development, enhancement, and recon-figuration. This course uses real-world examples and identifies common mistakes and pitfalls. Topics covered include project scoping, estimating, budgeting, scheduling,

tracking, and controlling."
MISE 4513,Advanced Networks (Routing and Switching),3,"This course studies routers, switches, and other computer and telecommunication network devices. The course would include information on network and routing protocols, local and wide area networks, and VLANs, as well as device configuration, management, and troubleshooting and exploring many of the concepts in the Cisco Certified Entry Networking Technician (CCENT) certification exam. Prerequisites: MISE ϣ203 Basics of Networking"
MISE 4643,Database Management,3,This course would introduce the student to the basics of relational database design. The student would learn to develop a relational database and use structured query language (SQL) to make database calls. The course is designed to provide a student with a useful overview of databases and a strong introduction to SQL. Prerequisites: CMSC ϣ203 Foundations of Programming
MISE 4663,Business Intelligence/Data Analytics,3,"The course would focus on the analysis and modeling of data. A major aspect of a business is to provide a model for management to make sound decisions. The student would learn how to access data, glean applicable information and then present this data in a manner meaningful to decision-makers.      Prerequisites:      CMSC      ϣ203      Foundations      of Programming
MISS [Missions]"
MISS 2203,Introduction to Missions,3,"An introductory study of the biblical basis of missions. Matters relating to the call to mission, the history of missions, and communication in the cultural context are explored. Offered every fall semester."
Miss 2303,"models of home, urban, and foreign missions’ ministry",3,A study of the major issues and forces on the mission’s scene today. Features an investigation into various models of ministry which have been used in various mission contexts with a view to developing models of mission ministry for the coming decade. Offered on demand.
MISS/SOCI 2243,Introduction to Cultural Anthropology,3,"A study of people's cultures worldwide, including the principles behind Human the various aspects of culture. The course is designed to provide an understanding of cross-cultural problems, which can assist in more effective communication of the Gospel and a better understanding of the person’s  culture.  Prerequisites:  SOCI  ϣϣ03  and PSYC  ϣϣ03.  Offered spring semester: Odd-numbered years."
MISS/PMIN/SOCI 3023,World Religions and Heretical Movements,3,"A study of the major living religions of today: Animism (Folk Religions), Hinduism, Buddhism, Confucianism, Shintoism, Taoism, Islam, and Judaism. Also, some typical American cults are included. Offered fall semester: even-numbered years."
MISS/SOCI 3203,Social Work in the Church,3,A survey of the special efforts of the church in the field of social work in the alleviation of human needs. Attention is given to the church’s role in world cultures' rapidly changing social structures and the manifestation of the Gospel through Christian   charity.   Prerequisites:   SOCI   ϣϣ03   and   ϣ203.   Offered   fall semester: even-numbered years.
MISS 3243,Church Planting,3,A study of the need for planting new churches and some typical methods used in this work. Prerequisite: PMIN ϣϣ03.  Offered spring semester: odd numbered years.
MISS/HUMN 3303,World Religions in America,3,"This course focuses on the world’s major religions – Islam, Buddhism, Hinduism, and Animism – within an American context. Utilizing a comparative religions approach, and would seek to provide an intellectual and experiential understanding of these faiths’ theology and worship. Of special interest are adapting these religions to an American setting and cultural interactions with these faiths."
MISS 3403,Cross-Cultural Communications,3,"A study of communicating the Christian message cross-culturally. Special attention

is given to cultural adaptations of Christianity in the light of Biblical faith. Concerns related to cross-cultural living are also explored. Offered spring semester: even-numbered years."
MISS 4513,Internship,3,"Guided field experience in Missions ministry. All students anticipating a career in the mission’s enterprise are encouraged to participate. Prerequisite: Twelve (ϣ2) hours in Missions. Offered on demand.
MKTG [Marketing]"
MKTG 3103,Principles of Marketing,3,"An introduction to the marketing of goods and services in advanced market economics; study of the marketing mix, pricing, distributional activities, consumer behavior, and marketing research."
MKTG 3143,Consumer and Market Behavior,3,A study of personal and group behavior patterns in acquiring goods and services in the marketing environment. Prerequisite: MKTG 3ϣ03.
MKTG 3243,Marketing Analytics,3,"This course focuses on analytics utilized specifically by digital marketers to give students the expertise to initiate, participate in, manage, and evaluate marketing analytics. In addition, students can apply principles and practices of data collection and analysis by performing A/B testing and web analytics, requiring them to make critical marketing analytics decisions. Prerequisite: MKTG 3ϣ03."
MKTG 3253,Digital Marketing Channels,3,"Students would delve into major digital advertising and product promotion channels such as Search Engine Optimization (SEO), Search Engine Marketing (SEM), Pay Per Click (PPC), and mobile advertising. Lead generation, revenue generation, and digital influence are topics of discussion. Students would develop digital channel campaigns and seek certification from the most current and relevant platforms."
MKTG 3263,Marketing Research and Reporting,3,"Marketing Research would help students understand customers and markets deeper through research design, research projects, data analysis, and reporting. Emphasis is placed on presenting findings, insights, and recommendations to key stakeholders."
MKTG 3273,Professional Selling in Marketing,3,"Professional Selling goes beyond sales by teaching students how to strategically manage customers through CRM (Customer Relationship Management) analytics and by managing the salesperson’s performance through KPIs (Key Performance Indicators). It would also focus on day-to-day salesperson operations such as planning and setting goals, how to use prospecting methods such as phone calls, video emails, and social media, and creating product proposals. Finally, it comes complete circle with teaching students how to meet customers’ needs by asking effective questions, resolving concerns, and creating individualized value. As well as negotiating effectively, closing deals, and managing customers post- purchase through account management."
MKTG 3313,Sports Marketing,3,"This course prepares students to develop the skills necessary to address marketing issues specific to the sports industry. Students would analyze the sports field in terms of mainstream marketing practices, applications, and strategies."
MKTG 3413,Mobile Marketing,3,"The Mobile Marketing world is fluid and ever-changing. Students would learn how to leverage mobile audiences, mobile apps, and mobile advertising, among other key concepts. Students would analyze case studies that demonstrate the marketing concepts and demonstrate how they are applicable to real life."
MKTG 3513,Personal Branding,3,"Your personal brand is the intentional process of creating an identity for yourself or your business. This course provides students with the tools for creating and sustaining a successful personal brand. Learning to grow as an influencer, using proper brand voice, creating brand-specific content, and evaluating brand partnerships are topics covered in this course."
MKTG 3533,Brand and Product Management,3,"An introduction to advertising and sales promotion, including the various communication channels used to spread product information about goods, services, and ideas to prospective customers."
MKTG 3713,Services Marketing,3,"This course focuses on the distinctive problems and characteristics of marketing in service organizations. Students would learn how to manage customer expectations, discover service design processes, and receive hands-on experience by setting up a service and learning how to deal with obstacles and changes as they develop."
MKTG 4113,International Marketing,3,"In an increasingly global economy, digital marketers need a global perspective to better respond to international opportunities. Topics include an overview of cultural, social, ethical, legal, and political environments. Special emphasis on global distribution, pricing, promotion, sales, international market entry, social responsibility, market planning, and strategy."
MKTG 4603,Social Media Marketing,3,"Students are educated and trained in social media marketing to attract engagement, develop brands, generate revenue, monitor reputations, and communicate and influence target audiences. The course would include key performance metrics, platforms, and the steps necessary to develop a successful social media campaign."
MKTG 4803,Content Marketing,3,"Content marketing has become the backbone of digital marketing through engagement, branding, storytelling, lead generation, email marketing, and numerous other channels. Students would learn how to effectively generate content, measure impact and evaluate content-focused campaigns."
MKTG 4923,Internship,3,"This course is an opportunity to earn upper-division marketing credit while learning about marketing careers and gaining real-world experience in the workplace. This internship would provide credit for learning by enrolling in internship hours. In addition, students would work with their advisors on a plan for accountability and direct reporting of observational and direct labor experiences. Prerequisite: Advanced standing and approval of the Program Director.
ML [Master of Arts Leadership]"
ML 5143,Leadership Theory and Practice,3,"This course explores the history and development of leadership theory in the students’ current organizational settings. Although leadership and management are not the same, they are often confused. The unique features of each are studied along with a practical application of case studies of current leaders as well as from history. Managers develop subordinates, leaders develop followers, and the most highly successful leaders develop leaders. Students would evaluate their leadership style using the Leadership Practices Inventory developed by Kouzes and Posner. Students would gain hands-on experience by analyzing their performance in a current or new leadership role."
ML 5153,Public Budgeting and Finance,3,Examines how to develop successful fiscal policy initiatives. A sufficient understanding of the technical material and the political processes involved in making tax and spending policy. Economic policy and its impact on a state or municipality are studied.
ML 5163,Training and Development,3,"This course addresses the core aspects of instructional systems design as applied to workforce learning and performance. Learners apply key principles involved in assessing, designing, developing, implementing, and evaluating employee development and performance improvement programs. Learners gain hands-on experience by creating an active training event."
ML 5233,Public Policy Implementation,3,Examines the ethical implementations of public law. Develops an understanding of different analytic strategies for assessing if a program is being instituted as designed and is reasonably connected to its articulated goals.
ML 5243,Leading Change,3,"Leaders often attempt changes that they believe are critical to the survival of the organization only to find those changes are resisted by the very people the leader is attempting to help. People's response to change depends on the degree to which they understand the need for change, are involved in the change process, and understand the implications the change has for their roles. This class explores the processes necessary to identify the need for change using appropriate models, plan the process of change, obtain authorization for the change and motivate the appropriate stakeholders to ensure success."
ML 5253,Legislative Process and Behavior,3,"Facilitates a better understanding of the: workings of the federal and state government; legislative process; the relationship between bicameralism, federalism, and the republican form of government; and the roles of elected representatives and the legislative staff."
ML 5263,The Adult Learner,3,"Learners explore the basic theories and current research in adult education. This class draws from both adult development and adult education to explore the stages of human development, issues concerning adult learning ability, how and why adults learn, and how to make sure that learning has taken place."
ML 5273,Nonprofit Leadership,3,"This course examines the unique leadership challenges and opportunities presented in nonprofit organizations. Students would learn about the nature of the nonprofit sector and gain perspectives on management, financial, leadership, and governance issues facing nonprofits."
ML 5343,Financial Development and Resource Management,3,"Leaders must be able to find the money to fund the budget for the planned programs to accomplish the mission of the group they are leading. Funding, budgeting, and financial accountability are prerequisites to organizational success. This class explores the skills necessary for budgeting, stewardship, donor development, funding, accountability, and ethical use of resources. While not an accounting course, the differences between for-profit, not-for-profit, and cash flow accounting requirements are explored."
ML 5353,Decision Making,3,"Leadership decisions must often be made with incomplete evidence. This course provides an understanding of various forces which influence the process of making and implementing decisions. Students would learn leadership decision- making from individual, small group, and social environment contexts, as well as the values of good decisions and the unintended consequences of poor decisions."
ML 6023,Integrative Leadership Project,3,"This course serves as a capstone for the MA Leadership program. In addition, students would complete an application project related to their emphasis and field of interest.
MUSI [MUSIC THEORY]"
MUSI 1101,Basic Musicianship Lab,1,"The Basic Musicianship Lab would consist of a series of lectures and video presentations dealing with the subject of music theory. It would include a portion of musical rehearsals to help musicians develop their rehearsal skills. A basic course dealing with the nomenclature, notational symbols, and organization of music."
MUSI 1103,Basic Musicianship,3,"A basic course deals with nomenclature, notational symbols, and music organization. Drills to acquaint the student with sight singing and keyboard. Approximately one-third of the time is used to develop basic conducting skills for congregational singing and knowledge of hymnology. Designed for the non-music majors with insufficient background to begin MUSI 2ϣ02. The course does not count toward the music requirements for the music major. Offered every semester."
MUSI 1113,Appreciation of Music and Fine Arts,3,"Contribution of the arts in the historical past to the present. There is some discussion of methods and procedures involved in creating an ""art."" Offered fall

semester: odd-numbered years."
MUSI 2001,Music Theory I Lab,1,"The Music Theory Lab would consist of a series of lectures and video presentations dealing with music theory. In addition, it would include a portion of musical rehearsals to help musicians develop their rehearsal skills. A basic course deals with nomenclature, notational symbols, and music organization. Writing melody based on the development of a motive, triads, inversions, tonal (V-I) and modal bases, harmonic progression, the structure of the phrase and period, non-harmonic tones, and writing for various non- transposing instruments and voices."
MUSI 2101,Aural Skills I,1,"Basic techniques of dictation, sight singing, and rhythmic reading. To be taken concurrently with MUSI 2ϣ02. Offered every fall semester."
MUSI 2102,Music Theory I,2,"Melody writing is based on the development of a motive, triads, and inversions, tonal (V-!) and modal bases, harmonic progression, the structure of the phrase and period, non-harmonic tones, writing for various non-transposing instruments and voices, text setting, keyboard, ear training, and sight singing drills. To be taken concurrently with MUSI 2ϣ0ϣ. Offered every fall semester."
MUSI 2201,Aural Skills II,1,"Sight-singing and dictation of major and minor scales, intervals, triads, rhythmic groups, and tonal melodies. To be  taken  concurrently  with  MUSI  2202.  Prerequisite:  MUSI  2ϣ0ϣ  or passing grade on placement examinations. Offered every spring semester."
MUSI 2202,Music Theory II,2,"Imitation and rhythmic independence in 2, 3, and 9 voice writing; second inversion triads, cadences; harmonic rhythm; modulation using a pivot chord; seventh and ninth chords; instrumental transposition, keyboard, ear training, and sight singing drills.  To  be  taken  concurrently  with  MUSI  220ϣ.  Prerequisite:  MUSI 2ϣ02. Offered every semester."
MUSI 3151,Conducting,1,"A practical course designed to prepare the music major for basic conducting patterns. The course includes a survey of the history of hymnology and some emphasis on the planning of services. Considerable emphasis is given to the practical physical aspects of conducting, leading to advanced conducting skills. Prerequisite: Approval by the Chair. Offered fall semester: even-numbered years."
MUSI 3251,Advanced Conducting,1,Continued emphasis on the techniques and skills required for the conducting of graded choirs. Choral literature of cantatas and major choral works are examined and evaluated. Practical experience in choir directing is included. Some emphasis is given to the skills required in instrumental directing. Prerequisite: MUSI 3ϣ5ϣ. Offered spring semester: odd numbered years.
MUSI 3301,Aural Skills III,1,"Sight-singing and dictation of chromatic chords, rhythmic groups, more difficult tonal melodies, and four-part work. To be taken concurrently with"
MUSI 3302,Music Theory III,2,"Sequence, eleventh, and thirteenth chords, including augmented and Neapolitan sixth chord, melodies, and harmonies with other bases, including the serialization of pitch, alto, and tenor clefs, keyboard, ear training, and sight singing drills. To be taken concurrently with MUSI 330ϣ. Prerequisite:"
MUSI 3403,Counterpoint,3,"Two, three, and four-voice contrapuntal writing after the style of Bach (l8th Century). Prerequisite:"
MUSI 3422,Piano Pedagogy,2,"Stressing comprehensive musicianship in the teaching of piano. Methods of teaching harmony, transposition, repertoire, and technique to the earliest beginner utilizing peer interaction for maximum results. Methods of establishing good business policies are also covered. Offered on demand."
MUSI 3501,Vocal Pedagogy,1,"Vocal Pedagogy is the study of the anatomy and acoustics of the voice with a survey of teaching materials,

and solo and ensemble repertoire intended for music education majors, performance majors, and choral directors. This course would provide the vocal student with a deeper understanding of the vocal process, physiology, and nature of the vocal mechanism."
MUSI 3522,Survey of Piano Literature,2,"An overview of the important repertoire for solo piano from the Baroque to the present. The various genres of composition written for the piano are traced, and students are expected to insightfully and sensitively critique various recordings and performance studies in this class. Prerequisite: Permission of the instructor is required to enroll. Offered on demand."
MUSI 3602,Singing Diction,2,"A study of the sounds and rules of pronunciation of English, Italian, and Latin and their application to song texts and libretti. Offered on demand."
MUSI 3611,Vocal Diction,1,"Vocal Diction focuses on learning correct singing diction in English, Italian, Latin, German, and French through the learning and use of the International Phonetic Alphabet. Students would learn to use the International Phonetic Alphabet, in which one symbol stands for a single sound, to “translate” pronunciation in each of the five languages studied from the orthographic letters into the IPA, applying this usage to the performance of standard and contemporary art song and choral repertoire."
MUSI 3622,Vocal Diction II,2,This class would study the proper pronunciations for lyrics of German and French musical literature. The student is expected to effectively apply these guidelines in their own speech and singing.
MUSI 4201,Survey of Sacred Music Literature,1,"This course is a study of the history and development of hymns and music texts in the church with a specific focus on the hymnology of the Church of God. Consideration would also be given to hymns written in the 20th  and 2ϣst centuries. Texts are evaluated on the criteria of the worthy subject, literary quality, rhythmic flow, rhyme scheme, metrical patterns, and matching texts to music."
MUSI 4212,History and Literature of Music I,2,Ancient to ϣ600. A survey of Western art music from its origins in classical Greek culture through the contrapuntal techniques of the ϣ6th century. Development of awareness of styles and formal procedures through the study of represented composers and works. Prerequisite: Junior in standing. Offered every fall semester.
MUSI 4222,History and Literature of Music II,2,Baroque to Classical (ϣ600-ϣ825). This course is a continuation of History and Literature I with a focus on Ancient to ϣ600 with emphasis on the Baroque and Classical eras.   A   survey   of   Western   art   music   from   ϣ600   through   ϣ825. Development of awareness of styles and formal procedures through a study of representative composers and works. Prerequisite: Junior in standing in Music. Offered every spring semester.
MUSI 4243,Music Ministry,3,"A course for the music major with a specific emphasis on meeting the particular problems a student would face as a minister of music in the local church. Emphasis is given to his role as minister, personnel relationships, development of graded choir program, evaluation of music, establishing a music library, and other ways the full church music program can be developed to help the entire congregation reach its full potential in Christian worship. Prerequisite: Junior/Senior standing. Offered spring semester: even-numbered years."
MUSI 4262,Vocal Literature,2,"Vocal Literature introduces art song literature for the solo voice. The repertoire in Italian, German, French, English, Spanish, and Russian are included. The main emphasis is on songs for the solo voice; some examples from opera, oratorio, and vocal chamber music will also be discussed."
MUSI 4301,Aural Skill IV,1,"Sight-singing and dictation of advanced chords, altered chords, and tonal harmonies. Error detection in listening examples and an introduction to tuning. To be taken concurrently with"
MUSI 4302,Music theory  IV,1,"Modern cords, diatonic modes,

pentatonic scales, alternate harmonies, atonal analysis, twelve-tone serialism, new directions in twenty-first-century music and keyboard, ear training, and sight singing drills. To be taken concurrently with MUSI 930ϣ. Prerequisite:"
MUSI 4702,Arranging,2,This course studies arranging for various vocal ensembles with particular emphasis on functional church music. Prerequisite:
MUSI 4903,Honor Studies,3,"Honor Studies in Music are open only to students with initiative and capability in individual study and research. The course is designed to allow students to do advanced work in an area of particular interest to them under the supervision of a selected faculty member. The course instructor must approve the course's offering and its format. All work must be completed within one regular semester or one summer. Prerequisite: 90 hours and instructor and school chair approval. Offered on demand.
NATS [Natural Science]"
NATS 2301,Plant Biology Lab,1,Laboratory experiences designed to facilitate understanding of the principles of plant biology studied in
NATS 2303,Plant Biology,3,"A survey of the morphology, anatomy, physiology, biochemistry, and genetics of plants emphasizes the similarities and differences that exist among the various types of plant life. Offered on demand."
NATS 2501,Introduction to Meteorology Lab,1,"Laboratory experiences are designed to facilitate an understanding of the relationship between geography and weather and the tools used to forecast weather. Students would examine different types of weather data and how they are collected. Additionally, students would compile and present weather and climate data."
