code,title,credits,description
GEOG 232,North American Geography,3,"This course surveys the establishment, expansion and regional development of the United 
States, Mexico and Canada using a geographical perspective. It is designed to help students 
understand North American social, political, economic and cultural developments within a 
continental geographic context. A sample of the topics explored: cultural encounters, territorial 
acquisitions, transportation, economic development, political development, impacts upon the 
environment and landscapes and the rise of regional identities."
GEOG 233,Physical Geography,3,"This course provides an introduction to the processes involved in the formation of the 
earth’s physical environment. Emphasis is on ecosystemic studies of flora, fauna, weather, 
climate, vegetation, soils and land forms."
GEOG 234,Geography and Global Cultures,3,"This course provides an introduction to the study of the interrelationships of humans and the 
earth’s physical environment. The themes of culture regions, diffusion, ecology, integration and 
landscape are explored on a global, national and regional level."
GEOG 236,Geographical Information Systems (GIS),3,"This course will teach the basic skills and applications of Geographic Information Systems. 
The emphasis will be on techniques used in geography and in other disciplines, such as biology, 
political science and sociology. Prerequisite: GEOG 131 or GEOG 231 or sophomore standing."
GEOG 331,Borderlands: Geography of Mexico and Texas,3,"This course will look at how the physical environment has shaped and continues to shape 
people’s lives and culture in the area under consideration. While the course is tailored for 
educators, particularly those who will be teaching in a bilingual/bicultural environment, it 
will benefit all students interested in human culture, the environment and the interaction 
of the two. Prerequisite: Sophomore standing."
GEOG 336,Advanced Geographic Information Systems (GIS),3,"This course builds on the principles introduced in GEOG 236 and presents a continued and in-
depth examination of techniques of spatial data and analysis, modeling, project planning and 
management. Prerequisite: GEOG 236."
GEOG 379,Special Topics in Geography,3,"An in-depth analysis of selected topics and regions in geography to be announced at the time 
of scheduling the course. May be repeated for credit when topics are changed. Prerequisite: 
Sophomore standing."
GEOG 380,Urban Geography,3,"This course will cover the major geographical forces at work in the development of cities and their 
hinterlands. Students will learn the locational aspects of urbanization, the functions of and 
relationships among and between cities and their relationship to rural areas along with the 
internal structure of urban areas. The course will also introduce basic concepts in modern 
urban planning, including the role of citizens in the process. Prerequisite: Sophomore standing. 
GEOG 419-429-439. Internship in Geography (X:X:X) 
Opportunity for geography minors to use their geographical skills, tools, and knowledge in a 
supervised work environment. Working with an advisor, students must arrange an internship 
with a public or private agency. No more than 3 credit hours may be applied toward the 
geography minor. Prerequisite: departmental approval."
GREK 131,Elementary Greek I,3,"The essentials of New Testament Greek with emphasis on inflectional forms, grammar and 
basic syntax."
GREK 132,Elementary Greek II,3,"Continuation of the essentials of New Testament Greek with emphasis on inflectional forms, 
vocabulary and basic syntax. During the last two weeks of the semester, portions of the Gospel 
According to John and of 1 John will be read and studied in Greek. Prerequisite: GREK 
131."
GREK 231,New Testament Greek Reading,3,"Reading and study of the Gospel According to Mark and portions of the Gospel According 
to Matthew in Greek. Grammar review and development of an effective Greek New Testament 
vocabulary. Introduction to basic exegetical methods. Prerequisite: GREK 132."
GREK 232,Advanced New Testament Greek Reading,3,"Reading and study of the Gospel According to Luke in Greek. Exegetical methods will be 
applied to the texts. Prerequisite: GREK 231.
GREK 310, 320, 330. Directed Study in Greek (X:X:X)
GREK 410, 420, 430. Independent Study in Greek (X:X:X)"
HEBR 131,Biblical Hebrew Language and Culture I,3,"The essentials of Biblical Hebrew with emphasis on vocabulary, inflectional forms, basic syntax 
and simplified Hebrew prose."
HEBR 132,Biblical Hebrew Language and Culture II,3,Continuation of HEBR 131. The Book of Ruth is read in Hebrew.
HEBR 231,Biblical Hebrew Language and Culture III,3,"Further study of Hebrew grammar. Reading and discussion of significant portions of Biblical 
Hebrew prose and poetry."
HEBR 232,Biblical Hebrew Language and Culture IV,3,"Reading and discussion of more difficult portions of Biblical Hebrew prose and poetry, together 
with modern Hebrew prayers and liturgies.
HEBR 310, 320, 330. Directed Study in Hebrew (X:X:X)
HEBR 410, 420, 430. Independent Study in Hebrew (X:X:X)
Consult with instructor before registering. May be repeated for credit. 1 to 3 hours credit. 
Prerequisite: intermediate proficiency in the Hebrew language. 

FREX 134 (HONR) Exploring the Arts and Sciences (3:3:0) 
A special honors section of FREX 134 designed to meet the orientation needs of entering first-year 
honors students as well as to fulfill the core course requirement. Offered each fall 
term. (Non-
freshmen appointees receive a waiver from the honors section of this course, but need to take FREX 
134 for graduation.) Offered every fall term. Prerequisite: First-year Honors student. This course will 
meet the additional competency of Civic Engagement. 
THEO 133 (HONR) Introduction to Theology (3:3:0) 
An examination of basic affirmations of the Christian faith. Attention is given to the 
origin and development of key theological concepts. Emphasis is placed upon the 
contemporary significance of theological reflection. Offered every spring term. Enrollment 
is limited to members of the TLU Honors Program. This course will meet one additional 
competency as determined by the Theology Department. 
HONR 331: Directed Readings in the Subject Areas (3:X:0) 
An interdisciplinary readings course. From a list submitted by faculty members, honors students 
select a book from each of the liberal education dimensions: humanities/arts, 
social 
science/cross-cultural, natural science and personal well-being/theology. During the term, 
students and faculty meet in small groups to discuss the books, identifying discipline-specific 
societal or cultural issues. Students submit a paper for each book they have read. This course 
should be taken during the sophomore year. Offered every fall term. Prerequisite: FREX 134H. 
HONR 332: Interdisciplinary Team-taught Seminar (3:3:0) 
Team-taught by two tenure-track faculty members from two different disciplines. Drawing 
on their academic disciplines and personal interests, the two instructors determine the topic 
for the course. Students will study the topic as a group and, after identifying major issues, 
each student will construct his/her own project in which a course-related issue is examined 
from the students’ disciplinary perspective. In consultation with the instructors, students 
will develop a research plan for the project, which will include examination of the subject from 

multiple perspectives, identification of conflicting arguments within the discipline, and analysis 
of credible data. Students 
will present their final evaluation of the issue as both a formal paper and a class 
presentation. This course is offered each spring term and should be taken during the junior 
or senior year. Prerequisite: Junior standing. 
HONR 431: Senior Honors Capstone Seminar (3:3:0) 
A capstone interdisciplinary course for honors students during their senior year. Honors students 
from various disciplinary specialties research and examine a topic determined by the instructor. 
Pre-registered honors students, in consultation with the instructor, select resources and 
determine assignments for the course. Subsequent to studying the agreed-upon resources, 
students will work in small groups, each comprised of representatives from multiple academic 
disciplines, to identify an issues-based problem and to strategize, research, evaluate and suggest 
solutions. The results of the project will be presented both orally and in written form and 
will include suggestions for a community-based service project, which would help to ameliorate 
the problem. Offered each fall and spring term. Prerequisite: Senior standing."
ISYS 133,Applications Software,3,"This is a hands-on class taught in the computer lab. Topics include: operating systems 
(Windows), word-processing, use of spreadsheets, databases and the internet. Designed for noncomputer science majors."
ISYS 231,Introduction to Information Systems,3,"As an introduction to information systems (IS), it is the goal of this course to present the core 
of IS principles that every IS student should know. Topics include hardware, software, networks, 
internet, transaction processing and ethical issues."
ISYS 232,Business Spreadsheet Applications,3,"Designed to teach students how to solve a wide range of accounting and business application 
problems using a popular spreadsheet. All aspects of a mature spreadsheet, such as MSExcel, 
will be explored. Topics will include main spreadsheet features, valid data entry, data filter and 
queries, formulas and built-in functions, macros, pivot tables, database functions and brief 
discussions of Visual Programming Language. This class will allow students to apply highly 
effective tools to produce good decisions including the goal seeking scenarios and solver 
capabilities of a spreadsheet."
ISYS 332,System Analysis & Design,3,"This course will examine strengths and weaknesses of the typical system development life cycle 
including: evaluation of system request, analysis of current systems, paradigms of system design 
including program development verses utilizing preexisting modules, deployment of systems, 
testing, maintenance and documentation. Students will apply what they learn to a useful project 
that will require them to go through each phase of a system design and implementation. Students 
must retain their work to be used in future classes. Prerequisite: ISYS 231."
ISYS 333,Electronic Commerce,3,"This course investigates electronic commerce theories, models and strategies needed to 
successfully build and manage E-Commerce applications. Students will learn how to make 
sound decisions regarding what type of technology is used to plan, analyze, design and implement 
an E-commerce application. Topics will include web-based business applications, web 
marketing, accounting practices for E-Commerce, E-Commerce security, planning a virtual 
business presence and ethical and legal issues. Prerequisite: CSCI 136 or 248 and at least 3 hours 
of 300 level BUSI or CSCI or ISYS credit
EDUD 731A. Organizational Leadership Theory & Practice (3:3:0) 
This core course explores over-arching topics from organization leadership theory and 
practice. Topics to be discussed include organizational structures, organizational cultures, 
motivation, recognizing individual differences, decision making, creativity, leading groups 
and teams, exercising power, managing conflict, working with a community, job 
satisfaction, and other work attitudes. Specific organizational contexts, such as healthcare, 
business, nonprofit and educational institutions will be explored through case studies and/or 
projects. 
EDUD 731B. Leadership for Transformational Change & Innovation (3:3:0) 
This core course explores critical topics from education leadership theory and practice. 
Topics to be discussed include the school environment, school structures and culture, 
motivation, recognizing individual differences, decision making, creativity, leading groups 
and teams, exercising power, managing conflict, working with community and parents, job 
satisfaction and other work attitudes."
EDUD 733,Communication & Leadership,3,"This core course explores the importance communication has in leadership. Students integrate 
communication theories to formulate effective ways to convey their ideas. Topics discussed 
include 
understanding 
an 
audience, 
non-verbal 
communication, 
organizational 
communication, communication technology, cross-cultural communication, and using 
language to achieve leadership goals."
EDUD 734,Leadership & Ethics,3,"This core course explores the ethical foundations that inform the leader's personal and 
professional practices. Students will examine ethical theories and assess concepts applied to 
leadership challenges in real world situations. Emphasis will be placed on understanding 
ethical leadership for social and organizational change, the leader's role as a moral agent, as 
well as the organization's role as a moral agent in society."
EDUD 735,"Leadership, Diversity, and Cultural Intelligence",3,"This core course explores the ideas of leadership, diversity, and cultural intelligence from 
multiple lenses and perspectives. Topics discussed include supporting diversity and cultivating 
cultural and emotional intelligence for leadership effectiveness in multicultural settings. 
Students will reflect on their own experiences with diverse populations."
EDUD 736,Data-Driven Decision Making for Leaders,3,"This core course explores the process of making organizational decisions based on actual data 
rather than intuition or observation alone. The process involves forming questions that need to 
be answered, identifying appropriate data sources, cleaning and organizing data, performing 
analysis, and drawing sound conclusions. The process of communicating data to those involved 
in decision-making will also be covered. 
EDUD 784A. Women & Leadership (3:3:0) 
This elective course will explore women's leadership and leadership styles. The course will 
also investigate the challenges and obstacles women may encounter in a variety of careers and 
their possible causes. Students will utilize texts and scientific articles focusing on the 
structural, cultural, psychological, institutional, organizational, political, personal, economical, 
and financial issues facing women leaders today. Students will reflect on their own experiences 
and how gender influences their leadership style and perceptions of the leadership.  
EDUD 784B. Power Dynamics & Toxic Leadership (3:3:0) 
This elective course explores the topic of toxic leadership and its impact on co-workers within 
an institution or workplace. Students will examine the how this type of dysfunctional and 
harmful leadership style affects productivity as well as possible ways to mitigate the toxicity 
and work toward a more positive environment.  
EDUD 784C. Global Leadership (3:3:0) 
 
This elective course explores leadership through a global lens. Student will learn about 
personal and professional competencies related to effective leadership in a global, diverse, and 
multicultural world."
EDUD 831,Qualitative Research Design,3,"This research design course explores qualitative research theory and practice. Students will 
learn about conducting, analyzing, and interpreting qualitative data for social and behavioral 
research. Methods of application through both critique and planning one's own research are 
included in this course."
EDUD 832,Quantitative Research Design,3,"This research design course explores quantitative research design including, research topics, 
questions, concepts, foundational statistical tests, survey design and other data collection 
methods. Students will learn to read and interpret quantitative results, and it will inform leaders 
and those who intend to pursue quantitative dissertations."
EDUD 833,Applied Research Design,3,"This research course provides the foundation for applied research design for both qualitative 
and quantitative methods. Students will explore the selection of the appropriate research design 
for particular research problems, and some methodological challenges with various research 
methods. Other topics discussed include sampling, data gathering, data analysis, and data 
interpretation. The goal of this course is to prepare students with the knowledge to conduct 
their own applied research project."
EDUD 871,"Dissertation I: Framing the Research Study: Topics, Problems, Purpose",3,"In this dissertation course students will narrow their topic, write research question(s), choose 
a committee, and complete a draft of their introduction for chapter 1."
EDUD 872,Dissertation 2: Literature Review & Theoretical Foundations,3,"In this dissertation course students will focus on writing their literature review for chapter 2 
and editing their introduction for chapter 1.  
EDUD-873. Dissertation 3: Methodology & Approach to Data Collection & Analysis (3:3:0) 
In this dissertation course students will focus on their research design and methods for chapter 
3. They will continue editing chapters 1 and 2. By the end of this course, students should be 
ready to submit and defend their dissertation proposal. Students complete their IRB in this 
class and submit it once the proposal is approved. 
EDUD-874. Dissertation 4: Data Collection (3:3:0) 
This dissertation course is taken after the dissertation proposal has been approved. Students 
will work writing chapter 4 data gathering and analysis. If additional time is needed, students 
may take dissertation IV more than once. (16-week course). 
EDUD-875. Dissertation 5: Data Analysis, Results, and Implications (3:3:0) 
In this dissertation course students will analyze and interpret their data and write their chapter 
5 conclusion. (16-week course). 
EDUD-876. Dissertation Defense (3:3:0) 
Students register for this course the semester they defend their dissertation."
ARTS 130,Introduction to the Arts,3,"An interdisciplinary course, in some cases team taught, that covers special topics across the 
fields of Dramatic Media, Music, and Visual Arts. The course is designed as a general 
education course suitable for non-majors."
HUMA 130,Introduction to the Humanities & Cultures,3,"An interdisciplinary course, in some cases team taught, that covers special topics across the 
fields of African American Studies, Communication, English, History, Mexican American 
Studies, Modern Languages, Philosophy, Theology, and Women’s Studies. The course is 
designed as a general education course suitable for non-majors."
INTR 113,Developing Scholars Seminar,1,"This course enhances student learning outcomes by supporting the academic success of 
undergraduate students who are readmitted to enroll, on academic probation, whose grade 
point average for a semester is below average (Academic Warning), or others who would 
like extra assistance. Students will address time management, motivation, study and learning 
strategies as well as learn to use academic resources. A total of three credits may be earned. 
The course helps students develop good study practices, improves learning outcomes, and 
increases the likelihood of persistence and graduation. 
INTR 211, 212, 311, 312. Krost Seminar (1:X:X)
Topics included in this seminar are related to well-being and health and enable students to 
explore these areas in greater depth. The course may be used for elective or subject area 
credit only and is open to any student, but particularly for students who participate in the 
Krost testing program. The course may be repeated to include three different topics. (211, 
311 for fall; 212, 312 for spring.) Past topics have included “Called to Make a Difference”
and “Volunteerism” taught by the campus pastor."
INTR 378,Practicum in Academic Tutoring & Supplemental Instr,3,"An introduction to the nuances of peer tutoring. Focusing on the general topics of learning 
theory, this course will show how various learning styles can be integrated in helping 
tutors/SIs lead peers to become more active in their own learning, developing study skills 

and understanding of course materials. Topics on cultural awareness and inter-cultural 
communications will also be covered, as well as group management skills."
INTR 431,Senior Thesis,3,"This course will focus on a research project that brings together two or more disciplines as 
outlined on the student’s degree plan. Open only to majors in Interdisciplinary Studies."
NSCI 140,Introduction to the Natural Sciences,4,"The goals of this course are to introduces non-science majors to the scientific method and 
increase science literacy using the Earth as a focus of study. The discussion will incorporate 
the disciplines of geology, chemistry, and biology as we investigate the various spheres of 
the Earth including the lithosphere, hydrosphere, atmosphere, and biosphere. The class will 
investigate cycles of the Earth’s systems and the interrelationships and feedback loops 
between systems. The course will be a broad-brush overview of the sciences applied to the 
Earth and students will be encouraged to examine environmental data and think critically 
about environmental questions and problems. The course will be complimented by handson lab work allowing students to investigate the environment around us using a scientific 
approach."
SSCI 130,Introduction to the Social Sciences,3,"An interdisciplinary course, in some cases team taught, that covers special topics across the 
fields of Criminal Justice, Economics, Geography, Political Science, Psychology, and 
Sociology. The course is designed as a general education course suitable for non-majors."
INTL 214,Cross-Cultural Reflections,1,"This course is open to all students recently returning from study abroad programs but is 
required of students just returning from at least a semester (fall or spring) of study abroad. 
Students must take the course after each semester studied abroad. The course is designed to 
help students readjust to U.S. culture and to contextualize their international experiences. 
Themes will include, but not be limited to exploration of experiences before, during and 
after study abroad, and the literature of cross-cultural experience will be consulted. 
Credit/No credit grading."
INTL 231,Global Perspectives,3,"This interdisciplinary course introduces global issues, stressing interdependence and 
focusing on topics including but not limited to national security, human rights, 
environmental issues, economic development and cross-cultural awareness.
INTL 431: Interdisciplinary Capstone Course for International Studies Major
Students will fulfill this requirement via registration in a departmental capstone course, with 
approval of the instructor and their international studies major advisor. Research topic should 
be interdisciplinary and appropriate to the capstone discipline chosen as well as to 
international studies."
KINS 122,First Aid and Medical Self Help,2,"Course is designed to provide the students with an overview and basic understanding of the body 
systems and the injuries, diseases, and illnesses that can affect these systems. Emphasis is 
placed on recognition and management of emergency situations and development of 
appropriate skills. A lecture/lab format is used. Upon completion of the course, the student may 
become certified by the American Red Cross in advanced First Aid and adult CPR."
KINS 130,Prevention and Care of Athletic Injuries,3,"An introduction and overview of the field of athletic training. Emphasis will be placed on 
gaining the knowledge and practical skills necessary to manage athletic injuries. Topics to 
include injury recognition, taping/wrapping, wound care, injury treatment, modality use and 
rehabilitation."
KINS 131,Personal Well-Being,3,"This course is designed to facilitate student understanding of and appreciation for personal well-
being, including an emphasis on healthy decision making, lifelong fitness, nutrition and personal 
management. Activities and assignments provide opportunities to establish habits conducive to 
optimal wellbeing and quality of life."
KINS 135,Foundations of Kinesiology,3,"Historical development of programs in sport, fitness and physical education. Principles and their 
application in planning a modern physical education program. 
KINS 211P. Practicum in Athletic Training (1:1:X) 
This course is intended for sophomore level students who are enrolled in the athletic training 
educational program. This is a laboratory-based course designed to begin instruction of 
clinical proficiencies in athletic training. Emphasis will be placed on clinical proficiencies in 
 
the areas of clinic operations, acute care, protective taping, risk management and pharmacology 
procedures. 
KINS 212P. Practicum in Athletic Training (1:1:X) 
This course is intended for students who are enrolled in the athletic training educational 
program. This is a laboratory-based course designed to give instruction and evaluation of 
specific clinical proficiencies in athletic training. Emphasis will be placed on proficiencies in 
the areas of protective taping, risk management and specific injury management. Evaluation 
of proficiencies will be performed in the areas of clinic operations, acute care, protective 
taping, risk management and pharmacology procedures. Prerequisite: KINS 211P. 
KINS 220, 230, 320, 330. Directed Study (2-3:2-3:0) 
Individualized study in topics of special interest under the supervision of a faculty member."
