code,title,credits,description
SPAN 133,Spanish for Health Professions,3,"This course is designed to teach health professionals in the United States how to 
communicate with patients whose primary language is Spanish. It will serve the needs of TLU 
students entering the nursing program as well as members of the community seeking to learn 
Spanish to use in the medical field. The course will focus on the most common and practical 
communication needs such as: intake information, personal and family history, diagnosis of 
chief complaint, basic requests and commands, friendly greetings and farewells, and insurance 
and billing information. For students pursuing majors in the medical sciences only. Prerequisite:"
SPAN 131,"SPAN 210, 220, 230; 310, 320, 330. Directed Study (X:X:X) 
See the section in this bulletin entitled “Special Studies,” and consult the Spanish instructor 
for details. Prerequisite: SPAN 232 or above. 
SPAN 231. Spanish Language and Culture III",3,"While integrating language and culture, classroom activities focus on conversational strategies 
in a wide range of concrete contexts likely to be encountered in the Spanish speaking countries. 
Students read short texts about concrete topics and write coherent paragraphs in past, present 
and future time frames. Prerequisite: SPAN 132 or SPAN 133 or equivalent."
SPAN 232,Spanish Language and Culture IV,3,"Continued emphasis on concrete discourse strategies in practical and social situations, with an 
introduction to those strategies needed to sustain a more complex conversation. Cultural clichés 
and realities are further explored through a variety of readings and classroom activities. 
Students write short descriptive and narrative essays. Prerequisite SPAN 231 or equivalent."
SPAN 338,Latin American Literature in English Translation,3,"Readings in English translation from the vast literary treasure of Latin America. The readings 
may include the works by Nobel Prize laureates such as Gabriel García Márquez, Miguel 
Angel Asturias, Octavio Paz, Gabriela Mistral and Pablo Neruda, as well as other world-
renowned writers: Jorge Luis Borges, Carlos Fuentes and Isabel Allende. Prerequisite: COMP 
131, 132, FREX 134, SPAN 375, 376 or instructor’s permission."
SPAN 375,Oral Communication in Spanish,3,"This course is for students who wish to improve their ability to speak Spanish. While the student 
will read and write in this class, the goal of the course is to produce a student who can speak 

and understand Spanish fluently and comfortably. Topics for discussion will come from various 
media sources: television, radio, movies, the internet, magazines, guest lectures, etc. Prerequisite: 
SPAN 232 or instructor’s permission."
SPAN 376,Written Communication in Spanish,3,"This course offers students the opportunity to improve their reading and writing skills 
in Spanish. The students will read texts and write coherent narrative essays using advanced 
Spanish grammar skills. Prerequisite: SPAN 232, 375 or instructor’s permission."
SPAN 377,Spanish Literature from Its Origins through the Golden Age,3,"This course examines the literature of Spain from the 12th through the 17th centuries, including 
the origins of primitive lyrical and epic poetry, early masterpieces of narrative prose and the 
beginnings of Spanish drama. Prerequisite: SPAN 375, 376 or instructor’s permission. 
SPAN 378 Spanish Literature from 18th Century to the Present (3:3:0) 
This course studies the literature from Spain beginning in the 18th century  and continuing 
until nowadays. Literary movements such as Enlightenment, Romanticism and Realism will 
be covered, as well as the Spanish Época de Plata (generación del 98, 14 y 27), post-war 
works and literature from the post- Franco period. Some of the authors studied in this 
course include Cadalso, Larra, Espronceda, Bécquer, Galdós, Unamuno, Machado, García 
Lorca, Miguel Hernández, Cela, Carmen Laforet, Pérez- Reverte, Muñoz Molina and Rosa 
Montero. Prerequisite: SPAN 375, 376 or instructor’s permission."
SPAN 379,Special Topics,3,"Special monographic topics to be taught as special topics courses include, but are not limited 
to, Ruben Darío and the Modernist Poets; Postmodernist and Feminist Voices in Spanish 
American Literature; Memory, Community and Identity in Contemporary Latin American 
Literature, Latin American Short Story, Latin American Essay. Prerequisite: SPAN 375 or 
instructor’s permission. 
SPAN 410, 420, 430. Independent Studies (X:X:X) 
Independent study courses in Spanish studies are individualized study courses under the 
supervision of a Spanish faculty member. The topic chosen by the student and approved by 
the faculty member and department chair must be sufficiently delimited to permit oral and 
written reports at the expected proficiency of 400 level. Consult the Spanish instructor for details. 
Prerequisite: SPAN 376 or above. 
SPAN 419, 429, 439. Internships (X:X:X) 
Designed to provide Spanish majors and minors experience using their Spanish in a work 
environment. See department chair for further information. Prerequisite: SPAN 375, 376 or 
instructor’s permission."
SPAN 434,Latin American Literature from Its Origins to the Present.,3,"This course studies the literary work by early explorers/chroniclers, Colonial, Independence, modern 
and Contemporary authors of Latin America. Prerequisite: SPAN 375, 376 or instructor’s 
permission."
SPAN 473,Art & Literature of the Mexican Revolution,3,"A course devoted to the comprehensive study of the circumstances, events and consequences 
of the Mexican revolution from a variety of perspectives including, but not limited to, 
literature, film, plastic and performing arts, and social, cultural and political changes. 
Prerequisite: SPAN 375, 376 or instructor’s permission."
SPAN 475,Research Seminar,3,"A research course for advanced students (open to juniors and seniors) involving intensive reading 
and writing on selected topics from literature, linguistics or cultural aspects of the Spanish-
speaking world, including the Spanish-speaking communities of the United States. This is a 
required capstone research course for Spanish majors. Prerequisite: any two courses from the 
following: SPAN 377, 378, 434, 473, 477 or ENGL 377."
SPAN 477,Women Writers of Latin America,3,"This course is a survey of the lives and literature written by women of Latin America from its 
origins through the 21st century. Prerequisite: SPAN 375, 376 or instructor’s permission. 

STATISTICS COURSES:"
STAT 374,Statistics,3,"Topics will include organization and presentation of data, correlation and linear regression, an 
introduction to probability and probability distributions such as binomial 
and normal 
distributions, sampling distributions, hypothesis testing and estimation involving one and two 
populations. Statistical software such as Minitab will be used as a tool in this course. Counts as 
a course toward a minor in MATH but does not count as upper-division MATH course. 
Prerequisite: MATH 130 or 133."
STAT 375,Applied Statistics,3,"Two population estimation and hypothesis testing, multinomial experiments and contingency 
tables, analysis of variance, multivariable and nonlinear regression, inferences about the 
correlation coefficient and slope of the regression line probability distributions such as Poisson’s, 
Uniform, Exponential and Gamma distributions and Nonparametric Statistics. Real data and 
statistical packages such as Minitab will be used extensively in this course. (Counts as a course 
toward a minor in MATH, as an upper- division MATH course.) Prerequisite: STAT 374."
THEO 133,Introduction to Theology,3,"An examination of basic affirmations of the Christian faith. Attention is given to the origin 
and development of key theological concepts. Emphasis is placed upon the contemporary 
significance of theological reflection. Offered every fall and spring."
THEO 231,Moral Problems in Theological Perspective,3,"A survey of contemporary moral problems viewed from theological perspective. Students will learn 
how theological commitments shape moral judgments and an understanding of the moral life. 
Topics covered will be selected from the following: human sexuality, just war theory, theories of 
justice and human rights, the death penalty, medical ethics, business ethics, the nature and 
meaning of work. Prerequisite: THEO 133."
THEO 234,Foundations of Youth Ministry,3,"A general introduction to congregation-based youth ministry through an examination of 
theology/philosophy of youth ministry, adolescent development, social trends and 
characteristics of the adolescent culture, an overview of “Asset Building” in youth, 
appropriate roles and recruiting/training techniques  for  adult  sponsors  and  holistic youth 
ministry program development. Prerequisite: 3 hours of theology."
THEO 235,Faith Active in the World,3,"This course is designed for non-majors and addresses current issues in the interface between 
Christian faith and contemporary culture. The focus topic will vary, but it will address issues 
basic to the mission of Texas Lutheran University, such as living lives of faithfulness, faith 
and reason, faith and popular culture, faith and literature and Christian faith and other faiths. 
Prerequisite: THEO 133."
THEO 238,Religion in the United States,3,"A survey of religious traditions, attitudes and practices in the United States. Students experience 
worship with major religious groups and explore the historical roots and beliefs of those 
groups. Broad themes, such as religious freedom, civil religion, humanism and fundamentalism 
are also addressed, using current events and students’ own experiences as resources in addition 
to the textbook and other assigned readings. Prerequisite: THEO 133."
THEO 276,Theologies of the Civil Rights Movement,3,"An analysis of the Civil rights Era as a time of controversy within American Christianity. Students 
will compare the diverse theological orientations of the various participants in this controversy: 
from nonviolent Civil Rights activists to white ""moderates"" to white terrorists to Black Power 
leaders. Students will reflect on what this theological history means for Christians confronting 
social injustice today. Also offered as AFAM 276."
THEO 322,Youth Gathering and Service-Learning Event Planning,2,"A study of the global denominational histories, principles, applications, structural 
organization, methodologies, theologies and biblical foundations involved in the planning and 
implementation of judicatory youth gatherings  and  congregation based service-learning 
opportunities. Includes 25 hours of practical field experience. Prerequisite: 6 hours in theology."
THEO 331,Christian Ethics,3,"An introduction to Christian ethics as a distinct discipline within theology. Special attention 
is given to the relationship between fundamental theological commitments and ethical judgment. 
Topics will be selected from the following: love (agape) as a basis for Christian ethics, the place 
of natural law reasoning in Christian ethics, the relationship between the doctrine of justification 
and virtue ethics, the relationship between Christology and social ethics and problems of 
ecumenism. Prerequisite: THEO 133."
THEO 332,Old Testament Studies,3,"A general introduction to the Old Testament with special emphasis upon the historical setting, 
the literary forms and the major theological concerns of the literature as a whole. Prerequisite:"
THEO 133,THEO 333. New Testament Studies,3,"A general introduction to the New Testament with special emphasis upon the historical setting, 
the literary forms and the major theological concerns of the literature as a whole. Prerequisite:"
THEO 133,THEO 334. History of Religions,3,"An examination of the sacred as an element in the structure of consciousness in some 
representative cultures of the past and present, along with a study of the origins, 
development, doctrines and practices of some of the most significant world religions, such as 
Hinduism, Buddhism, Judaism, Christianity and Islam. Prerequisite: THEO 133."
THEO 335,Ancient and Medieval Christian History,3,"A survey of the history of Christianity, with particular emphasis on the theological 
development of the Church from the apostolic period to the eve of the 16th century 
Reformation. Prerequisite: THEO 133."
THEO 336,Reformation and Modern Christian History,3,"A history of Christianity, in both its old and New World manifestations, from the 
Reformation to the present. Prerequisite: THEO 133."
THEO 337,Luther and the Lutheran Tradition,3,"A study of the life, thought, and work of Martin Luther. Reading and discussion of Luther’s 
most influential writings. Prerequisite: THEO 133."
THEO 370,Applications and Methodologies of Youth Ministry,3,"A practical examination of methodological understandings, effective ministry among middle 
school youth, verbal and nonverbal communication skills, youth ministry and “the law,” active 
listening skills, personal leadership styles, leadership development within youth, job interview 
skills and contract negotiations and print and media resource assessment and acquisition. 
Prerequisite: THEO 234."
THEO 371,Biblical Spiritualities of Suffering,3,"This course will dive deeply into biblical texts to consider how specific religious subjects in the 
scriptures experienced suffering and reflected on their faith and theology in contexts of extremity. 
We will then put these biblical periscopes into conversation with contemporary issues of suffering and 
events of extremity. Through lecture, discussion, and meditation on specific concerns of contemporary 
theodicy, we will consider the theological implications of God’s silence in the midst of horrors depicted 
in Scripture and ways that people of faith can approach sacred narratives that show practices of faith 
and resistance in the face of violence, grief, racism, poverty, conflict, and injustice. Prerequisite: THEO 
133."
THEO 372,Interpreting the Bible,3,"An examination of ways in which the Bible has been interpreted throughout history, as well as a 
creative exploration of new possibilities for interpreting the Bible in the social, cultural and 
political contexts of today. Prerequisite: THEO 133."
THEO 373,Judaism,3,"A study of historical, cultural and theological developments within Judaism, with special emphasis 
on 20th century experiences of anti-Semitism, the Holocaust, the nation Israel, religious pluralism 
and Jewish-Christian dialogue. Prerequisite: THEO 133."
THEO 374,Hispanic/Latino Theologies,3,"This course provides an introduction to theologies that are being developed by Hispanic 
theologians in the United States. Authors from a variety of Christian theological 
perspectives will be read as they address issues of historical and contemporary context, theology, 
biblical interpretation and ministry. Prerequisite: THEO 133."
THEO 379,Special Topic,3,"May be repeated for credit when the topics are changed. Offered on demand and subject to 
availability of staff. Prerequisite: THEO 133. 
THEO 410, 420, 430. Independent Study (X:X:X) 
Designed for students wishing to pursue a special research topic in theology under 
departmental supervision. Subject to approval of instructor and department chairperson. 
THEO 419, 429, 439. Internship in Theology (X:X:X) An individually designed 
practical  experience course  in the methods and  problems of professional staff workers in 
the church. The course will usually be conducted as a laboratory course and will be primarily 
in-service training. The number of credit hours will be determined by the range and scope of 
the project but could vary from one credit for a small project to three credits per semester 
for an internship. This course can be taken only after consultation with the chair of the 
department and submission of an acceptable project proposal. May be repeated for credit, up 
to a total of 6 semester hours."
THEO 433,New Testament Theologies,3,"An investigation of the message of the New Testament in the light of contemporary 
scholarship. Special attention is given to the Christological significance of the kerygma. 
Prerequisite: THEO 333."
THEO 434,Senior Seminar,3,"The capstone course to help theology majors integrate and explore the vocational 
implications of what they have learned in theology through a course structured around 
the sub-disciplines of scriptural studies, historical theology, systematic theology, Christian ethics 
and practical theology. The class will culminate in a documented paper and presentation. Required 
of all seniors who plan to graduate with a major in theology."
THEO 437,Contemporary Theologies,3,"An introduction to current religious thought through a study of the nature of the theological 
task today, representative theologies, theologians and their historical roots. Since this course 
reflects current theological issues, specific content may vary from year to year. Prerequisite: 6 
hours of theology."
WOST 131,Introduction to Women’s & Gender Studies,3,"Drawing from many disciplines (literature, psychology and history, among others), this course 
provides an introduction to the forces that shape contemporary women’s lives. It is designed to 
question “common sense” notions of gender and look at how our ideas about what it means to be 
a woman are shaped by race, class, popular culture and public policy. Cross-listed with SOCI 131."
WOST 336,Poverty and Discrimination,3,"This course explores how the discipline of economics can explain and analyze the causes 
and effects of poverty and discrimination on various parts of the population. Students will 
be introduced to economic theories of poverty and discrimination, ways to measure each 
(and the problems associated with these measures), and a description of the success and 
failures of public policies designed to curtail discrimination in the US. Prerequisite: ECON 
237 or instructor approval. 
WOST 410, 420, 430. Women’s & Gender Studies Independent Study (X:X:X)
Designed for students wishing to pursue a special research topic in women’s studies. Subject to 
approval of instructor and program chairperson.
WOST 419, 429, 439. Internship in Women’s & Gender Studies (X:X:X)
Opportunity to work in an appropriate setting under close supervision. Subject to approval 
of instructor and program chairperson"
ACCT 510-520-530,"Independent Study in Accounting (X:X:X) 
Independent study by students majoring in accounting. Departmental approval required. 
Prerequisite: Admission to graduate program. 
ACCT 519-529-539. Accounting Internship (X:X:X) 
Designed to provide graduate accounting students with an opportunity to apply their classroom 
knowledge in a real business or firm and to gain hands-on experience. No more than three hours 
may be counted toward the major. Department approval required. Prerequisite: Admission to 
graduate program. 
ACCT 531. Corporate Tax",3,"A study of the tax laws and regulations applicable to the formation, operation and liquidation 
of corporations and pass-through entities, including partnerships and S corporations together 
with the preparation of federal tax returns for such entities. Prerequisite: Admission to 
graduate program."
ACCT 532,Accounting for Govt & Not-for-Profit Organizations,3,"A study of accounting, budgeting, fiscal procedures and financial records of governmental funds, 
colleges and universities, health care entities and private nonprofit organizations. Prerequisite: 
Admission to graduate program."
ACCT 533,Advanced Accounting,3,"A study of business combinations, international accounting, consolidated statements, SEC 
reporting and partnerships. Prerequisite: Admission to graduate program."
ACCT 534,Advanced Tax Practice,3,"Advanced topics in taxation, including Federal tax practice and procedures, ethics and 
responsibilities in tax practice, Circular 230, AICPA Statements on Standards for Tax Services, 
tax-exempt organizations, estate and gift taxation and income taxation of estates and trusts. 
Prerequisite: Admission to graduate program; BUSI 476 or BUSI 531 Corporate Tax."
ACCT 535,Financial Statement Analysis,3,"Review and analysis of financial position and results of operation utilizing corporate annual 
reports and Forms 10K, including analysis of liquidity, operating efficiency, profitability and 
solvency. Prerequisite: Admission to graduate program."
ACCT 536,Accounting Theory and Research,3,"A study of accounting pronouncements and current issues in financial accounting, including 
the Accounting Standards Codification, Statements of Financial Accounting Concepts and 
International Financial Reporting Standards. Emphasis on research and analysis of accounting 
standards and written communications, including the preparation of a major research paper 
integrating multiple sources of accounting information. This course is writing intensive. 
Prerequisite: Admission to graduate program."
ACCT 537,Contemporary Accounting Topics,3,"Research and analysis of current issues in accounting, problem solving and communication 
in a professional environment. Prerequisite: Admission to the graduate program."
ACCT 538,Advanced Financial Reporting,3,"A study of advanced issues in financial reporting including debt and equity funding, 
preparation and analysis of financial statements considering conditions of the changing economic 
and regulatory environment. Prerequisite: Admission to the graduate program."
ACCT 571,Accounting Ethics,3,"The study of ethical theory and its application to business decisions, ethical issues in 
accounting and business, codes of ethical conduct and ethical decision making. Prerequisite: 
Admission to graduate program."
ACCT 572,Advanced Auditing,3,"Current issues and research in auditing, attestation and financial disclosures. Prerequisite: Admission 
to graduate program."
ACCT 573,Tax Research,3,"Tax research methods using an online research database and summarizing of research results. 
Focus will include development of skills in identifying problems, interpreting facts, locating 
appropriate authority, conducting research, and preparing memos and reports to communicate 
results. Prerequisite: Admission to graduate program; BUSI 476 or ACCT 531."
ACCT 574,Data Analytics in Accounting,3,"Development of a data analytics mindset and skills for accounting professionals. Students learn to apply 
tools necessary for data analysis, data visualization, and communication of insights to decision makers. 
Prerequisite: STAT 374 and ISYS 232."
ACCT 579,Special Topic in Accounting,3,"Designed for graduate accounting students. May be repeated for credit when topics change. 
Prerequisite: Admission to graduate program. 

BUSI 510-520-530. Independent Graduate Study in Business (X:X:X) 
Independent study by graduate students. Departmental approval required. Prerequisite: 
Admission to graduate program."
BUSI 531,Investments,3,"A study of the environment and tools of investment. Emphasis on securities markets; fixed-
income securities, common stock, and derivatives; portfolio construction; investment 
management and tax considerations. Reports and presentations on current periodical research 
and participation in a portfolio management exercise are required. Prerequisite: Admission to 
graduate program."
BUSI 532,Advanced Corporate Finance,3,"A study of the theories and methods used to determine the market value of firms through 
risk-based discounting of expected future cash flows; covers both projection of free cash flows 
to investors as well as selection of discount rates based on anticipated risk; international risk 
management also considered. Prerequisite: Admission to graduate program. 
BUSI 533 Operations Management (3:3:0) 
Management of the operations function of both manufacturing and service organizations: how to 
make decisions about product, processes, location, layout, inventory control, supply chains, 
quality, scheduling and job design. Prerequisite: Admission to graduate program."
BUSI 579,Special Topics in Business,3,"Designed for students pursuing a graduate degree. May be repeated for credit when topics 
change. Prerequisite: Admission to graduate program."
ECON 531,"Money, Banking and Financial Markets",3,"Study of the U.S. monetary system with emphasis on the commercial banking system, the 
operation and policies of the Federal Reserve System, monetary theory and the operation of 
financial markets. Prerequisite: Admission to graduate program."
ECON 532,Intermediate Microeconomics,3,"Study of consumer and business behavior, and of markets, including: demand theory, cost 
theory, market types, game theory and time and uncertainty. Prerequisites: Admission to graduate 
program."
ECON 533,Intermediate Macroeconomics,3,"Study of principal theories of income determination in both the short and long run and 
analysis of fiscal and monetary policy impacts on prices and output. Prerequisite: Admission 
to graduate program."
ECON 534,International Economics and Finance,3,"An introduction  to  the  theory  of  international  trade  and  finance  with  emphasis on 
contemporary applications. Commercial policy issues confronting the U.S. are considered, 
as are exchange rates and international capital flows. Prerequisites: Admission to graduate 
program."
AFAM 236,African American Literature,3,"A study of African-American literature from colonial America to the contemporary with an 
emphasis on intersectionality. Readings may include slave narratives, literature of the Civil 
Rights Movement, and women’s writings. Also offered as ENGL 236."
