code,title,credits,description
ACCT 531,Corporate Tax,3,"A study of the tax laws and regulations applicable to the formation, operation and liquidation 
of corporations and pass-through entities, including partnerships and S corporations together 
with the preparation of federal tax returns for such entities. Prerequisite: Admission to 
graduate program."
ACCT 532,Accounting for Govt & Not-for-Profit Organizations,3,"A study of accounting, budgeting, fiscal procedures and financial records of governmental funds, 
colleges and universities, health care entities and private nonprofit organizations. Prerequisite: 
Admission to graduate program."
ACCT 533,Advanced Accounting,3,"A study of business combinations, international accounting, consolidated statements, SEC 
reporting and partnerships. Prerequisite: Admission to graduate program."
ACCT 534,Advanced Tax Practice,3,"Advanced topics in taxation, including Federal tax practice and procedures, ethics and 
responsibilities in tax practice, Circular 230, AICPA Statements on Standards for Tax Services, 
tax-exempt organizations, estate and gift taxation and income taxation of estates and trusts. 
Prerequisite: Admission to graduate program; BUSI 476 or BUSI 531 Corporate Tax."
ACCT 535,Financial Statement Analysis,3,"Review and analysis of financial position and results of operation utilizing corporate annual 
reports and Forms 10K, including analysis of liquidity, operating efficiency, profitability and 
solvency. Prerequisite: Admission to graduate program."
ACCT 536,Accounting Theory and Research,3,"A study of accounting pronouncements and current issues in financial accounting, including 
the Accounting Standards Codification, Statements of Financial Accounting Concepts and 
International Financial Reporting Standards. Emphasis on research and analysis of accounting 
standards and written communications, including the preparation of a major research paper 
integrating multiple sources of accounting information. This course is writing intensive. 
Prerequisite: Admission to graduate program."
ACCT 537,Contemporary Accounting Topics,3,"Research and analysis of current issues in accounting, problem solving and communication 
in a professional environment. Prerequisite: Admission to the graduate program."
ACCT 538,Advanced Financial Reporting,3,"A study of advanced issues in financial reporting including debt and equity funding, 
preparation and analysis of financial statements considering conditions of the changing economic 
and regulatory environment. Prerequisite: Admission to the graduate program."
ACCT 571,Accounting Ethics,3,"The study of ethical theory and its application to business decisions, ethical issues in 
accounting and business, codes of ethical conduct and ethical decision making. Prerequisite: 
Admission to graduate program."
ACCT 572,Advanced Auditing,3,"Current issues and research in auditing, attestation and financial disclosures. Prerequisite: Admission 
to graduate program."
ACCT 573,Tax Research,3,"Tax research methods using an online research database and summarizing of research results. 
Focus will include development of skills in identifying problems, interpreting facts, locating 
appropriate authority, conducting research, and preparing memos and reports to communicate 
results. Prerequisite: Admission to graduate program; BUSI 476 or ACCT 531."
ACCT 574,Data Analytics in Accounting,3,"Development of a data analytics mindset and skills for accounting professionals. Students learn to apply 
tools necessary for data analysis, data visualization, and communication of insights to decision makers. 
Prerequisite: STAT 374 and ISYS 232."
ACCT 579,Special Topic in Accounting,3,"Designed for graduate accounting students. May be repeated for credit when topics change. 
Prerequisite: Admission to graduate program. 

BUSI 510-520-530. Independent Graduate Study in Business (X:X:X) 
Independent study by graduate students. Departmental approval required. Prerequisite: 
Admission to graduate program."
BUSI 531,Investments,3,"A study of the environment and tools of investment. Emphasis on securities markets; fixed-
income securities, common stock, and derivatives; portfolio construction; investment 
management and tax considerations. Reports and presentations on current periodical research 
and participation in a portfolio management exercise are required. Prerequisite: Admission to 
graduate program."
BUSI 532,Advanced Corporate Finance,3,"A study of the theories and methods used to determine the market value of firms through 
risk-based discounting of expected future cash flows; covers both projection of free cash flows 
to investors as well as selection of discount rates based on anticipated risk; international risk 
management also considered. Prerequisite: Admission to graduate program. 
BUSI 533 Operations Management (3:3:0) 
Management of the operations function of both manufacturing and service organizations: how to 
make decisions about product, processes, location, layout, inventory control, supply chains, 
quality, scheduling and job design. Prerequisite: Admission to graduate program."
BUSI 579,Special Topics in Business,3,"Designed for students pursuing a graduate degree. May be repeated for credit when topics 
change. Prerequisite: Admission to graduate program."
ECON 531,"Money, Banking and Financial Markets",3,"Study of the U.S. monetary system with emphasis on the commercial banking system, the 
operation and policies of the Federal Reserve System, monetary theory and the operation of 
financial markets. Prerequisite: Admission to graduate program."
ECON 532,Intermediate Microeconomics,3,"Study of consumer and business behavior, and of markets, including: demand theory, cost 
theory, market types, game theory and time and uncertainty. Prerequisites: Admission to graduate 
program."
ECON 533,Intermediate Macroeconomics,3,"Study of principal theories of income determination in both the short and long run and 
analysis of fiscal and monetary policy impacts on prices and output. Prerequisite: Admission 
to graduate program."
ECON 534,International Economics and Finance,3,"An introduction  to  the  theory  of  international  trade  and  finance  with  emphasis on 
contemporary applications. Commercial policy issues confronting the U.S. are considered, 
as are exchange rates and international capital flows. Prerequisites: Admission to graduate 
program."
AFAM 236,African American Literature,3,"A study of African-American literature from colonial America to the contemporary with an 
emphasis on intersectionality. Readings may include slave narratives, literature of the Civil 
Rights Movement, and women’s writings. Also offered as ENGL 236."
AFAM 276,Theologies of the Civil Rights Movement,3,"An analysis of the Civil rights Era as a time of controversy within American Christianity. 
Students will compare the diverse theological orientations of the various participants in this 
controversy: from nonviolent Civil Rights activists to white ""moderates"" to white terrorists 
to Black Power leaders. Students will reflect on what this theological history means for 
Christians confronting social injustice today. Also offered as THEO 276."
AFAM 333,The Civil War and Reconstruction Eras,3,"This course explores the causes, course, and consequences of the American Civil War, from 
the 1840s through the 1870s.  The course will examine the following themes: the crisis of 
union and disunion; slavery, race, and emancipation; the experience of modern, total war for 
individuals and American society;  the political and social challenges of Reconstruction; and 
the question of why the Civil War era has a unique hold on American historical memory.  
Prerequisite: sophomore standing. Also offered as HIST 333."
AFAM 335,The African-American Freedom Struggle,3,"This course explores the efforts of African Americans to achieve civil rights beginning in the 1860s 
through the present day. In addition to providing a broad chronological and thematic framework 
for understanding the movement, this course will also introduce students to a diverse array of 
primary sources that will help develop an understanding of the major themes of the Civil Rights 
Movement and familiarize students with some of the major historiographical interpretations of 
the period. Also offered as HIST 335. Prerequisite: sophomore standing."
AFAM 336,Poverty and Discrimination,3,"This course explores how the discipline of economics can explain and analyze the causes 
and effects of poverty and discrimination on various parts of the population. Students will 
be introduced to economic theories of poverty and discrimination, ways to measure each 
(and the problems associated with these measures), and a description of the success and 

failures of public policies designed to curtail discrimination in the US. Prerequisite: ECON 
237 or instructor approval."
AFAM 339,History of Southern Africa,3,"This course examines the rich complexity of southern Africa, its varied cultures and diverse 
societies. By interpreting primary and secondary sources, students explore the impact of 
European colonization on Southern African societies, examine the interactions of various 
settler groups and indigenous societies and trace the socio-economic changes wrought by 
South Africa’s incorporation into the industrial-capitalist world system.  In the second half 
of the course, students do research to examine the rise and fall of apartheid and assess Nelson 
Mandela’s role in the process of creating a modern multicultural state. Special attention will 
be given to analyzing different ideologies and strategies that shaped the liberation struggle 
as well as the question of how gender has shaped and still shapes the identities of South 
Africans and their social interactions. Prerequisite: sophomore standing. Also offered as"
HIST 339,VART 131. Drawing 1,3,"Drawing for potential art majors as well as those with little or no previous drawing 
experience. Basic concepts emphasizing the formal elements of drawing. Media include pencil, 
charcoal and pen and ink."
VART 136,Art Appreciation,3,"A basic course in art appreciation and perception. Concepts common to painting, sculpture, 
architecture and the minor arts are stressed through lecture sessions."
VART 138,Design I,3,Introduction to the formal elements of design and principles of visual organization.
VART 231,Drawing II,3,"Theory and practice in the elements of drawing with emphasis on the human figure. 
Prerequisite: VART 131 or consent of instructor."
VART 232,Computer Design I.,3,"Introduction to graphic design on the computer using Adobe Photoshop and Illustrator. There 
are no prerequisites for this course and it is open to all students without prior knowledge of 
computer imaging software."
VART 233,Painting I,3,"Introduction to painting media and techniques. Personal expression through pictorial 
organization is stressed."
VART 235,Sculpture I,3,"Fundamental techniques and 3-dimensional concepts in producing sculpture in clay, plaster 
and other materials."
VART 237,Printmaking I,3,"Introduction to printmaking media and techniques. Personal expression through pictorial 
organization is stressed."
VART 238,Visual Literacy,3,"Designed for the non-major, this course introduces students to the contemporary challenges 
of reading, comprehending, and creating visual communication in an expanded sense. 
Students are introduced to a common language for describing visual communication and then 
apply rules to create and analyze a wide variety of content. Best practices for a variety of 
applications including quantitative graphical forms, photography, advertising, and motion 
graphics are applied in lab using Power Point, Excel, Photoshop, and Illustrator."
VART 272,Ceramics I,3,"Basic techniques in forming, decoration, and firing pottery. Emphasis on hand-building with 
introduction to wheel thrown forms."
VART 273,Art Concepts,3,Basic art activities in a variety of media and materials for teachers of all grades.
VART 274,Art History of the Western World I,3,"A survey of painting, sculpture and architecture from prehistory through 1400. Non- Western 
art traditions included. Artistic styles, individual artistic achievements and cultural contexts 
will be examined."
VART 275,Art History of the Western World II,3,"A survey of painting, sculpture and architecture from 1400 through the present. 
Movements in style, achievements of artists and cultural contexts will be examined. (Note: 
VART 274 is not a prerequisite)"
VART 332,Drawing III,3,"Continuation of VART 231, with emphasis on further investigation of drawing concepts and 
structure. Prerequisite: VART 131, 231 or consent of instructor."
VART 333,Painting II,3,"Emphasis on development of personal style, specialized concepts and techniques. 
Prerequisite: VART 233 or consent of instructor."
VART 335,Sculpture II,3,"Emphasis on development of personal style, specialized concepts and techniques related to 3-
dimensional art. Prerequisite: VART 235."
VART 336,Design II,3,Color theory as well as concepts related to 3-dimensional form.
VART 337,Printmaking II,3,"Emphasis on development of personal style, specialized concepts and techniques. 
Prerequisite: VART 237 or consent of instructor."
VART 339,Watercolor,3,"Investigation of composition, color, techniques and materials related to watercolor."
VART 372,Ceramics II,3,"Continuation of VART 272 with further emphasis on wheel thrown forms, introduction to glaze 
calculations with emphasis on individual expression through combinations of hand-building 
and wheel throwing. Prerequisite: VART 272 or consent of instructor."
VART 378,Photography,3,"Introduction of historic, nontraditional and alternative methods of creating photographic 
imagery with the use of medium format film."
VART 379,Special Topics,3,"Designed to provide specialization in various media taught in the department. 
VART 410, 420, 430. Independent Study (X:0:X) 
Independent research in the visual arts under departmental supervision. Prerequisite: Consent 
of instructor."
VART 414,Senior Seminar I (Capstone research course),1,"The course is to be taken by senior art majors one semester prior to graduation. The student 
will outline a course of research that includes critical aesthetic and ethical reading in order 
 
to fully develop a body of visual art for public display either on or off-campus. Through the 
writing and individual and group critiques of studio work, students will rigorously examine 
the work they create in order to prepare for leadership roles in their professional careers."
VART 424,Senior Seminar II (Capstone seminar course),2,"Required of all art majors during their semester of graduation. The seminar emphasizes 
continued professional development of individuals in  pursuit  of  careers  in  the visual 
arts and has the following components: exhibition and presentation methods, 
documentation and community service through the arts. Preparation of the body of work 
developed in VART 424 for exhibition, production of a digital portfolio, development of a 
resume, artist’s statement, and biography, initiation and/or participation in community service 
and volunteer projects during the course of study that are related to the arts using the 
skills that have been acquired in the process of art-making."
VART 436,Environmental Design,3,"Exploration of three methods of environmental sculpture that include site specific, 
installations and earthworks."
VART 473,Advanced 2-Dimensional Studio,3,"Continuation of 2-dimensional interest (painting or printmaking) with introduction to 
contemporary ideas of art, emphasis on craft and broadening of critical thinking skills in 
preparation for a career in the visual arts. Prerequisite: Completion of 100 and 200 level 
required courses toward art major or consent from instructor."
VART 474,Advanced 3-Dimensional studio,3,"Continuation of 3-dimensional interest (ceramics or sculpture) with introduction to 
contemporary ideas of art, emphasis on craft, and broadening of critical thinking skills in 
preparation for a career in the visual arts. Prerequisite: Completion of 100 and 200 level 
required courses toward art major or consent from instructor."
ATHL 512,Research Project,1,"Independent study and research in a specific area of interest. Students will focus on specific 
areas needed for completion of their research project including but not limited to Institutional 
review process, data collection, data analysis, and results section of a manuscript."
ATHL 513,Case Analyses of Musculoskeletal Injury,1,"The course includes a serial analysis of musculoskeletal case studies. It gives students an 
opportunity to critically analyze prior learned evaluative techniques in real world situations. It 
teaches students to align how musculoskeletal anatomy and physiologic response to stress 
contribute to the formation of key features in specific musculoskeletal injury patterns."
ATHL 530,Athletic Training Concepts,3,"An introduction to clinical patient care in the athletic training profession. Students will be 
introduced to the core competencies for allied health professions and how disablement affects 
care decisions. Domains of the Board of Certification's Practice Analysis will be used to 
discuss foundational knowledge, skills, and abilities of the athletic trainer. Prerequisite: 
Acceptance to the Professional Phase of the Athletic Training Program."
ATHL 531,Clinical Practice 1,3,"This course is intended for students who are enrolled in the professional portion of the 
athletic training program. This is a laboratory-based course designed to begin instruction 
and evaluation of clinical proficiencies in athletic training. Students will be assigned as the 
primary health care provider in a specific clinical setting and provide care under the direct 
supervision of clinical preceptors. Weekly meetings will reinforce 
concepts learned in the 
clinical setting. Prerequisite: Acceptance to the Professional Phase of the Athletic Training 
Program."
ATHL 532,Clinical Practice 2,3,"This course is designed to build upon the clinical concepts begun in the Clinical Practice 
1 course. This is a laboratory-based course designed to continue instruction and evaluation 
of clinical proficiencies in athletic training. Students will be assigned as the primary health 
care provider in a specific clinical setting and provide care under the direct supervision of 
clinical preceptors. Weekly meetings will reinforce concepts learned in the clinical setting. 
Prerequisite: ATHL 531."
ATHL 533,Clinical Practice 3,3,"This course is designed to build upon the clinical concepts begun in the Clinical Practice 
2 course. This is a laboratory-based course designed to continue instruction and evaluation 
of clinical proficiencies in athletic training. Students will be assigned as the primary health 
care provider in a specific clinical setting and provide care under the direct supervision of 
clinical preceptors. Weekly meetings will reinforce concepts learned in the clinical setting. 
Prerequisite: ATHL 532."
ATHL 534,Clinical Practice 4,3,"This course is designed to allow students to practice and gain confidence in the clinical skills and 
concepts covered in the Clinical Practice 1-3 courses. This is a laboratory- based course 

designed to evaluate and refine clinical proficiencies in athletic training. Students will be 
assigned as the primary health care provider in a specific clinical setting and provide care under 
the direct supervision of clinical preceptors. Weekly meetings will reinforce concepts learned in 
the clinical setting. Prerequisite: ATHL 533."
ATHL 535,Pharmacological Concepts in Sports Medicine,3,"An introduction to the principles, physiology and administration of common 
pharmacological agents used in sports medicine. Prerequisite: Acceptance to the 
Professional Phase of the Athletic Training Program."
ATHL 536,General Medical Care,3,"An examination of common illnesses & conditions that affect the multiple body systems. Emphasis 
will be on clinical evaluation, recognition, immediate care, and appropriate referral of general 
medical conditions. Prerequisite: Acceptance to the Professional Phase of the Athletic Training 
Program."
ATHL 538,Advanced Clinical Decision Making,3,"This course builds upon concepts learned in Assessment of Athletic Injuries 1 and 2 in 
developing the ability to evaluate orthopedic conditions. Students will be expected to perform 
a comprehensive clinical examination of a patient with an upper extremity, lower extremity, 
head, neck, thorax, and/or spine injury or condition. Additionally the student will incorporate 
clinical reasoning in the selection of assessment procedures and interpretation of findings in 
order to formulate a differential diagnosis and/or 
diagnosis, determine underlying 
impairments, and identify activity limitations and participation restrictions. Prerequisite: 
ATHL 570A, 570B. 
ATHL 570A. Assessment of Musculoskeletal Injury I (3:3:0) 
An in-depth look at anatomical and differentiating characteristics of injuries to the body to 
include upper extremity, lower extremity, pelvis, abdomen, thorax, and head.  Prerequisite: 
Acceptance to the Master of Athletic Training Program. 
ATHL 570B. Assessment of Musculoskeletal Injury II (3:3:0) 
An in-depth look at the hands-on evaluation techniques (palpation, range of motion testing, 
nervous testing, special testing, etc.) used to assess injuries to the upper extremity, lower 
extremity, pelvis, abdomen, thorax, and head.  Prerequisite: ATHL 570A."
ATHL 571,Community Based Prevention Strategies,3,"Provides an understanding of evidence-based health care practices and their application to 
sound clinical decision making and critically examining athletic training practice. Students 
will learn commonly used clinical outcomes assessment measures to determine the 
effectiveness and efficacy of athletic training interventions. Students will also identify a 
specific clinical question of interest and begin the preliminary steps in conducting an original 
research project. Prerequisite: Acceptance to the Professional Phase of the Athletic Training 
Program."
ATHL 572,Advanced Therapeutic Interventions,3,"An examination of clinician and patient oriented outcome measures used to assess a patient's 
status. Based on assessment results and with consideration of the stage of healing and goals, 
students will design a therapeutic intervention designed to maximize patient function and health 
related quality of life. A variety of interventions, methods, techniques, equipment, exercise, 
modalities and medications will be covered to produce a comprehensive treatment plan for the 
patient. Prerequisite: ATHL 575, 577."
ATHL 573,Acute Care in Athletic Training,3,"Introduction to principles of emergent care across a variety of settings. Students will be 
expected to clinically evaluate and manage a patient with an emergency injury or condition 
to include the assessment of vital signs and level of consciousness, activation of emergency 
action plan, secondary assessment, diagnosis, and provision of the appropriate emergency 
care (e.g. CPR, AED, supplemental oxygen, airway adjunct, splinting, spinal stabilization, 
control of bleeding). Prerequisite: Acceptance to the Professional Phase of the Athletic Training 
Program."
ATHL 574,Summer Clinical Practice,3,"This course is designed to expose students to general medical and non-traditional practice 
settings in allied health. A combination of observation and laboratory based experiences will 
be used to provide an interdisciplinary understanding of patient care. Class meetings will be 
used to reflect upon experiences and reinforce concepts learned throughout the athletic training 
curriculum. Prerequisite: ATHL 532."
ATHL 575,Therapeutic Modalities,3,"An examination of the theories, principles and application of therapeutic modalities in a clinical 
setting. Prerequisite:  Acceptance to the Professional Phase of the Athletic Training Program."
ATHL 576,Administration of Athletic Training Programs,3,"Examination of issues relating to management of a comprehensive athletic training program. 
Administrative and legal issues, risk management, conflict resolution, budgeting, personnel, 
record keeping and policy development. Prerequisite: Acceptance to the Professional Phase of the 
Athletic Training Program."
ATHL 577,Therapeutic Exercise in Rehabilitation,3,"An examination of the theories, principles and applications of therapeutic exercise in the 
rehabilitation of injuries. Prerequisite: Prerequisite: Acceptance to the Professional Phase of the 
Athletic Training Program."
ATHL 578,Athletic Training Capstone,3,"A culminating experience for senior athletic training students, taken during the student’s last 
semester at TLU. This course includes application of knowledge learned in the discipline and 
focuses on preparation as a BOC certified athletic trainer. Students will demonstrate knowledge 
and ability in written and oral communication, and research presentation skills appropriate 
for an entry level athletic trainer. Prerequisite: ATHL 512."
BIOL 111,Biodiversity in Central Texas,1,"A laboratory and field-based course for biology majors and students interested in 
environmental science. Students will observe, photograph and collect plant and animal 
specimens on field trips and then identify the specimens using taxonomic keys and field 
guides. Students will become familiar with the common species and taxonomic groups 
found in central Texas. Cross-listed as ENVS 111."
