code,title,credits,description
1313*,AUDIO AND VISUAL PRODUCTION,3,"Introduction to principles and techniques of audio and 
video production in radio, television, and online 
applications. Lecture , laboratory . (Fall, 
Spring)nonenone"
2243*,PHOTOJOURNALISM I,3,"The study of 
the principles and techniques of photography with an 
emphasis on composition and design. Students will learn 
scanning software and image editing software. Lecturenonenone"
2323*,RADIO PRODUCTION,3,"A look at the 
equipment in radio studios and its uses in editing, 
production and creating programs. Lecture , 
laboratory . Corequisite: JRMPnonenone"
2333*,TV STUDIO PRODUCTION,3,"An 
introduction to the basic principles, procedures, and 
techniques of television studio production. The course 
includes video control, operation of cameras and editing 
machines, lighting, staging and directing, on-camera 
  
 
 
announcing and interviewing. Lecture , laboratory 
. Prerequisite: JRMPnonenone"
2513*,WRITING FOR MASS MEDIA,3,"This 
course will introduce students to the various strategies 
and styles of writing for mass media organizations that 
find 
themselves 
converging 
into 
multiple 
media 
institutions. Lecture . (Fall, Spring)nonenone"
2623*,VISUAL COMMUNICATION,3,"This 
course is an exploration into why some images are 
remembered while most are not. This course will explore 
how we see, why we see, the ethics of what we see, and 
equip students with a vocabulary for analyzing visual 
messages. The study of visual communication will change 
the way a student sees the world. Lecture .nonenone"
3223*,LAYOUT AND DESIGN,3,"Explores 
techniques, processes, and procedures for the publication 
of print media with an emphasis on the elements of design 
using the pagination program InDesign and the image 
editing software Adobe Photoshop. Lecture .nonenone"
3343*,VIDEO FIELD PRODUCTION AND EDITING,3,"Advanced techniques in field production for 
commercial and industrial television. Emphasis will be 
given to pre- and post-production stages, as well as 
training for independent assignments and ""electronic 
news gathering."" Lecture , laboratory . 
Prerequisite: JRMPnonenone"
3363,PRODUCING THE DOCUMENTARY,3,"Preparation for the participation in all phases of 
documentary production. The course will function as a 
team process with students participating in one or many 
aspects of the production. May be repeated for a 
maximum of six hours. Laboratory . Prerequisite: 
Instructor permission.nonenone"
3423*,BROADCAST NEWS,3,"Theories and 
practices of broadcast news gathering, writing, delivery, 
and ethics to develop professional attitude and skills in 
broadcast 
and 
internet 
news. 
Lecturenonenone"
3523*,"FEATURES, COLUMNS, and REVIEWS",3,"The purpose of this course is to understand and 
practice writing news content while accounting for 
current changes and developments in mass media. This 
class will emphasize writing from the basis of craft, and 
we will examine newswriting style and develop writing 
skills specific to subjective, creative newswriting forms 
(features, columns, and reviews). Students will learn how 
to write across newswriting genres while adhering to 
ethical journalistic standards as dictated in the Society of 
Professional Journalists' Code of Ethics. Lecture . 
Prerequisite: Students must be English Composition I 
eligible (i.e., have no English deficiencies).nonenone"
3533*,BROADCAST WRITING,3,"Concept and 
practices of writing for radio and television. Emphasis on 
writing news, commercials, and long-form scripts. Lecture 
. Prerequisite: Students must be English 
Composition I eligible (i.e., have no English deficiencies).nonenone"
3613*,MEDIA LITERACY,3,"The purpose of 
this class is to look at the various components of the mass 
media industry with special emphasis on Media Literacy 
and the impact of Media Literacy on our culture. This 
course provides a theoretical underpinning and critical 
analysis to the Journalism and Media Production 
curriculum. The course is grounded in media theory 
which espouses the use of literacy education and criticism 
to analyze mass media effects on society. Lecture . 
Years)nonenone"
3623*,BROADCAST PROGRAMS AND RATINGS,3,"Principles governing the selection of programs; 
preparation of broadcast schedules; and audience 
measurements. Focus will include program types, rating 
systems, program and audience analysis in radio, 
television and cable. Lecture .nonenone"
3633*,SOCIAL MEDIA THEORY,3,"Social 
Media Theory is the study of the development, impact and 
significance of social mass media technologies. Students 
study new social media, develop an analysis model to 
examine emergent social media, research current social 
media uses and present findings to their peers. Lecturenonenone"
1-3,"credit hours Workshop designed 
to give intensive emphasis to a specific area of media. May 
be repeated with a different topic for additional credit up 
to a maximum of six hours. Journalism and Media 
Production majors may count only three hours of 
workshops towards their degree. Workshop, .",3811-2,"MEDIA 
PRACTICUMnonenone"
4153*,MEDIA HISTORY,3,"Background and 
development of the early press. Emergence of the partisan 
press. Evolution of personal and independent journalism. 
Lecture . Prerequisite: Students must be English 
Composition I eligible (i.e., have no English deficiencies).nonenone"
4233*,GRAPHICS FOR VIDEO PRODUCTION,3,"An examination of the principles, procedures, and 
techniques used in creating graphics for video production. 
While special emphasis is placed on graphics creation for 
the television medium, students will explore the use of 
graphics for non-broadcast applications such as distance 
or adaptive learning. Lecture , laboratory . 
Prerequisite: Students must be English Composition I 
eligible (i.e., have no English deficiencies).nonenone"
4213*,PHOTOJOURNALISM II,3,"The 
continued study of the principles of photography with an 
emphasis on composition and design. Students will 
continue to employ digital darkroom techniques in 
coordination with various modes of expression: print, 
video and online. Lecture . Prerequisite: JRMPnonenone"
4353*,CORPORATE VIDEO,3,"Theory and 
uses of video in business and industry including writing, 
planning, and production, as well as television programs 
for instructional and corporate applications. Lecturenonenone"
4413,NEWS EDITING,3,"Study of editing, both 
practical and theoretical, in the media field. Lecturenonenone"
4433*,ONLINE JOURNALISM,3,"Adapting 
works for the Internet, incorporating style and format 
changes to accommodate online audiences. Writing 
assignments 
for 
news 
and 
marketing 
content. 
Examination of the elements of print and broadcast 
writing styles that contributes to online content. This 
course is a thorough review of the differences and 
similarities that mark the era of media convergence in 
journalism. Lecture .nonenone"
4643*,MEDIA LAW,3,"The principles by which 
mass media exercise their public functions and fulfill legal 
obligations to society. Right to know, truth and fairness, 
responsibility, libel, privilege, fair comment, privacy, 
contempt, copyright, and regulation of advertising. 
Lecture . Prerequisite: Students must be English 
Composition I eligible (i.e., have no English deficiencies).nonenone"
4653*,"MEDIA 
MANAGEMENT",3,"Investigation into various print and broadcast media 
management functions, sales, network and labor 
relations, internal organizational structures, operating 
procedures and government regulations. Lecture . 
Prerequisite: Students must be English Composition I 
eligible (i.e., have no English deficiencies).nonenone"
4721-3*,SPECIAL TOPICS,1-3,"Directed 
individual or group study of selected topic(s) in 
broadcasting or journalism. The course may be repeated. 
Lecture .nonenone"
4823,MEDIA INTERNSHIP,3,"Supervised 
work experience in a professional setting which relates to 
the student's career objectives. The internship will allow 
practical experience in a broadcast or journalism area. 
May be repeated for a maximum of six hours. Internshipnonenone"
1001-3*,INTRODUCTORY LANGUAGE WORKSHOP,1-3,"An introductory course that provides 
beginning study in a selected foreign language, often with 
a special focus such as survival Spanish or Arabic for 
military personnel. May be repeated to a total of six hours.  
Content varies. Lecture .nonenone"
3991-3*,IMMERSION EXPERIENCE,1-3,"Field 
experience under close supervision of a faculty member in 
which student gains language proficiency through an 
immersion in target language environment. Field 
experience :  study of 
target 
language 
or 
equivalent 
and 
department 
permission.nonenone"
4181-3*,"SPECIAL TOPICS IN LANGUAGES  Directed individual or group study of selected topics 
in language. This course may be repeated up to a total of",6,"hours credit with departmental permission. Independent 
study/directed readings s: ENGLnonenone"
1113*,BEGINNING LATIN I,3,"An 
introductory course in understanding, speaking, reading, 
and writing Latin. Lecture . General Education, 
Humanities–Diversity. (Fall)nonenone"
1223*,BEGINNING LATIN II,3,"Continuation 
of LATNnonenone"
2113*,INTERMEDIATE LATIN I,3,"An 
intermediate-level course in Latin. A review of grammar, 
writing, and speaking. Lecture . Prerequisite: 
LATNnonenone"
2223*,INTERMEDIATE LATIN II,3,Continuation of LATNnonenone
3113*,ROMAN WRITERS I,3,"Beginning study 
of various authors of Roman literature. Topics may 
include Roman prose, poetry, or drama. Lecture . 
Prerequisite: LATNnonenone"
3223*,ROMAN WRITERS II,3,"A continuation 
of LATNnonenone"
4961-3*,"DIRECTED READINGS IN LATIN  Intensive independent readings and research on a 
selected topic, writer, or movement in Latin literature or 
language under supervision of a faculty member. May be 
repeated to a total of  with departmental 
permission. Independent study/directed readings . Prerequisite: LATN",3223,"or equivalent. 
  
 
 
LIBRARY SCIENCE (LIBS) 
Educationnonenone"
3423*,CHILDREN'S LITERATURE,3,"General 
survey of the literature available for children. Criteria for 
evaluation of materials in terms of needs, interests, and 
abilities of children. Methods of selecting books and 
introducing them to children. Lecture . (Fall, 
Spring) 
LINGUISTICS (LING) 
Communication, English, and Foreign Languagesnonenone"
4113*,GENERAL LINGUISTICS,3,"A 
systematic review of linguistics to include grammar, 
phonology, morphology, syntax, and semantics of world 
languages. Lecture . primary and secondary language requirements or 
concurrent enrollment in final level. (Fall)nonenone"
4163,"TEACHING ENGLISH AS A SECOND LANGUAGE: 
THEORY AND METHODS",3,"Introduction to 
theories of language acquisition and methods of 
instruction; practicum in applications of theories and 
methods. Lecture . Composition,  foreign language or instructor 
permission.nonenone"
4173,"TEACHING FOREIGN LANGUAGES: THEORY AND 
METHODS",3,"An introduction to methods and 
materials in teaching elementary and secondary foreign 
languages. Lecture , laboratory . Teacher 
Certification students must be admitted to teacher 
education prior to enrollment in this course. 
MANAGEMENT (MGMT) 
Businessnonenone"
3013*,PRINCIPLES OF MANAGEMENT,3,"An 
introductory management course dealing with the 
fundamental 
principles 
of 
management: 
planning, 
organizing, and controlling. Lecture . Prerequisite: 
BUSnonenone"
3513,HUMAN RESOURCE MANAGEMENT,3,"A comprehensive review of human resources policy 
development, along with a description and analysis of 
human resources techniques. The interdependence of 
human and operating functions is discussed. Focuses on 
the primary management functions as they relate to 
employment 
law, 
recruitment, 
selection, 
training, 
performance appraisal, compensation, and safety and 
health. Lecture .nonenone"
3613,OPERATIONS MANAGEMENT,3,"Management of operations in manufacturing and service 
systems. Includes product, process and job design; 
planning facilities, quality assurance, and control systems; 
improvement of processes; materials management; 
budgetary and cost control; and associated quantitative 
techniques. Lecture . and STATnonenone"
3813,LABOR MANAGEMENT RELATIONS,3,"Study of the relationships between management and 
labor: contract negotiations, grievance procedures, and 
arbitration in the public and private sectors. Lecturenonenone"
4013,ORGANIZATIONAL BEHAVIOR,3,"Concerns the application of knowledge relating to human 
behavior theory as it applies to the business environment. 
Includes 
motivation 
theory, 
leadership 
patterns, 
organization climate, interpersonal relations, intergroup 
behavior, etc. Emphasis is on behavioral research 
findings. Lecture . Prerequisite: MGMTnonenone"
4033,SMALL ENTERPRISE MANAGEMENT,3,"This course emphasizes principles and problems 
associated with starting and managing small enterprises. 
Lecture . Prerequisite: MGMTnonenone"
4053,"BUSINESS, ETHICS, AND SOCIETY",3,"An examination of the external environment of business, 
the need to ethically manage the external environment, 
and management's ethical responsibilities to the various 
elements 
of 
the 
environment. 
Lecturenonenone"
4443,"PROJECT 
MANAGEMENT",3,"Investigation and study of projects in organizations. 
Includes technical aspects pertaining to managing 
complex projects and systems. Emphasis placed on 
integrative concepts including topics such as project 
selection; planning and organization; negotiation and 
conflict resolution; budgeting and cost estimation; 
scheduling; resource allocation; monitoring and control; 
project auditing; and project termination. Lecture . 
Prerequisite: MGMTnonenone"
4471-4,SEMINAR IN MANAGEMENT,1-4,"Group study of specified topics in management for 
undergraduate students. Can be repeated for a maximum 
MANAGEMENT INFORMATION SYSTEMS (MIS) 
Computing and Technologynonenone"
2001-3,"SPECIAL 
PROBLEMS 
IN 
MANAGEMENT 
INFORMATION SYSTEMS",1-3,"Assigned 
student projects which will include topics not covered in 
detail in the MIS curriculum and based on study needs. 
Lecture .nonenone"
2013,PROGRAMMING I,3,"Introduction to 
and use of application development tools for object-
oriented programming. Emphasizes step-wise refinement 
of fourth generation computer languages (nonenone"
2113,FUNDAMENTAL MIS TOOLS AND SKILLS,3,"A study of major microcomputer application 
software packages, including operating systems, word 
processing, and spreadsheet software. The emphasis is on 
  
 
 
hands-on use of these packages to develop software 
applications for solving basic business problems. Lecture 
. (Fall, Spring)nonenone"
3013,MANAGEMENT INFORMATION SYSTEMS,3,"An overview of the current principles and practices 
of information systems and solving problems from a 
managerial perspective. Lecture .nonenone"
3021-3,BUSINESS SOFTWARE APPLICATIONS,1-3,"A 
study 
of 
selected 
software 
for 
microcomputer systems. Course may be repeated for 
credit with different software packages. Lecture . Prerequisite: MISnonenone"
3033,DATABASE DESIGN AND MANAGEMENT,3,"This course introduces the basic theories, skills, and 
techniques of data and database systems. The course will 
primarily focus on database design and implementation. 
Lecture .nonenone"
3083,SYSTEMS ANALYSIS AND DESIGN,3,"Systems development using modern methods and tools. 
Recent advances in software technologies such as 
distributed hypermedia systems (World Wide Web), 
CASE tools, GUI tools, DBMSs,nonenone"
3123,"ADVANCED BUSINESS APPLICATIONS OF 
MICROCOMPUTER SOFTWARE",3,"Study of 
advanced features of major microcomputer application 
software 
packages, 
including 
word 
processing, 
spreadsheet, graphics, and database software. Emphasis 
on hands-on use of these packages to develop software 
applications for solving complex business problems. 
Lecture . Prerequisite: MISnonenone"
3183,STRUCTURED QUERY LANGUAGE,3,"An in-depth study of the Structured Query Language 
(SQL) and relational database processing. Topics will 
include general application development using basic and 
advanced select statements. Other topics include queries 
involving multiple tables. Lecture .nonenone"
3223,"BUSINESS 
DATA 
COMMUNICATION/ 
TELECOMMUNICATIONS",3,"Introduction to 
data communications and networking in a business 
environment while emphasizing current advances in 
telecommunications 
technology, 
regulation, 
and 
international standards. Topics include TCP/IP and the 
OSI model; current data communications protocols; 
network architecture including client/server networks; 
and operating systems. Student becomes conversant in 
data 
communication 
terminology 
and 
concepts. 
Knowledge and skills gained will be applied in an end-of-
course business scenario. Lecture . Prerequisite: 
MISnonenone"
4023,DATA ANALYTICS,3,"The strategies and 
processes for Data Analytics of large databases. The major 
focus of this course is data analytics applications related 
to the corporate business world. Examples of discussion 
areas include banking and finance, retail, and heath care.nonenone"
4033,ELECTRONIC COMMERCE,3,"This 
course will involve a comprehensive look at electronic 
commerce. Students will gain theoretical exposure to the 
complex field as well as practical experience in basic web 
programming. Course topics include: business models, 
revenue models, e-commerce security, payment systems, 
as well as legal, social and ethical issues. Lecture . 
Prerequisite: MISnonenone"
4433,PROJECT MANAGEMENT,3,"The course 
presents basic principles of project management, tools of 
project management, and the role of project manager in 
the successful completion of a project. Lecture . 
Prerequisite: Junior standing.nonenone"
4471-3,"SEMINAR IN MANAGEMENT INFORMATION 
SYSTEMS",1-3,"Study of specified topics in 
Management Information Systems such as advanced 
telecommunications, 
advanced 
database, 
data 
warehousing, information security, web page design, 
decision support systems, and other topics. Can be 
repeated for maximum ofnonenone"
4491-3,"INDEPENDENT STUDY IN MANAGEMENT 
INFORMATION SYSTEMS",1-3,"Independent 
reading and/or study of specific problems or special 
subjects, based upon pre-approved outlines of plans, with 
conferences 
and/or 
written 
reports. 
Independent 
study/directed readings s:nonenone"
3413*,PRINCIPLES OF MARKETING,3,"An 
introductory course utilizing a managerial approach to 
the study and development of marketing with emphasis 
on marketing strategy and development of marketing mix. 
Lecture . Prerequisite: BUSnonenone"
3423,CONSUMER MOTIVATION AND BEHAVIOR,3,"An examination of the internal and external 
influences on buyer behavior; analysis of the buying 
  
 
 
process; consumer decision-making; and aggregate 
consumer behavior over time. Lecture . 
Prerequisite: MKTGnonenone"
3433,RETAILING,3,"An investigation of the 
retailing field examining retail strategy, merchandise 
management and store management. Lecture . 
Prerequisite: MKTGnonenone"
3533,PERSONAL SELLING,3,"Students will 
earn how to become an effective sales professional 
through traditional and non-traditional approaches. 
Students will assess the current and potential value of an 
organization’s offerings, develop skills in prospecting 
customers, craft unique selling propositions and design 
effective sales strategies to connect customers with 
needed satisfying products and services. Lecture . 
Prerequisite: MKTGnonenone"
4433,ADVERTISING,3,"credit hour. A survey of the various 
advertising media with an emphasis on planning and 
evaluating advertising themes and campaigns. To this end, 
the various elements of advertising, the types of 
advertising, and the objectives of advertising will be 
examined. Lecture .nonenone"
4443,"MARKETING 
RESEARCH",3,"Development of statistical techniques applicable to 
marketing research. Includes a discussion of experimental 
design, planning research and investigations; formulation 
of hypothesis; logic and reasoning; conducting research 
investigations including formulation of the problem, 
sampling 
techniques, 
interviews, 
developing 
questionnaires; 
and 
the 
application 
of 
statistical 
techniques for reporting data. Lecture .nonenone"
4481-3,SEMINAR IN MARKETING,1-3,"Study 
of specified topics in marketing. Can be repeated for a 
maximum of  credit under different topic titles.nonenone"
4553,SPORT MARKETING,3,"A study of the 
business side of sports, including economic impact, the 
use of sports as a marketing tool for other products, the 
marketing of sports products, sport sponsorships, 
publicity, media and guest relations. Lecture .nonenone"
4613,SERVICES MARKETING,3,"A study of 
the difference between expected and perceived service 
performance by investigating the listening gap, the service 
design and standards gap, the service performance gap 
and 
the 
communication 
gap. 
Lecturenonenone"
0013,"PRE-ALGEBRA Developmental course, no credit This 
course provides a solid foundation in whole and signed 
number operations, fractions, decimals and percent. Does 
not satisfy any requirements for any degree program at 
Cameron University. Lecture .",0103,"BEGINNING ALGEBRA Developmental course, no 
credit This course is an introduction to algebra. Topics 
covered include introduction to the real number system, 
solving and graphing linear equations and inequalities, 
arithmetic operations using polynomials, factoring, and 
simplifying rational expressions. Does not satisfy any 
requirements for any degree program at Cameron 
University. Lecture .nonenone"
0115,"BEGINNING AND INTERMEDIATE ALGEBRA 
Developmental course, no credit A combined beginning 
and intermediate algebra course. This course is designed 
for students who are able to cover the material in both 
beginning and intermediate algebra in one semester. Does 
not satisfy any requirements for any degree program at 
Cameron University. Lecture .",0142,"SUPPLEMENTAL SURVEY OF MATHEMATICS 
INSTRUCTION 
Developmental 
course, 
no 
credit 
Remediation and support for students who are enrolled in 
MATHnonenone"
1413,who score less than,19,"on the ACT 
Mathematics test and have not completed MATHnonenone"
1513,who score less than,19,"on the ACT 
Mathematics test and have not completed MATHnonenone"
1463,who score less than,19,"on the ACT 
Mathematics test and have not completed MATHnonenone"
0213,"INTERMEDIATE ALGEBRA Developmental course, 
no credit This course is designed to help students develop 
the skills needed for general education courses. Topics 
include radical and rational exponents, inequalities, 
  
 
 
quadratics, complex numbers, and an introduction to 
functions. Does not satisfy any requirements for any 
degree program at Cameron University. Lecture .",1001,TECHNOLOGY FOR MATHEMATICSnonenone
1413*,SURVEY OF MATHEMATICS,3,"An 
introductory course in Mathematics designed to acquaint 
the 
student 
with 
mathematical 
ideas 
and 
their 
applications. This course covers topics in mathematics to 
help the student develop quantitative reasoning skills and 
to better understand the world around them. Topics 
include (but are not limited to) finance, statistics, 
describing data, and linear programming. Does not apply 
toward a major or minor in mathematics. Lecture .nonenone"
1463*,FUNCTIONS AND MODELING,3,"Topics covered are equations and functions (linear, 
polynomial, rational, exponential, logarithmic) from 
various perspectives (symbolic, verbal, numerical, 
graphical); digital techniques for graphing functions, 
solving equations, and modeling data using regressions. 
This course is designed for students in agricultural, 
business, life/health science, or social science majors. 
Does not apply towards a minor or major in mathematics. 
Lecture .nonenone"
1513*,COLLEGE ALGEBRA,3,"Topics covered 
are functions and graphs, including polynomial, rational, 
exponential and logarithmic; linear and nonlinear 
systems; and matrices. Does not apply toward a minor or 
major in mathematics or a major in mathematics 
education. Lecture .nonenone"
1613*,PLANE TRIGONOMETRY,3,"The 
development, use and relations between circular and 
trigonometric functions; solutions of triangles; and 
application to practical problems throughout the course. 
Does not apply towards a major or minor in mathematics 
or a major in mathematics education. Lecture .nonenone"
2215*,CALCULUS AND ANALYTIC GEOMETRY I,5,"Limits, derivatives with applications, the definite 
integral with applications. Lecture .nonenone"
2235*,CALCULUS AND ANALYTIC GEOMETRY II,5,"Techniques 
of 
integration, 
applications 
of 
integration, polar coordinates, sequences and series, 
vectors. Lecture . Prerequisite: MATHnonenone"
2244*,CALCULUS AND ANALYTIC GEOMETRY III,4,"Solid 
analytic 
geometry, 
partial 
differentiation, multiple integrals, functions of several 
variables, vector calculus. Lecture . Prerequisite: 
MATHnonenone"
2353,MATHEMATICS FOR ELEMENTARY TEACHERS I,3,"A basic course in mathematics for 
elementary education majors. An introduction to problem 
solving, numeration systems, whole number properties, 
and current technologies and manipulatives that relate to 
elementary mathematics. Additionally, operations with 
whole numbers are developed. Does not apply toward a 
major or minor in mathematics or a major in mathematics 
education. Lecture . Prerequisite: Completion of 
one math general education course. (Fall, Spring)nonenone"
2363,MATHEMATICS FOR ELEMENTARY TEACHERS II,3,"An introduction to the structure of the real 
number system, functions, and probability and statistics 
for elementary education majors. Various manipulatives 
are used as teaching tools. Does not apply toward a major 
or minor in mathematics or a major in mathematics 
education. Lecture .nonenone"
