code,title,credits,description
3313*,COGNITIVE PSYCHOLOGY,3,"Examines cognition involving language, thinking, problem 
solving, memory, intelligence, and categorization. Lecture 
. Prerequisite: PSYnonenone"
3333,COUNSELING AND CLINICAL PSYCHOLOGY,3,"An introduction to the helping profession for 
students considering counseling or clinical psychology as 
a career. Lecture . Prerequisite: PSYnonenone"
3353*,"LIFESPAN 
HUMAN 
GROWTH 
AND 
DEVELOPMENT",3,"Survey 
of 
the 
psychological changes across the life span. Cognitive, 
social, emotional, and physical changes from birth to 
death will be examined. Lecture . Prerequisite: PSYnonenone"
3363*,PSYCHOLOGY OF MIDDLE CHILDHOOD,3,"This course will include and in-depth study of the 
theories, research, and findings in the biological, 
psychological, and social development of middle 
  
 
 
childhood (agenonenone"
3373*,"PSYCHOLOGY 
OF 
ADOLESCENCE 
AND 
EMERGING ADULTHOOD",3,"An in-depth 
study of the theories, research, and findings in the 
biological, psychological, and social development of 
adolescence and emerging adulthood (agesnonenone"
3383*,SOCIAL PSYCHOLOGY,3,"The study of 
human behavior as affected by social stimuli. Lecturenonenone"
3413*,PSYCHOLOGY OF LEARNING,3,"Investigations into the processes of learning in humans 
and animals. Emphasis is given to behavioral and 
cognitive approaches. Lecture . Lecture . 
Prerequisite: PSYnonenone"
3423,APPLIED QUANTITATIVE METHODS,3,"A strong emphasis will be placed on inferential 
procedures used in published articles in psychological 
journals. Topics include correlational testing, linear 
regression, simple and factorial ANOVAs, tests for 
outliers, 
normalcy, 
randomness, 
heterogeneity 
of 
variance, and post-hoc analysis. Lecture .nonenone"
3453,"QUANTITATIVE 
ANALYSIS 
AND 
INTERPRETATION",3,"A strong emphasis will 
be placed on inferential analysis and interpretation 
procedures used in published articles in psychological 
journals. Students will become familiar with various 
software packages (e.g., Excel, SPSS, and PowerPoint) and 
their use in the analysis and interpretation process. 
Analyses, interpretation, and presentation of independent 
and dependent t-tests, correlational testing, linear 
regression, simple and factorial ANOVAs, tests for 
outliers, 
normalcy, 
randomness, 
heterogeneity 
of 
variance, and post-hoc analyses will be included.nonenone"
4313,PSYCHOLOGICAL TESTING,3,"A general 
survey of the principles, backgrounds, and procedures of 
psychological testing. Attention is given to interpretation 
of measuring instruments in the fields of personality and 
intelligence. Lecture . Prerequisite: PSYnonenone"
4323*,SENSATION AND PERCEPTION,3,"An 
in-depth study of the biological properties of sensory 
systems and major phenomena in sensation and 
perception (e.g., adaptation, brightness, color and 
binocular 
vision, 
audition, 
taste, 
touch, 
imagery, 
individual differences, time and motion, attention and 
theories of psychophysical judgment including STD and 
classical). Lecture . Prerequisite: PSYnonenone"
4331-3,SEMINAR IN PSYCHOLOGY,1-3,"Specific problems or issues of concern to Psychology are 
given in depth exploration and analysis. A different topic 
may be presented each semester. (May be repeated for a 
total of six hours credit.) Seminar .nonenone"
4363*,ABNORMAL PSYCHOLOGY,3,"The 
study of various abnormalities as described in DSM. 
Lecture . Prerequisite: PSYnonenone"
4393*,PERSONALITY,3,"Factors determining 
and 
affecting 
personality, 
its 
development 
and 
assessment. Lecture . Prerequisite: PSYnonenone"
4423,EXPERIMENTAL PSYCHOLOGY,3,"Studies in the major designs, methods employed and 
problems in conducting experiments in psychological 
research. Lecture . Prerequisite: PSYnonenone"
4433,PSYCHOLOGICAL RESEARCH,3,"Students will design and conduct a psychological research 
project of sufficient quality for conference presentation. 
Material covered will include APA format research ethics, 
data analysis and conference presentation preparation. 
Lecture/capstone . of “C” or higher in PSYnonenone"
4443*,BIOPSYCHOLOGY,3,"Explains 
behavior in terms of the physiological events inside the 
body with emphasis on vision, audition, psychoactive 
drugs, eating, sex, and sleep. Lecture . 
Prerequisite: PSYnonenone"
4453,PROFESSIONAL RESEARCH IN PSYCHOLOGY,3,"Students will work individually with a 
department faculty member to develop and present a 
psychological research project of professional quality. The 
presentation will take place as a conference paper, 
conference poster, or by submission of a manuscript to a 
peer-reviewed 
psychological 
journal. 
Independent 
study/directed readings . Prerequisite: PSYnonenone"
4501,PSYCHOLOGY OF LOVE,1,"credit hour This 
workshop focuses on the psychological theories of love 
relationships 
within 
heterosexual 
relationships 
in 
marriage, courting, dating, attraction, cohabitation, and 
such. Theoretical models of Fehr, Lee, Rubin, Kelley, Grey, 
Smalley, Harley, and others are discussed. Seminarnonenone"
4521,PSYCHOLOGY OF DREAMING,1,"credit hour This 
workshop focuses on the psychological theories of dreams 
according to Freud, Jung, Adler, and other theorists. Other 
areas 
will 
include 
sleep 
stages 
and 
physical 
characteristics influencing psychological dream states. 
Seminarnonenone"
4541,"BOYS TO MEN: THE CREATION OF MASCULINITY 
IN LITTLE BOYS",1,"credit hour “Me Tarzan… You Jane!” 
Mothers, watch out. Your little boy wants to grow up. The 
student will investigate the masculine needs of the male 
gender and developmental stages involving male 
maturity, as well as the issues that surround this 
wonderful part of life! The student will be challenged to 
look at concepts and theoretical models portraying boys 
that are “wild at heart” and the boy’s need to “capture the 
key” from their mothers to run with the “wild man.” 
Seminarnonenone"
4561,PSYCHOLOGY OF BEHAVIORAL ADDICTION,1,"credit hour Ever hear “I just can’t stop” or ”It doesn’t hurt 
me or anyone else” or “Why don’t I change?”? This 
workshop will investigate many aspects and concepts of 
“Behavior Addiction” in a psychological reference. 
Gambling, sex, internet and cell phone use, shopping, 
video games, food, and such are just a few areas of 
discussion. The student will dive into the theoretical study 
of personality, family, relationships, compulsiveness, 
pleasure and arousal, rituals, and other concepts to study 
the addiction cycle and to gain more knowledge of this 
topic. Seminarnonenone"
4581,ANGER MANAGEMENT,1,"credit hour Anger is 
neither good nor bad. Anger is a resource, and signal, 
letting us know that something needs to change. Anger is 
a tool It can manipulate. It can protect. Anger is something 
that we feel, both emotionally, and physically. When we 
are angry, we are some-other-emotion, too. This 
workshop will discuss the effective techniques that can be 
used to manage anger. Seminarnonenone"
4601,INFIDELITY,1,"credit hour Is it cheating… adultery… 
having an affair? Is it the subjective feeling that my spouse 
or lover has violated the rules of the relationship? This 
seminar will investigate different theories and concepts 
involving “infidelity” such as betrayal, jealousy, rivalry, 
emotional and physical issues, assumptions, and 
expectations 
that 
develop 
and 
are 
assumed 
in 
relationships. Seminarnonenone"
2113*,INTRODUCTION TO PUBLIC RELATIONS,3,"An introduction to the history, development, and 
ethical practice of public relations as relationship 
management between an organization and its public. 
Emphasis on building a philosophical foundation for the 
practice of advocacy through public relations. Lecturenonenone"
3213*,"PUBLIC 
RELATIONS 
WRITING 
AND 
PRODUCTION",3,"Study and application of 
current trends and best practices in public relations. 
Includes instruction in communication methods and 
tactics, 
with 
emphasis 
on 
the 
production 
and 
dissemination of strategic communication messages. 
Lecture .nonenone"
3323*,STRATEGIC CAMPAIGN COMMUNICATION,3,"This course explores the planning, 
preparation and presentation of strategic communication 
campaigns. Emphasis on developing and integrating 
theories and strategies for campaign communication. 
Analysis and critique of public relations campaigns. 
Lecture . Prerequisite: Students must be English 
Composition I eligible (i.e., have no English deficiencies).nonenone"
3941-3,WORKSHOP,1-3,"Public relations 
workshop designed to give intensive emphasis to a 
specific area of the profession. May be repeated with a 
different topic for a total ofnonenone"
4413*,PUBLIC RELATIONS ETHICS,3,"This 
course explores the nature of public relations from an 
ethical and philosophical perspective, including ethical 
decision making in public relations, truth telling, 
objectivity, and the justification of persuasion use in the 
marketplace of ideas. Themes of responsible advocacy 
and representation in the “Courts of Public Opinion” will 
underscore the course. Lecture . Prerequisite: 
Students must be English Composition I eligible (i.e., have 
no English deficiencies).nonenone"
4823,CASE STUDIES IN PUBLIC RELATIONS,3,"Detailed analysis of current case studies in the 
planning and execution of public relations activities. 
Emphasis given to fact-finding, researching audiences, 
setting objectives, charting programs, execution, and 
evaluation. Lecture . Prerequisite: Students must 
  
 
 
be English Composition I eligible (i.e., have no English 
deficiencies).nonenone"
4931-3*,SPECIAL TOPICS,1-3,"Directed 
individual or group study of selected topic(s) in public 
relations. Course may be repeated.nonenone"
4973,PUBLIC RELATIONS INTERNSHIP,3,"Field experience in public relations in organizations, 
business, and industry. Internship/field experiencenonenone"
1013*,FUNDAMENTALS OF BROADCASTING,3,"Survey of components of broadcasting and other 
electronic media systems in America, including technical 
aspects, history, legal and social issues. Lecture .nonenone"
3223,ADVANCED RADIO PRODUCTION,3,"Theory and practice in the operation of advanced audio 
recording, and sound creation, and transmission 
equipment. Lecture , laboratory . 

Agriculture, Biology, and Health Sciencesnonenone"
2012,"INTRODUCTION TO RADIOLOGIC SCIENCES AND 
HEALTH CARE",2,"Provides an overview of the 
foundations of radiography and the practitioner's role in 
health care delivery and includes 
contact hours of clinical training. Principles, practices, and 
policies of health care organizations are examined and 
discussed in addition to the professional responsibilities 
of the radiographer and will include a clinical component. 
Clinical practice experiences are designed to provide 
patient care and assessment, competent performance of 
radiologic imaging, and total quality management. Levels 
of competency and outcomes measurement will be taught 
to ensure the well-being of the patient prior to, during, 
and following the radiologic procedure. Lecturenonenone"
2012L,"INTRODUCTION TO RADIOLOGIC SCIENCES 
AND HEALTH CARE LAB",0,"LAB: Provides an 
overview of the foundations of radiography and the 
practitioner's role in health care delivery and includes a 
minimum ofnonenone"
2113,PATIENT CARE IN RADIOLOGIC SCIENCES,3,"Content provides the concepts of optimal patient 
care, including consideration for the physical and 
psychological needs of the patient and family. Routine and 
emergency patient care procedures are described, as well 
as 
infection 
control 
procedures 
using 
standard 
precautions. Additionally, the course content provides a 
foundation in ethics and law related to the practice of 
medical imaging. An introduction to terminology, 
concepts and principles will be presented. Students will 
examine a variety of ethical and legal issues found in 
clinical practice. Lecturenonenone"
2113L,PATIENT CARE IN RADIOLOGIC SCIENCES LAB,0,"LAB: Content provides the concepts of 
optimal patient care, including consideration for the 
physical and psychological needs of the patient and 
family. Routine and emergency patient care procedures 
are described, as well as infection control procedures 
using standard precautions. Additionally, the course 
content provides a foundation in ethics and law related to 
the practice of medical imaging. An introduction to 
terminology, concepts and principles will be presented. 
Students will examine a variety of ethical and legal issues 
found in clinical practice. Lecturenonenone"
2123,RADIATION PHYSICS,3,"Content 
establishes a basic knowledge of radiation production and 
characteristics of atomic structure and terminology. Also 
presented are the nature and characteristics of radiation, 
x-ray production, and the fundamentals of photon 
interactions with matter. Additionally the course 
establishes a knowledge base in imaging equipment of 
radiographic, 
fluoroscopic 
and 
mobile 
equipment 
requirements and design. The content also provides a 
basic knowledge of quality control. Lecturenonenone"
2123L,RADIATION PHYSICS LAB,0,"LAB: 
Content establishes a basic knowledge of radiation 
production and characteristics of atomic structure and 
terminology. Also presented are the nature and 
characteristics of radiation, x-ray production, and the 
fundamentals of photon interactions with matter. 
Additionally the course establishes a knowledge base in 
imaging equipment of radiographic, fluoroscopic and 
mobile equipment requirements and design. The content 
  
 
 
also provides a basic knowledge of quality control. 
Lecturenonenone"
2134,"RADIOGRAPHIC PROCEDURES AND IMAGE 
ANALYSIS I",4,"Content provides the 
knowledge base necessary to perform standard imaging 
procedures and special studies within the corresponding 
semester. Consideration is given to the evaluation of 
optimal diagnostic images. Content provides a basis for 
analyzing 
radiographic 
images. 
Included 
are 
the 
importance of optimal imaging standards, discussion of a 
problem-solving technique for image evaluation and the 
factors than can affect image quality. Actual images will be 
included for analysis. Additionally this course establishes 
a knowledge base in radiography anatomy and physiology 
taught within the semester and will include a lab 
component. Components of the cells, tissues, organs and 
body systems are described and discussed. The 
fundamentals of sectional anatomy relative to routine 
radiography are addressed. Lecturenonenone"
2134L,"RADIOGRAPHIC PROCEDURES AND IMAGE 
ANALYSIS I LAB",0,"LAB: Content provides the 
knowledge base necessary to perform standard imaging 
procedures and special studies within the corresponding 
semester. Consideration is given to the evaluation of 
optimal diagnostic images. Content provides a basis for 
analyzing 
radiographic 
images. 
Included 
are 
the 
importance of optimal imaging standards, discussion of a 
problem-solving technique for image evaluation and the 
factors than can affect image quality. Actual images will be 
included for analysis. Additionally this course establishes 
a knowledge base in radiography anatomy and physiology 
taught within the semester and will include a lab 
component. Components of the cells, tissues, organs and 
body systems are described and discussed. The 
fundamentals of sectional anatomy relative to routine 
radiography are addressed. Lecturenonenone"
2204,CLINICAL PRACTICE I,4,"Content and 
clinical practice experiences are designed to sequentially 
develop, apply, critically analyze, integrate, synthesize 
and evaluate concepts and theories in the performance of 
radiologic procedures within the corresponding semester 
andnonenone"
2214,PRINCIPLES OF EXPOSURE,4,"Content 
establishes a knowledge base in technical factors that 
govern the image production process. Lecture . 
Prerequisite: RADnonenone"
2224,"RADIOGRAPHIC PROCEDURES AND IMAGE 
ANALYSIS II",4,"Content provides the 
knowledge base necessary to perform standard imaging 
procedures and special studies within the corresponding 
semester. Consideration is given to the evaluation of 
optimal diagnostic images. Content provides a basis for 
analyzing 
radiographic 
images. 
Included 
are 
the 
importance of optimal imaging standards, discussion of a 
problem-solving technique for image evaluation, and the 
factors than can affect image quality. Actual images will be 
included for analysis. Additionally this course establishes 
a knowledge base in radiography anatomy and physiology 
taught within the semester and will include a lab 
component. Components of the cells, tissues, organs and 
body systems are described and discussed. The 
fundamentals of sectional anatomy relative to routine 
radiography are addressed. Lecture , laboratorynonenone"
2224L,"RADIOGRAPHIC PROCEDURES AND IMAGE 
ANALYSIS II LAB",0,"LAB: Content provides the 
knowledge base necessary to perform standard imaging 
procedures and special studies within the corresponding 
semester. Consideration is given to the evaluation of 
optimal diagnostic images. Content provides a basis for 
analyzing 
radiographic 
images. 
Included 
are 
the 
importance of optimal imaging standards, discussion of a 
problem-solving technique for image evaluation, and the 
factors than can affect image quality. Actual images will be 
included for analysis. Additionally this course establishes 
a knowledge base in radiography anatomy and physiology 
taught within the semester and will include a lab 
component. Components of the cells, tissues, organs and 
body systems are described and discussed. The 
fundamentals of sectional anatomy relative to routine 
radiography are addressed. Lecture , laboratorynonenone"
2302,CLINICAL PRACTICE II,2,"Content and 
clinical practice experiences are designed to sequentially 
develop, apply, critically analyze, integrate, synthesize, 
and evaluate concepts and theories in the performance of 
  
 
 
radiologic procedures within the corresponding semester 
and 
Through 
structured, 
sequential, 
competency-based 
clinical assignments, concepts of team practice, patient-
centered clinical practice, and professional development 
are discussed, examined, and evaluated. Clinical practice 
experiences are designed to provide patient care and 
assessment, 
competent 
performance 
of 
radiologic 
imaging, and total quality management. Levels of 
competency and outcomes measurement will be taught to 
ensure the well-being of the patient prior to, during, and 
following the radiologic procedure. Clinical . 
Prerequisite: RADnonenone"
2311,"BASIC 
PRINCIPLES 
OF 
COMPUTED 
TOMOGRAPHY",1,"credit hour Content is designed to 
provide entry-level radiography students or radiologic 
technologists with an introduction to and basic 
understanding 
of 
the 
operation 
of 
a 
computed 
tomography (CT) device. Content is not intended to result 
in clinical competency, but when available, radiography 
programs with sufficient resources will provide students 
with clinical exposure to computed tomography. Lecturenonenone"
2323,"RADIOGRAPHIC PROCEDURES AND IMAGE 
ANALYSIS III",3,"Content provides the 
knowledge base necessary to perform standard imaging 
procedures and special studies within the corresponding 
semester. Consideration is given to the evaluation of 
optimal diagnostic images. Content provides a basis for 
analyzing 
radiographic 
images. 
Included 
are 
the 
importance of optimal imaging standards, discussion of a 
problem-solving technique for image evaluation, and the 
factors than can affect image quality. Actual images will be 
included for analysis. Additionally this course establishes 
a knowledge base in radiography anatomy and physiology 
taught within the semester and will include a lab 
component. Components of the cells, tissues, organs and 
body systems are described and discussed. The 
fundamentals of sectional anatomy relative to routine 
radiography are addressed. Lecture , laboratorynonenone"
2323L,"RADIOGRAPHIC PROCEDURES AND IMAGE 
ANALYSIS III LAB",0,"LAB: Content provides 
the knowledge base necessary to perform standard 
imaging procedures and special studies within the 
corresponding semester. Consideration is given to the 
evaluation of optimal diagnostic images. Content provides 
a basis for analyzing radiographic images. Included are 
the importance of optimal imaging standards, discussion 
of a problem-solving technique for image evaluation and 
the factors than can affect image quality. Actual images 
will be included for analysis. Additionally this course 
establishes a knowledge base in radiography anatomy and 
physiology taught within the semester and will include a 
lab component. Components of the cells, tissues, organs 
and body systems are described and discussed. The 
fundamentals of sectional anatomy relative to routine 
radiography are addressed. Lecture , laboratorynonenone"
2402,RADIOGRAPHIC PATHOLOGY,2,"Content introduces concepts related to disease and 
etiological considerations with emphasis on radiographic 
appearance of disease and impact on exposure factor 
selection. Lecture . Prerequisite: RADnonenone"
2414,CLINICAL PRACTICE III,4,"Content and 
clinical practice experiences are designed to sequentially 
develop, apply, critically analyze, integrate, synthesize, 
and evaluate concepts and theories in the performance of 
radiologic procedures within the corresponding semester 
and includes 
training. Through structured, sequential, competency-
based clinical assignments, concepts of team practice, 
patient-centered clinical practice and professional 
development are discussed, examined, and evaluated. 
Clinical practice experiences are designed to provide 
patient care and assessment, competent performance of 
radiologic imaging, and total quality management. Levels 
of competency and outcomes measurement will be taught 
to ensure the well-being of the patient prior to, during, 
and following the radiologic procedure. Clinical . 
Prerequisite: RADnonenone"
2422,DIGITAL IMAGE ACQUISITION AND DISPLAY,2,"Content imparts an understanding of the 
components, principles, and operation of digital imaging 
systems found in diagnostic radiology. Factors that impact 
image acquisition, display, archiving, and retrieval are 
discussed. Principles of digital system quality assurance 
and maintenance are presented. Lecture . 
Prerequisite: RADnonenone"
2434,"RADIOGRAPHIC PROCEDURES AND IMAGE 
ANALYSIS IV",4,"Content provides the 
knowledge base necessary to perform standard imaging 
procedures and special studies within the corresponding 
semester. Consideration is given to the evaluation of 
optimal diagnostic images. Content provides a basis for 
analyzing 
radiographic 
images. 
Included 
are 
the 
importance of optimal imaging standards, discussion of a 
problem-solving technique for image evaluation, and the 
factors than can affect image quality. Actual images will be 
included for analysis. Additionally this course establishes 
a knowledge base in radiography anatomy and physiology 
taught within the semester and will include a lab 
component. Components of the cells, tissues, organs and 
body systems are described and discussed. The 
fundamentals of sectional anatomy relative to routine 
  
 
 
radiography are addressed. Lecture , laboratorynonenone"
2434L,"RADIOGRAPHIC PROCEDURES AND IMAGE 
ANALYSIS IV LAB",0,"LAB: Content provides 
the knowledge base necessary to perform standard 
imaging procedures and special studies within the 
corresponding semester. Consideration is given to the 
evaluation of optimal diagnostic images. Content provides 
a basis for analyzing radiographic images. Included are 
the importance of optimal imaging standards, discussion 
of a problem-solving technique for image evaluation, and 
the factors than can affect image quality. Actual images 
will be included for analysis. Additionally this course 
establishes a knowledge base in radiography anatomy and 
physiology taught within the semester and will include a 
lab component. Components of the cells, tissues, organs 
and body systems are described and discussed. The 
fundamentals of sectional anatomy relative to routine 
radiography are addressed. Lecture , laboratorynonenone"
2503,CLINICAL PRACTICE IV,3,"Content and 
clinical practice experiences are designed to sequentially 
develop, apply, critically analyze, integrate, synthesize, 
and evaluate concepts and theories in the performance of 
radiologic procedures within the corresponding semester 
and includes 
training. Through structured, sequential, competency-
based clinical assignments, concepts of team practice, 
patient-centered clinical practice and professional 
development are discussed, examined, and evaluated. 
Clinical practice experiences are designed to provide 
patient care and assessment, competent performance of 
radiologic imaging, and total quality management. Levels 
of competency and outcomes measurement will be taught 
to ensure the well-being of the patient prior to, during, 
and following the radiologic procedure. Clinicalnonenone"
2513,RADIATION BIOLOGY AND PROTECTION,3,"Content provides an overview of the principles of 
interaction of radiation with living systems. Radiation 
effects on molecules, cells, tissues and the body as a whole 
are presented. Factors affecting biological response are 
presented, including acute and chronic effects of 
radiation. Content also presents an overview of the 
principles 
of 
radiation 
protection, 
including 
the 
responsibilities of the radiographer for 
patients, 
personnel, and the public. Radiation health and safety 
requirements of federal and state regulatory agencies, 
accreditation agencies, and health care organizations are 
incorporated. Lecture . Prerequisite: RADnonenone"
