code,title,credits,description
2013*,PRINCIPLES OF FINANCIAL ACCOUNTING,3,"Basic principles of financial accounting, 
including how to record transactions, prepare financial 
statements, analyze selected accounts and use accounting 
information in decision-making. Lecture . (Fall, 
Spring)nonenone"
2023*,PRINCIPLES OF COST/MANAGERIAL ACCOUNTING,3,"Basic principles of cost accounting related to manufacturing and other 
enterprises. Use of management and cost accounting 
information in decision-making. Lecture .nonenone"
3013,INTERMEDIATE ACCOUNTING I,3,"A 
review of the fundamental processes of accounting with 
an emphasis on the basic accounting process, procedures 
and working papers, statements, cash receivables, 
liabilities, and inventory pricing and planning. Lecturenonenone"
3113,FRAUD EXAMINATION,3,"A study of 
occupational fraud including the pressures that compel 
potential fraudsters to commit fraud, how fraudsters 
rationalize their fraudulent acts, and how they find access 
to business assets. In addition, students will gain in-depth 
understanding of internal controls necessary to prevent 
fraud and deter fraudsters. Lecture .nonenone"
3133,COST ACCOUNTING,3,"Cost accounting 
systems that assist management in planning, decision-
making and control. Cost-volume-profit analysis, cost 
behavior, standard job order and process costing, and 
inventory control using Just-in-Time analysis. Lecturenonenone"
1124,INTRODUCTION TO ANIMAL SCIENCE,4,"Species adaptability, product standards and 
requirements, areas and types of production, processing 
and distribution of products; (includes meat animals, 
dairy and poultry). Lecture , laboratory . 
Corequisite: AGRCnonenone"
1124L,INTRODUCTION TO ANIMAL SCIENCE LAB,0,"LAB: Species adaptability, product standards 
and requirements, areas and types of production, 
processing and distribution of products; (includes meat 
animals, dairy and poultry). Lecture , laboratorynonenone"
1214,INTRODUCTION TO PLANT SCIENCE,4,"Factors determining growth, distribution, culture, 
improvement and utilization of economic plants. Lecture 
, laboratory . Corequisite: AGRCnonenone"
1214L,INTRODUCTION TO PLANT SCIENCE LAB,0,"LAB: Factors determining growth, distribution, 
culture, improvement and utilization of economic plants. 
Lecture , laboratory . Corequisite: AGRCnonenone"
2013*,INTRODUCTION TO AGRICULTURAL ECONOMICS,3,"A study of economic principles 
as they relate to the national economy, production, 
marketing and consumption of agricultural products. 
Lecture . General Education, Economics. (Fall, 
Spring)nonenone"
2123,PRINCIPLES OF LIVESTOCK FEEDING,3,"An introductory study of livestock feeding 
problems. The selection and preparation of feeds for the 
different classes of livestock. Practical feeding methods, 
balancing rations for various livestock species. Lecturenonenone"
2124*,FUNDAMENTALS OF SOIL SCIENCE,4,"A general course dealing with the origin, chemical, 
physical, and biological properties of soils in relation to 
plant growth, engineering and environmental uses. 
Lecture , laboratory .nonenone"
3303,PRINCIPLES OF AGRICULTURAL MARKETING,3,"Analysis of the marketing system; its 
importance to the economy and the role of the individual 
firm. Understanding of basic cnonenone"
3413,FARM AND RANCH MANAGEMENT,3,"Production planning with budgeting, market planning, 
financial records, and income tax management for the 
individual farm-ranch business. Lecture .nonenone"
3513,PRINCIPLES OF AGRICULTURAL MANAGEMENT,3,"An introduction to fundamental concepts 
associated with management of agribusiness firms, 
including finance, management, marketing and human 
resources. Special emphasis will be placed on the 
development of business plans. Computer applications 
and simulations will be utilized to model performance of 
agribusiness firms.nonenone"
3613,AGRICULTURAL AND FOOD POLICY,3,"Applications of economic principles to policy analysis 
related to agricultural and food issues facing the United 
States and the world. Includes study of the nature, causes, 
and effects of governmental participation in agriculture, 
and the interrelationships of the American agricultural 
and agribusiness sectors with the political and economic 
system, public administration, and interest group 
representation.nonenone"
3813,PRECISION AGRICULTURE,3,"Principles of acquisition and analysis of geographically 
referenced data for the management of crop and livestock 
production systems. Topics include: mapping, global 
positioning systems, geographic information systems, 
crop modeling, livestock monitoring, applications of 
technology including fixed wing, single rotor, and multi-
rotor drones, and selection of appropriate sensor systems. 
Field trips are an integral and required part of the course. 
Lecture .nonenone"
4223,INTEGRATED PEST MANAGEMENT,3,"Management of pests in agricultural situations. Topics 
include fundamentals of pest management, selection and 
safe use of herbicides and insecticides, control of weedy 
species, insect species, rodents, and nuisance wildlife, and 
regulatory agency considerations. Lecture . Independent study based on the review of 
literature, laboratory problems, or field investigations. 
Independent study : Junior or 
Senior standing.nonenone"
4333,AGRICULTURAL FINANCE,3,"An 
introduction to the planning, analyzing and controlling of 
business performance in agriculture and on the related 
financial markets. The topics covered include financial 
statements, capital structure, capital budgeting, financial 
markets, and commercial lending for farms and ranches 
as well as for agribusiness firms. Special emphasis will be 
placed on liquidity and credit, risk management, financial 
intermediaries, and outside equity capital. Lecturenonenone"
4572,AGRICULTURAL CAPSTONE,2,"Required capstone course in the agriculture major. 
Designed to bring reflection and focus to the whole of the 
university experience and to encourage students to 
integrate and synthesize aspects of agriculture with 
important concepts from related disciplines. Provides 
resources for careers, professional programs, and 
graduate school. Includes required program assessment. 
Capstone/Lecture .nonenone"
3213,"FORAGE, RANGE, AND PASTURE CROPS",3,"Principles of production management, utilization, 
and improvement of forages for livestock. Lecture .nonenone"
3312,CROP SCIENCE LABORATORY,2,"LAB: 
Application of principles of field crop science in 
laboratory and field to include seed and plant 
identification, implement calibration, and field research 
techniques. Laboratory .nonenone"
3434*,"SOIL MORPHOLOGY, GENESIS, AND CLASSIFICATION",4,"Taxonomy of Soils. A study of the internal differentiating characteristics of soils 
and their causal processes; the U. S. comprehensive 
system of soil classification; soil survey techniques. 
Lecture , laboratory .nonenone"
4673,GRAIN CROPS,3,"Principles of grain 
crop production, classification, and improvement. Lecture 
. 
ALBANIAN (ALBN) 
Communication, English, and Foreign Languagesnonenone"
4153*,INTENSIVE STUDIES IN ALBANIAN,3,"An intensive introductory study of Albanian combining 
guided independent study of the written language with 
regular oral practice of the spoken language. Two hours 
independent study, one hour lab. and six hours study of another foreign language or 
permission of the department. 
ALLIED HEALTH SCIENCES (AHS) 
Agriculture, Biology, and Health Sciencesnonenone"
1003,INTRODUCTION TO PUBLIC HEALTH,3,"Introduction to Public Health introduces the major 
concepts and principles of public health and the options 
for intervention to promote health and prevent disease. It 
is not applicable to the Biology major or minor. Lecturenonenone"
3103L,LIVESTOCK EVALUATION LAB,0,"LAB: Instruction in selection, evaluating, fitting, showing, 
and judging of multiple species of commercial livestock. 
Lecture , laboratorynonenone"
3133,BREEDS OF LIVESTOCK,3,"Study of the 
origin, history, development and characteristics of 
livestock breeds and of the specific purposes of each 
breed. Lecture .nonenone"
3143,EQUINE SCIENCE,3,"Scientific principles 
of equine anatomy, physiology, genetics, reproduction, 
breeding, nutrition, and health; current management 
practices based on these principles. Overview of the 
equine industry including career choices. Lecture . 
Prerequisite: AGRCnonenone"
3653,PRINCIPLES OF ANIMAL NUTRITION,3,"Principles of animal nutrition including 
composition, characteristics, digestion, absorption, and 
metabolism of various feedstuffs and ration additives, 
qualitative and quantitative nutrient requirements of 
each of the classes of livestock, formulation of rations for 
each of the classes of livestock. Lecture .nonenone"
4113,BEEF CATTLE SCIENCE,3,"Application 
of scientific principles and recent advances to the 
production, feeding, breeding, management, and 
marketing of commercial and purebred cattle. Lecture , laboratory .nonenone"
4113L,BEEF CATTLE SCIENCE LAB,0,"LAB: 
Application of scientific principles and recent advances to 
the production, feeding, breeding, management, and 
marketing of commercial and purebred cattle. Lecturenonenone"
4123L,SWINE SCIENCE LAB,0,"LAB: The 
application of genetics, physiological, nutritional and 
engineering principles to the efficient production of 
swine. Swine evaluation and marketing. Lecture , 
laboratory . Prerequisites AGRCnonenone"
4133,SHEEP SCIENCE,3,"Breeding, feeding, 
management, and marketing of commercial and purebred 
sheep. Lecture , laboratory . AGRCnonenone"
4133L,SHEEP SCIENCE LAB,0,"LAB: Breeding, 
feeding, management, and marketing of commercial and 
purebred sheep. Lecture , laboratory .nonenone"
4333*,PHYSIOLOGY OF DOMESTIC ANIMALS,3,"The comparative physiology of digestion, 
circulation, production, reproduction and environment of 
farm animals. Lecture .nonenone"
4423,LIVESTOCK DISEASES AND SANITATION,3,"The recognition and study of common diseases and 
parasitic infestations together with their prevention and 
control in domestic animals. Lecture . 
Prerequisite: AGRCnonenone"
4434,ANIMAL REPRODUCTION,4,"Physiological processes of reproduction in farm animals, 
gonadal function, endocrine relationships, fertility, and 
factors affecting reproduction efficiency. Emphasis is 
given to principles of artificial insemination in the 
laboratory. Lecture , laboratory . 
Prerequisite: AGRCnonenone"
4434L,ANIMAL REPRODUCTION LAB,0,"LAB: Physiological processes of reproduction in farm 
animals, gonadal function, endocrine relationships, 
fertility, and factors affecting reproduction efficiency. 
Emphasis is given to principles of artificial insemination 
in the laboratory. Lecture , laboratory . 
Prerequisite: AGRCnonenone"
1113*,BEGINNING MODERN STANDARD ARABIC I,3,"An introductory course in the language and 
culture of Arabic-speaking countries. Lecture . 
General Education, Humanities–Diversity. (Fall)nonenone"
1223*,BEGINNING MODERN STANDARD ARABIC II,3,Continuation of ARBCnonenone
2113*,INTERMEDIATE MODERN STANDARD ARABIC I,3,"An intermediate course in the language and 
culture of the Arabic-speaking countries. Lecture . 
Prerequisite: ARBCnonenone"
2223*,INTERMEDIATE MODERN STANDARD ARABIC II,3,Continuation of ARBCnonenone
3113*,ADVANCED MODERN STANDARD ARABIC I,3,"An advanced course in the language and 
culture of the Arabic-speaking countries. Lecture . 
Prerequisite: ARBCnonenone"
3223*,ADVANCED MODERN STANDARD ARABIC II,3,A continuation of ARBCnonenone
4961-3*,DIRECTED READINGS IN MODERN STANDARD ARABIC,1-3,"This course 
provides an opportunity for students to work on 
individualized topics in Arabic language, linguistics, and 
literature. Course may be repeated to a total of six hours 
with departmental permission. Independent 
study/directed readings : ARBCnonenone"
1013*,ART APPRECIATION,3,"An introduction to various aspects of the visual arts with 
illustrated lectures and studio demonstrations. Lecturenonenone"
1023*,FUNDAMENTALS OF ART,3,"An 
introduction to art through studio experience for non-
majors. Studio .nonenone"
1031-3,WORKSHOP,3,"A concentrated 
course of specific exploration at the introductory level of 
various art forms, designed to provide intensive 
experience in studio projects. May be repeated for credit 
under different subtitle. No more than  of ARTnonenone"
1113*,DRAWING I,3,"Introduction to the 
basic principles, techniques and media of 
drawing/perception. Studio . (Fall)nonenone"
1123,DRAWING II,3,"Drawing experiences 
that coordinate drawing skills with perception and 
creativity. Studio . Prerequisite: ARTnonenone"
1213*,DESIGN I,3,"An introductory class 
concentrating on two and three dimensional forms which 
emphasizes design elements and their organizational 
principles. Studio . (Fall)nonenone"
1223,DESIGN II,3,"Application and analysis of 
three-dimensional elements and principles of design. 
Studio . (Spring)nonenone"
1231,COMPUTER-STUDIO LAB,1,"credit hour An 
introduction to computer graphics and appropriate 
software for use in foundation studio art courses. For Art 
majors only. Studio  per week. (Fall)nonenone"
2243*,COLOR,3,"Exploration and analysis of 
color. Studio . (Fall)nonenone"
2253,COMPUTER GRAPHIC DESIGN,3,"An 
introduction to the processes of creatively translating 
concepts from words to effective visual communication 
through graphic design, layout, and technical illustration. 
Studio  per week.nonenone"
2313,PAINTING,3,"Painting courses exploring 
the principles, techniques, media and creative potential of 
painting. Studio .nonenone"
2413,PRINTMAKING,3,"An introduction to 
various basic printmaking processes: collagraphs, 
monoprints, intaglio, serigraphy, lithography, relief 
printing. Studio . Prerequisite: ARTnonenone"
2513,SCULPTURE,3,"A beginning class that 
emphasizes sculptural form and aesthetics through 
various media and techniques. Studio . 
Prerequisite: ARTnonenone"
2613*,HISTORY OF ART I,3,"A survey of the 
painting, sculpture and architecture from prehistoric 
times through the Gothic period. Lecture . General 
Education, Humanities–Aesthetics. (Fall)nonenone"
2623*,HISTORY OF ART II,3,"A survey of the 
painting, sculpture and architecture from the Renaissance 
through the  Century. Lecture . General 
Education, Humanities–Aesthetics. (Spring)nonenone"
2733,ILLUSTRATION,3,"Introduction to 
historic and contemporary illustration and consideration 
of a wide range of illustrative styles. Required 
experiments with media and consideration of alternate 
ways of illustrating a message through conceptual and 
compositional variations. Studio . ARTnonenone"
2743,TYPOGRAPHY,3,"An investigation of 
letter forms and their characteristics and a study of 
spacing, leading, type selection, layout alternatives, type 
specification and copy fitting. Preliminary introduction to 
typography as a communication medium. An understanding to 
typographic terminology and 
measuring systems while developing hand skills and 
introducing computer technology. Studio .nonenone"
2813,BEGINNING CERAMICS,3,"Introduction 
to ceramic techniques, with focus on exploration, ideas, 
and the aesthetics of form. Studio .nonenone"
3133,FIGURE DRAWING,3,"An introduction 
to drawing the figure from direct observation. Emphasis 
on a variety of traditional drawing media and techniques. 
Studio  per week.  Prerequisite: ARTnonenone"
3213,GRAPHIC DESIGN,3,"Exploration of 
basic design principles-line, form and color, as visual 
communication. Problem solving, generation of ideas, 
development of concepts and the integration of word and 
image. Technical and presentation skills. Studio . 
Prerequisite: ARTnonenone"
3713,ART FOR ELEMENTARY TEACHERS,3,"Lecture and laboratory experience in two and three 
dimensional media designed for the understanding and 
application of art as an element of the elementary 
curriculum. Lecture/studio .nonenone"
3723,PUBLIC SCHOOL ART,3,"Elementary 
and Secondary theory in two and three dimensional 
media designed for the application and understanding of 
art as an element of the school curriculum with lecture 
laboratory and field experience. Teacher Certification 
students must be admitted to teacher education prior to 
enrollment. Studio .nonenone"
3743,"ADVANCED COMPUTER GRAPHICS AND IMAGE 
ENHANCEMENT",3,"Use of computer software 
(primarily Photoshop) to capture, create and alter 
electronic images for use in graphic design and 
illustration applications with an emphasis on concept and 
thematic development. Skillful production of portfolio 
pieces via learned software. Studio . Prerequisite: 
ARTnonenone"
3753,LAYOUT/PRODUCTION,3,"Use of 
computer and traditional methods to enhance production 
skills and solution of design projects from concept to the 
comprehensive. Evaluation and design of symbols and 
ogos and their various applications, leading to an 
understanding of system design. Introduction to graphic 
design production and the preparation of art for 
reproduction. Studio . ARTnonenone"
3833,CRAFTS,3,"A studio course that relates 
material to form and function, with an emphasis on one of 
several materials: weaving, beadwork, textiles, etc. May 
be repeated under a different subtitle. No more thannonenone"
4143,ADVANCED DRAWING,3,"Advanced 
studio courses exploring the principles, techniques, media 
and creative potential of drawing. May be repeated for 
credit under a different subtitle. Studio . 
Prerequisite: ARTnonenone"
4213,ADVANCED GRAPHIC DESIGN,3,"Design problems with special attention to signage, 
exhibition design, packaging, display, and point of 
purchase. Use of model-building tools and study of 
structure and form to introduce the student to problem-
solving and finishing techniques. Development of 
concepts into models. Studio . Prerequisite: ARTnonenone"
4323,ADVANCED PAINTING I: TRADITIONAL PAINTING TECHNIQUES,3,"Students will continue to apply and further refine the traditional oil 
painting techniques learned in ARTnonenone"
4333,"ADVANCED PAINTING II: CONTEMPORARY 
PAINTING TECHNIQUES",3,"Students will 
explore and experiment with contemporary oil and/or 
acrylic painting techniques. This may include creative and 
inventive use of traditional materials as well as use of 
nontraditional surfaces, mixed media, collage, and 
expanded form painting. Studio .  Prerequisite: 
ARTnonenone"
4343,"ADVANCED PAINTING III: SUBJECT MATTER 
EXPLORATION",3,"Students will focus on the 
creative exploration of personal subject matter using oil 
and/or acrylic paint. Subject matter may include portraits, 
the figure, still life, landscape, and interiors. Students will 
continue to refine their painting techniques in relation to 
their subject matter. Students will research historical and 
contemporary genres in painting. Studio . 
Prerequisite: ARTnonenone"
4353,ADVANCED PAINTING IV: STYLE EXPLORATION,3,"Students will explore a variety of painting 
styles using oil and/or acrylic paint. Styles may include 
realism, abstraction, surrealism, and narrative painting. 
Students will research artists working in a variety of 
historical and contemporary styles. Emphasis is placed on 
the union of style with personal subject matter. Studiononenone"
4363,"ADVANCED PAINTING V: PAINTING THESIS 
INTRODUCTION",3,"Students will develop a 
series of related oil and/or acrylic paintings 
demonstrating creativity and a personal aesthetic and 
direction in painting. Emphasis is placed on the 
development of a unique concept and the application of 
technique, design, style, and subject matter in relation to 
concept. Students will also complete in-depth formal and 
critical analyses of their paintings. Paintings created in 
this course will be part of the student's senior art 
exhibition. Required for all BFA majors with a painting 
concentration. Studio . Prerequisite: ARTnonenone"
4373,"ADVANCED PAINTING V: PAINTING THESIS 
CONCLUSION",3,"Students will continue to 
develop and refine a series of related paintings as well as 
an artist statement in preparation for their senior art 
exhibition. Continued focus is on the development of 
paintings that demonstrate a unique concept and mature 
vision enhanced by creative use of subject matter, skilled 
paint application, and sophisticated design skills. Students 
will also complete in-depth formal and critical analyses of 
their paintings. Required for all BFA majors with a 
painting concentration. Studio . Prerequisite: ARTnonenone"
4383,ADVANCED PAINTING: TRADITIONAL WATERCOLOR,3,"Students will explore the 
techniques and traditional methods of watercolors on 
paper. Subject matter will include landscapes, plein air 
painting, portraits, the figure, still life, and a variety of 
color mixing charts related to subject. Studio . 
Prerequisite: ARTnonenone"
4393,ADVANCED PAINTING: CONTEMPORARY WATERCOLOR,3,"Students will focus on experimentation and personal expression of subject 
matter using watercolor on traditional or nontraditional 
surfaces. Students will continue to refine their painting 
techniques in relation to their concept. Studio . 
Prerequisite: ARTnonenone"
4423,ADVANCED PRINTMAKING I,3,"Students will be introduced to various advanced 
techniques in printmaking methods which will include 
stone lithography, serigraphy, relief, 
and monoprints/monotype. Emphasis will be placed on 
learning and understanding the many techniques of 
printmaking. Students are required to take this course for 
a concentration in printmaking. Studio . 
Prerequisite: ARTnonenone"
4433,ADVANCED PRINTMAKING II: WOODCUT,3,"Students will focus on the techniques and methods 
of woodcut. Emphasis will be placed on learning to carve, 
matrix registration, and applying color to the block while 
simultaneously developing personal imagery. Students 
will learn how to create a consistent edition. Studiononenone"
4443,ADVANCED PRINTMAKING III: SERIGRAPHY,3,"Students will focus on the techniques and 
methods of screen printing. Emphasis will be placed on 
how to prepare and print a screen print with equal 
attention to personal imagery. Students will learn how to 
create a consistent edition. Studio . Prerequisite: ARTnonenone"
4453,ADVANCED PRINTMAKING IV: MONOPRINT/MONOTYPE,3,"Students will focus on developing personal imagery using painting and 
printmaking techniques. Drypoint, collograph, and 
painting will be utilized in developing one of a kind images 
and personal imagery. Studio . Prerequisite: ARTnonenone"
4463,ADVANCED PRINTMAKING V: RELIEF LINOCUT,3,"Students will continue to explore relief 
printing using a linoleum matrix. Reduction and additive 
methods will be used to create personal imagery. Students 
will learn how to create a consistent edition. Studiononenone"
4473,"ADVANCED PRINTMAKING VI: LITHOGRAPHY 
AND RELIEF",3,"Students will continue to 
develop and explore the techniques of stone lithography 
and relief printing. Students will learn how to create a 
consistent color edition. Studio . Prerequisite: ARTnonenone"
4483,ADVANCED PRINTMAKING VII: LITHOGRAPHY,3,"Students will focus on the techniques and 
methods of stone lithography. Emphasis will be placed on 
learning the chemical etching process and developing 
personal imagery. Students will learn how to create a 
consistent edition. Studio . Prerequisite: ARTnonenone"
4523,"ADVANCED SCULPTURE I: WELDING, ASSEMBLAGE, CARVING",3,"Advanced studio course emphasizing safe studio practices and the personal 
exploration of sculptural forms and materials. Students 
will learn advanced skills to create sculpture using the 
techniques of oxy-acetylene welding, arc stick welding, 
wood-assemblage, wood carving, and hand building in 
clay. Studio . Prerequisite: ARTnonenone"
4533,"ADVANCED SCULPTURE II: TIG WELDING AND 
HAND BUILDING CLAY",3,"Advanced studio 
course emphasizing safe studio practices and the personal 
exploration of sculptural forms and materials. Students 
will engage in self-directed image making and create 
personal sculptural expressions for their portfolio. Studio 
workshop skills using advanced techniques of TIG 
welding and hand building in clay will be developed. 
Studio . Prerequisite: ARTnonenone"
4543,"ADVANCED SCULPTURE III: SPECIAL PROBLEMS 
IN WELDING, WOOD, AND CLAY",3,"Advanced 
studio course emphasizing safe studio practices and the 
personal exploration of sculptural forms and materials. 
Students will engage in special problems in sculpture. 
Each student will design an original sculpture and 
construct an advanced portfolio of their work. Studio 
workshop skills will build upon the advanced techniques 
of TIG welding, arc welding, plasma arc cutting, and oxy-
acetylene welding in addition to further development of 
their advanced skills in woodworking and clay 
construction. Studio . Prerequisite: ARTnonenone"
4553,"ADVANCED SCULPTURE IV: TIME BASED MEDIA, 
ASSEMBLAGE, CARVING, CASTING, OR MODELING",3,"Advanced studio course emphasizing safe 
studio practices and the personal exploration of 
sculptural forms and materials. Students will engage in 
new forms of sculpture. Each student will design original 
sculpture and construct advanced portfolios of their work 
using a variety of new materials including time-based 
media. Studio workshop skills will be stressed in all 
sculpture media and include works that are carved, 
assembled, cast, or modeled. Studio . Prerequisite: ARTnonenone"
4563,ADVANCED SCULPTURE V: PUBLIC INSTALLATION SCULPTURE,3,"Advanced studio course emphasizing safe studio practices and the 
personal exploration of sculptural forms and materials. 
Students will engage in new forms of sculpture. Each 
student will design original sculpture for public display. 
Studio . Prerequisite: ARTnonenone"
